tcpdump: verbose output suppressed, use -v[v]... for full protocol decode
listening on enp0s8, link-type EN10MB (Ethernet), snapshot length 262144 bytes
00:13:36.411970 IP 192.168.1.74.36908 > 192.168.1.45.5005: Flags [S], seq 863949485, win 64240, options [mss 1460,sackOK,TS val 3247255558 ecr 0,nop,wscale 6], length 0
00:13:36.411993 IP 192.168.1.45.5005 > 192.168.1.74.36908: Flags [S.], seq 572937286, ack 863949486, win 65160, options [mss 1460,sackOK,TS val 2039948237 ecr 3247255558,nop,wscale 6], length 0
00:13:36.412102 IP 192.168.1.74.36908 > 192.168.1.45.5005: Flags [.], ack 1, win 1004, options [nop,nop,TS val 3247255558 ecr 2039948237], length 0
00:13:36.412735 IP 192.168.1.74.36908 > 192.168.1.45.5005: Flags [P.], seq 1:5, ack 1, win 1004, options [nop,nop,TS val 3247255559 ecr 2039948237], length 4
00:13:36.412749 IP 192.168.1.45.5005 > 192.168.1.74.36908: Flags [.], ack 5, win 1019, options [nop,nop,TS val 2039948238 ecr 3247255559], length 0
00:13:36.413008 IP 192.168.1.45.5005 > 192.168.1.74.36908: Flags [P.], seq 1:3, ack 5, win 1019, options [nop,nop,TS val 2039948238 ecr 3247255559], length 2
00:13:36.413123 IP 192.168.1.74.36908 > 192.168.1.45.5005: Flags [.], ack 3, win 1004, options [nop,nop,TS val 3247255559 ecr 2039948238], length 0
00:13:36.413159 IP 192.168.1.74.36908 > 192.168.1.45.5005: Flags [P.], seq 5:7245, ack 3, win 1004, options [nop,nop,TS val 3247255559 ecr 2039948238], length 7240
00:13:36.413159 IP 192.168.1.74.36908 > 192.168.1.45.5005: Flags [.], seq 7245:10141, ack 3, win 1004, options [nop,nop,TS val 3247255559 ecr 2039948238], length 2896
00:13:36.413238 IP 192.168.1.74.36908 > 192.168.1.45.5005: Flags [P.], seq 10141:14485, ack 3, win 1004, options [nop,nop,TS val 3247255559 ecr 2039948238], length 4344
00:13:36.413641 IP 192.168.1.74.36908 > 192.168.1.45.5005: Flags [R.], seq 14485, ack 3, win 1004, options [nop,nop,TS val 3247255560 ecr 2039948238], length 0

11 packets captured
11 packets received by filter
0 packets dropped by kernel
