tcpdump: verbose output suppressed, use -v[v]... for full protocol decode
listening on enp0s8, link-type EN10MB (Ethernet), snapshot length 262144 bytes
00:27:34.680341 IP 192.168.1.74.50092 > 192.168.1.45.5005: Flags [S], seq 3473386117, win 64240, options [mss 1460,sackOK,TS val 3248093861 ecr 0,nop,wscale 6], length 0
00:27:34.680364 IP 192.168.1.45.5005 > 192.168.1.74.50092: Flags [S.], seq 3124953009, ack 3473386118, win 65160, options [mss 1460,sackOK,TS val 2040786505 ecr 3248093861,nop,wscale 6], length 0
00:27:34.680677 IP 192.168.1.74.50092 > 192.168.1.45.5005: Flags [.], ack 1, win 1004, options [nop,nop,TS val 3248093861 ecr 2040786505], length 0
00:27:34.681050 IP 192.168.1.74.50092 > 192.168.1.45.5005: Flags [P.], seq 1:5, ack 1, win 1004, options [nop,nop,TS val 3248093862 ecr 2040786505], length 4
00:27:34.681060 IP 192.168.1.45.5005 > 192.168.1.74.50092: Flags [.], ack 5, win 1019, options [nop,nop,TS val 2040786506 ecr 3248093862], length 0
00:27:34.681307 IP 192.168.1.45.5005 > 192.168.1.74.50092: Flags [P.], seq 1:3, ack 5, win 1019, options [nop,nop,TS val 2040786506 ecr 3248093862], length 2
00:27:34.681627 IP 192.168.1.74.50092 > 192.168.1.45.5005: Flags [.], ack 3, win 1004, options [nop,nop,TS val 3248093862 ecr 2040786506], length 0
00:27:34.681627 IP 192.168.1.74.50092 > 192.168.1.45.5005: Flags [P.], seq 5:7245, ack 3, win 1004, options [nop,nop,TS val 3248093862 ecr 2040786506], length 7240
00:27:34.681627 IP 192.168.1.74.50092 > 192.168.1.45.5005: Flags [P.], seq 7245:14485, ack 3, win 1004, options [nop,nop,TS val 3248093862 ecr 2040786506], length 7240
00:27:34.681897 IP 192.168.1.74.50092 > 192.168.1.45.5005: Flags [R.], seq 14485, ack 3, win 1004, options [nop,nop,TS val 3248093862 ecr 2040786506], length 0

10 packets captured
10 packets received by filter
0 packets dropped by kernel
