tcpdump: verbose output suppressed, use -v[v]... for full protocol decode
listening on enp0s8, link-type EN10MB (Ethernet), snapshot length 262144 bytes
01:15:57.151708 IP 192.168.1.74.46542 > 192.168.1.45.5005: Flags [S], seq 3660531979, win 64240, options [mss 1460,sackOK,TS val 736405791 ecr 0,nop,wscale 6], length 0
01:15:57.151733 IP 192.168.1.45.5005 > 192.168.1.74.46542: Flags [S.], seq 2410762589, ack 3660531980, win 65160, options [mss 1460,sackOK,TS val 2131907815 ecr 736405791,nop,wscale 6], length 0
01:15:57.151877 IP 192.168.1.74.46542 > 192.168.1.45.5005: Flags [.], ack 1, win 1004, options [nop,nop,TS val 736405791 ecr 2131907815], length 0
01:15:57.152544 IP 192.168.1.74.46542 > 192.168.1.45.5005: Flags [P.], seq 1:5, ack 1, win 1004, options [nop,nop,TS val 736405792 ecr 2131907815], length 4
01:15:57.152555 IP 192.168.1.45.5005 > 192.168.1.74.46542: Flags [.], ack 5, win 1019, options [nop,nop,TS val 2131907816 ecr 736405792], length 0
01:15:57.152798 IP 192.168.1.45.5005 > 192.168.1.74.46542: Flags [P.], seq 1:3, ack 5, win 1019, options [nop,nop,TS val 2131907816 ecr 736405792], length 2
01:15:57.153112 IP 192.168.1.74.46542 > 192.168.1.45.5005: Flags [.], ack 3, win 1004, options [nop,nop,TS val 736405793 ecr 2131907816], length 0
01:15:57.153150 IP 192.168.1.74.46542 > 192.168.1.45.5005: Flags [P.], seq 5:7245, ack 3, win 1004, options [nop,nop,TS val 736405793 ecr 2131907816], length 7240
01:15:57.153150 IP 192.168.1.74.46542 > 192.168.1.45.5005: Flags [.], seq 7245:10141, ack 3, win 1004, options [nop,nop,TS val 736405793 ecr 2131907816], length 2896
01:15:57.153185 IP 192.168.1.74.46542 > 192.168.1.45.5005: Flags [P.], seq 10141:14485, ack 3, win 1004, options [nop,nop,TS val 736405793 ecr 2131907816], length 4344
01:15:57.153650 IP 192.168.1.74.46542 > 192.168.1.45.5005: Flags [R.], seq 14485, ack 3, win 1004, options [nop,nop,TS val 736405793 ecr 2131907816], length 0

11 packets captured
11 packets received by filter
0 packets dropped by kernel
