tcpdump: verbose output suppressed, use -v[v]... for full protocol decode
listening on enp0s8, link-type EN10MB (Ethernet), snapshot length 262144 bytes
02:12:19.179094 IP 192.168.1.74.44214 > 192.168.1.45.5005: Flags [S], seq 1047082121, win 64240, options [mss 1460,sackOK,TS val 223735192 ecr 0,nop,wscale 6], length 0
02:12:19.179118 IP 192.168.1.45.5005 > 192.168.1.74.44214: Flags [S.], seq 135516346, ack 1047082122, win 65160, options [mss 1460,sackOK,TS val 1988694516 ecr 223735192,nop,wscale 6], length 0
02:12:19.179284 IP 192.168.1.74.44214 > 192.168.1.45.5005: Flags [.], ack 1, win 1004, options [nop,nop,TS val 223735193 ecr 1988694516], length 0
02:12:19.179870 IP 192.168.1.74.44214 > 192.168.1.45.5005: Flags [P.], seq 1:5, ack 1, win 1004, options [nop,nop,TS val 223735193 ecr 1988694516], length 4
02:12:19.179883 IP 192.168.1.45.5005 > 192.168.1.74.44214: Flags [.], ack 5, win 1019, options [nop,nop,TS val 1988694517 ecr 223735193], length 0
02:12:19.180100 IP 192.168.1.45.5005 > 192.168.1.74.44214: Flags [P.], seq 1:3, ack 5, win 1019, options [nop,nop,TS val 1988694517 ecr 223735193], length 2
02:12:19.180201 IP 192.168.1.74.44214 > 192.168.1.45.5005: Flags [.], ack 3, win 1004, options [nop,nop,TS val 223735194 ecr 1988694517], length 0
02:12:19.180327 IP 192.168.1.74.44214 > 192.168.1.45.5005: Flags [P.], seq 5:7245, ack 3, win 1004, options [nop,nop,TS val 223735194 ecr 1988694517], length 7240
02:12:19.180327 IP 192.168.1.74.44214 > 192.168.1.45.5005: Flags [.], seq 7245:11589, ack 3, win 1004, options [nop,nop,TS val 223735194 ecr 1988694517], length 4344
02:12:19.180369 IP 192.168.1.74.44214 > 192.168.1.45.5005: Flags [P.], seq 11589:14485, ack 3, win 1004, options [nop,nop,TS val 223735194 ecr 1988694517], length 2896
02:12:19.180653 IP 192.168.1.74.44214 > 192.168.1.45.5005: Flags [R.], seq 14485, ack 3, win 1004, options [nop,nop,TS val 223735194 ecr 1988694517], length 0

11 packets captured
11 packets received by filter
0 packets dropped by kernel
