tcpdump: verbose output suppressed, use -v[v]... for full protocol decode
listening on enp0s8, link-type EN10MB (Ethernet), snapshot length 262144 bytes
00:14:07.586795 IP 192.168.1.74.48738 > 192.168.1.45.5005: Flags [S], seq 1384021820, win 64240, options [mss 1460,sackOK,TS val 3247286732 ecr 0,nop,wscale 6], length 0
00:14:07.586817 IP 192.168.1.45.5005 > 192.168.1.74.48738: Flags [S.], seq 2275069039, ack 1384021821, win 65160, options [mss 1460,sackOK,TS val 2039979412 ecr 3247286732,nop,wscale 6], length 0
00:14:07.587016 IP 192.168.1.74.48738 > 192.168.1.45.5005: Flags [.], ack 1, win 1004, options [nop,nop,TS val 3247286733 ecr 2039979412], length 0
00:14:07.587109 IP 192.168.1.74.48738 > 192.168.1.45.5005: Flags [P.], seq 1:5, ack 1, win 1004, options [nop,nop,TS val 3247286733 ecr 2039979412], length 4
00:14:07.587115 IP 192.168.1.45.5005 > 192.168.1.74.48738: Flags [.], ack 5, win 1019, options [nop,nop,TS val 2039979412 ecr 3247286733], length 0
00:14:07.587171 IP 192.168.1.45.5005 > 192.168.1.74.48738: Flags [P.], seq 1:3, ack 5, win 1019, options [nop,nop,TS val 2039979412 ecr 3247286733], length 2
00:14:07.587230 IP 192.168.1.74.48738 > 192.168.1.45.5005: Flags [.], ack 3, win 1004, options [nop,nop,TS val 3247286733 ecr 2039979412], length 0
00:14:07.587325 IP 192.168.1.74.48738 > 192.168.1.45.5005: Flags [P.], seq 5:7245, ack 3, win 1004, options [nop,nop,TS val 3247286733 ecr 2039979412], length 7240
00:14:07.587325 IP 192.168.1.74.48738 > 192.168.1.45.5005: Flags [.], seq 7245:8693, ack 3, win 1004, options [nop,nop,TS val 3247286733 ecr 2039979412], length 1448
00:14:07.587361 IP 192.168.1.74.48738 > 192.168.1.45.5005: Flags [P.], seq 8693:9221, ack 3, win 1004, options [nop,nop,TS val 3247286733 ecr 2039979412], length 528
00:14:07.587410 IP 192.168.1.74.48738 > 192.168.1.45.5005: Flags [R.], seq 9221, ack 3, win 1004, options [nop,nop,TS val 3247286733 ecr 2039979412], length 0
00:14:07.587412 IP 192.168.1.45.5005 > 192.168.1.74.48738: Flags [.], ack 8693, win 884, options [nop,nop,TS val 2039979412 ecr 3247286733], length 0
00:14:07.587521 IP 192.168.1.74.48738 > 192.168.1.45.5005: Flags [R], seq 1384030513, win 0, length 0

13 packets captured
13 packets received by filter
0 packets dropped by kernel
