tcpdump: verbose output suppressed, use -v[v]... for full protocol decode
listening on enp0s8, link-type EN10MB (Ethernet), snapshot length 262144 bytes
00:28:01.914568 IP 192.168.1.74.33440 > 192.168.1.45.5005: Flags [S], seq 1311020557, win 64240, options [mss 1460,sackOK,TS val 3248121095 ecr 0,nop,wscale 6], length 0
00:28:01.914590 IP 192.168.1.45.5005 > 192.168.1.74.33440: Flags [S.], seq 895837165, ack 1311020558, win 65160, options [mss 1460,sackOK,TS val 2040813740 ecr 3248121095,nop,wscale 6], length 0
00:28:01.914806 IP 192.168.1.74.33440 > 192.168.1.45.5005: Flags [.], ack 1, win 1004, options [nop,nop,TS val 3248121095 ecr 2040813740], length 0
00:28:01.914806 IP 192.168.1.74.33440 > 192.168.1.45.5005: Flags [P.], seq 1:5, ack 1, win 1004, options [nop,nop,TS val 3248121095 ecr 2040813740], length 4
00:28:01.914830 IP 192.168.1.45.5005 > 192.168.1.74.33440: Flags [.], ack 5, win 1019, options [nop,nop,TS val 2040813740 ecr 3248121095], length 0
00:28:01.914933 IP 192.168.1.45.5005 > 192.168.1.74.33440: Flags [P.], seq 1:3, ack 5, win 1019, options [nop,nop,TS val 2040813740 ecr 3248121095], length 2
00:28:01.915088 IP 192.168.1.74.33440 > 192.168.1.45.5005: Flags [.], ack 3, win 1004, options [nop,nop,TS val 3248121095 ecr 2040813740], length 0
00:28:01.915088 IP 192.168.1.74.33440 > 192.168.1.45.5005: Flags [P.], seq 5:7245, ack 3, win 1004, options [nop,nop,TS val 3248121095 ecr 2040813740], length 7240
00:28:01.915088 IP 192.168.1.74.33440 > 192.168.1.45.5005: Flags [P.], seq 7245:9221, ack 3, win 1004, options [nop,nop,TS val 3248121095 ecr 2040813740], length 1976
00:28:01.915225 IP 192.168.1.74.33440 > 192.168.1.45.5005: Flags [R.], seq 9221, ack 3, win 1004, options [nop,nop,TS val 3248121096 ecr 2040813740], length 0
00:28:01.915229 IP 192.168.1.45.5005 > 192.168.1.74.33440: Flags [.], ack 7245, win 906, options [nop,nop,TS val 2040813740 ecr 3248121095], length 0
00:28:01.915305 IP 192.168.1.74.33440 > 192.168.1.45.5005: Flags [R], seq 1311027802, win 0, length 0

12 packets captured
12 packets received by filter
0 packets dropped by kernel
