tcpdump: verbose output suppressed, use -v[v]... for full protocol decode
listening on enp0s8, link-type EN10MB (Ethernet), snapshot length 262144 bytes
23:10:32.551237 IP 192.168.1.44.58532 > 192.168.1.45.5005: Flags [S], seq 1853151372, win 64240, options [mss 1460,sackOK,TS val 3848386342 ecr 0,nop,wscale 6], length 0
23:10:32.551261 IP 192.168.1.45.5005 > 192.168.1.44.58532: Flags [S.], seq 3561605499, ack 1853151373, win 65160, options [mss 1460,sackOK,TS val 1370955101 ecr 3848386342,nop,wscale 6], length 0
23:10:32.551494 IP 192.168.1.44.58532 > 192.168.1.45.5005: Flags [.], ack 1, win 1004, options [nop,nop,TS val 3848386342 ecr 1370955101], length 0
23:10:32.552304 IP 192.168.1.44.58532 > 192.168.1.45.5005: Flags [P.], seq 1:5, ack 1, win 1004, options [nop,nop,TS val 3848386343 ecr 1370955101], length 4
23:10:32.552315 IP 192.168.1.45.5005 > 192.168.1.44.58532: Flags [.], ack 5, win 1019, options [nop,nop,TS val 1370955102 ecr 3848386343], length 0
23:10:32.552523 IP 192.168.1.45.5005 > 192.168.1.44.58532: Flags [P.], seq 1:3, ack 5, win 1019, options [nop,nop,TS val 1370955103 ecr 3848386343], length 2
23:10:32.552578 IP 192.168.1.44.58532 > 192.168.1.45.5005: Flags [.], ack 3, win 1004, options [nop,nop,TS val 3848386343 ecr 1370955103], length 0
23:10:32.552685 IP 192.168.1.44.58532 > 192.168.1.45.5005: Flags [P.], seq 5:7245, ack 3, win 1004, options [nop,nop,TS val 3848386343 ecr 1370955103], length 7240
23:10:32.552685 IP 192.168.1.44.58532 > 192.168.1.45.5005: Flags [.], seq 7245:11589, ack 3, win 1004, options [nop,nop,TS val 3848386344 ecr 1370955103], length 4344
23:10:32.552725 IP 192.168.1.44.58532 > 192.168.1.45.5005: Flags [P.], seq 11589:14485, ack 3, win 1004, options [nop,nop,TS val 3848386344 ecr 1370955103], length 2896
23:10:32.560117 IP 192.168.1.44.58532 > 192.168.1.45.5005: Flags [.], seq 14485:15933, ack 3, win 1004, options [nop,nop,TS val 3848386351 ecr 1370955103], length 1448
23:10:32.594573 IP 192.168.1.45.5005 > 192.168.1.44.58532: Flags [.], ack 15933, win 857, options [nop,nop,TS val 1370955145 ecr 3848386343], length 0
23:10:32.595504 IP 192.168.1.44.58532 > 192.168.1.45.5005: Flags [P.], seq 15933:26069, ack 3, win 1004, options [nop,nop,TS val 3848386386 ecr 1370955145], length 10136
23:10:32.595504 IP 192.168.1.44.58532 > 192.168.1.45.5005: Flags [P.], seq 26069:36205, ack 3, win 1004, options [nop,nop,TS val 3848386386 ecr 1370955145], length 10136
23:10:32.595537 IP 192.168.1.45.5005 > 192.168.1.44.58532: Flags [.], ack 26069, win 752, options [nop,nop,TS val 1370955146 ecr 3848386386], length 0
23:10:32.595561 IP 192.168.1.45.5005 > 192.168.1.44.58532: Flags [.], ack 36205, win 645, options [nop,nop,TS val 1370955146 ecr 3848386386], length 0
23:10:32.595598 IP 192.168.1.44.58532 > 192.168.1.45.5005: Flags [P.], seq 36205:46341, ack 3, win 1004, options [nop,nop,TS val 3848386386 ecr 1370955145], length 10136
23:10:32.595605 IP 192.168.1.45.5005 > 192.168.1.44.58532: Flags [.], ack 46341, win 540, options [nop,nop,TS val 1370955146 ecr 3848386386], length 0
23:10:32.595997 IP 192.168.1.44.58532 > 192.168.1.45.5005: Flags [P.], seq 46341:60821, ack 3, win 1004, options [nop,nop,TS val 3848386387 ecr 1370955146], length 14480
23:10:32.596042 IP 192.168.1.44.58532 > 192.168.1.45.5005: Flags [P.], seq 60821:66613, ack 3, win 1004, options [nop,nop,TS val 3848386387 ecr 1370955146], length 5792
23:10:32.596042 IP 192.168.1.44.58532 > 192.168.1.45.5005: Flags [P.], seq 66613:77485, ack 3, win 1004, options [nop,nop,TS val 3848386387 ecr 1370955146], length 10872
23:10:32.596066 IP 192.168.1.44.58532 > 192.168.1.45.5005: Flags [P.], seq 77485:78197, ack 3, win 1004, options [nop,nop,TS val 3848386387 ecr 1370955146], length 712
23:10:32.596066 IP 192.168.1.44.58532 > 192.168.1.45.5005: Flags [.], seq 78197:79645, ack 3, win 1004, options [nop,nop,TS val 3848386387 ecr 1370955146], length 1448
23:10:32.612178 IP 192.168.1.44.58532 > 192.168.1.45.5005: Flags [.], seq 78197:79645, ack 3, win 1004, options [nop,nop,TS val 3848386403 ecr 1370955146], length 1448
23:10:32.638465 IP 192.168.1.45.5005 > 192.168.1.44.58532: Flags [.], ack 79645, win 176, options [nop,nop,TS val 1370955189 ecr 3848386387,nop,nop,sack 1 {78197:79645}], length 0
23:10:32.639314 IP 192.168.1.44.58532 > 192.168.1.45.5005: Flags [P.], seq 79645:90909, ack 3, win 1004, options [nop,nop,TS val 3848386430 ecr 1370955189], length 11264
23:10:32.660192 IP 192.168.1.44.58532 > 192.168.1.45.5005: Flags [.], seq 89781:90909, ack 3, win 1004, options [nop,nop,TS val 3848386451 ecr 1370955189], length 1128
23:10:32.682533 IP 192.168.1.45.5005 > 192.168.1.44.58532: Flags [.], ack 90909, win 0, options [nop,nop,TS val 1370955233 ecr 3848386430,nop,nop,sack 1 {89781:90909}], length 0
23:10:32.900292 IP 192.168.1.44.58532 > 192.168.1.45.5005: Flags [.], ack 3, win 1004, options [nop,nop,TS val 3848386691 ecr 1370955233], length 0
23:10:32.900319 IP 192.168.1.45.5005 > 192.168.1.44.58532: Flags [.], ack 90909, win 0, options [nop,nop,TS val 1370955450 ecr 3848386430], length 0
23:10:33.352228 IP 192.168.1.44.58532 > 192.168.1.45.5005: Flags [.], ack 3, win 1004, options [nop,nop,TS val 3848387143 ecr 1370955450], length 0
23:10:34.248234 IP 192.168.1.44.58532 > 192.168.1.45.5005: Flags [.], ack 3, win 1004, options [nop,nop,TS val 3848388039 ecr 1370955450], length 0
23:10:34.248261 IP 192.168.1.45.5005 > 192.168.1.44.58532: Flags [.], ack 90909, win 0, options [nop,nop,TS val 1370956798 ecr 3848386430], length 0
23:10:36.008117 IP 192.168.1.44.58532 > 192.168.1.45.5005: Flags [.], ack 3, win 1004, options [nop,nop,TS val 3848389799 ecr 1370956798], length 0
23:10:36.008144 IP 192.168.1.45.5005 > 192.168.1.44.58532: Flags [.], ack 90909, win 0, options [nop,nop,TS val 1370958558 ecr 3848386430], length 0
23:10:39.592128 IP 192.168.1.44.58532 > 192.168.1.45.5005: Flags [.], ack 3, win 1004, options [nop,nop,TS val 3848393383 ecr 1370958558], length 0
23:10:39.592154 IP 192.168.1.45.5005 > 192.168.1.44.58532: Flags [.], ack 90909, win 0, options [nop,nop,TS val 1370962142 ecr 3848386430], length 0
23:10:46.760042 IP 192.168.1.44.58532 > 192.168.1.45.5005: Flags [.], ack 3, win 1004, options [nop,nop,TS val 3848400551 ecr 1370962142], length 0
23:10:46.760067 IP 192.168.1.45.5005 > 192.168.1.44.58532: Flags [.], ack 90909, win 0, options [nop,nop,TS val 1370969310 ecr 3848386430], length 0
23:10:47.553020 IP 192.168.1.45.5005 > 192.168.1.44.58532: Flags [.], ack 90909, win 1002, options [nop,nop,TS val 1370970103 ecr 3848386430], length 0
23:10:47.553711 IP 192.168.1.44.58532 > 192.168.1.45.5005: Flags [P.], seq 90909:98149, ack 3, win 1004, options [nop,nop,TS val 3848401344 ecr 1370970103], length 7240
23:10:47.553711 IP 192.168.1.44.58532 > 192.168.1.45.5005: Flags [.], seq 98149:99597, ack 3, win 1004, options [nop,nop,TS val 3848401344 ecr 1370970103], length 1448
23:10:47.553744 IP 192.168.1.45.5005 > 192.168.1.44.58532: Flags [.], ack 98149, win 1228, options [nop,nop,TS val 1370970104 ecr 3848401344], length 0
23:10:47.553763 IP 192.168.1.45.5005 > 192.168.1.44.58532: Flags [.], ack 99597, win 1273, options [nop,nop,TS val 1370970104 ecr 3848401344], length 0
23:10:47.553876 IP 192.168.1.44.58532 > 192.168.1.45.5005: Flags [P.], seq 99597:105389, ack 3, win 1004, options [nop,nop,TS val 3848401344 ecr 1370970103], length 5792
23:10:47.553882 IP 192.168.1.45.5005 > 192.168.1.44.58532: Flags [.], ack 105389, win 1454, options [nop,nop,TS val 1370970104 ecr 3848401344], length 0
23:10:47.554457 IP 192.168.1.44.58532 > 192.168.1.45.5005: Flags [P.], seq 105389:108285, ack 3, win 1004, options [nop,nop,TS val 3848401345 ecr 1370970104], length 2896
23:10:47.554457 IP 192.168.1.44.58532 > 192.168.1.45.5005: Flags [P.], seq 108285:110053, ack 3, win 1004, options [nop,nop,TS val 3848401345 ecr 1370970104], length 1768
23:10:47.554457 IP 192.168.1.44.58532 > 192.168.1.45.5005: Flags [P.], seq 110053:112949, ack 3, win 1004, options [nop,nop,TS val 3848401345 ecr 1370970104], length 2896
23:10:47.554457 IP 192.168.1.44.58532 > 192.168.1.45.5005: Flags [P.], seq 112949:115845, ack 3, win 1004, options [nop,nop,TS val 3848401345 ecr 1370970104], length 2896
23:10:47.554484 IP 192.168.1.45.5005 > 192.168.1.44.58532: Flags [.], ack 108285, win 1545, options [nop,nop,TS val 1370970105 ecr 3848401345], length 0
23:10:47.554513 IP 192.168.1.45.5005 > 192.168.1.44.58532: Flags [.], ack 110053, win 1600, options [nop,nop,TS val 1370970105 ecr 3848401345], length 0
23:10:47.554525 IP 192.168.1.45.5005 > 192.168.1.44.58532: Flags [.], ack 112949, win 1690, options [nop,nop,TS val 1370970105 ecr 3848401345], length 0
23:10:47.554543 IP 192.168.1.45.5005 > 192.168.1.44.58532: Flags [.], ack 115845, win 1781, options [nop,nop,TS val 1370970105 ecr 3848401345], length 0
23:10:47.554561 IP 192.168.1.44.58532 > 192.168.1.45.5005: Flags [P.], seq 115845:121637, ack 3, win 1004, options [nop,nop,TS val 3848401345 ecr 1370970104], length 5792
23:10:47.554561 IP 192.168.1.44.58532 > 192.168.1.45.5005: Flags [P.], seq 121637:127429, ack 3, win 1004, options [nop,nop,TS val 3848401345 ecr 1370970104], length 5792
23:10:47.554569 IP 192.168.1.45.5005 > 192.168.1.44.58532: Flags [.], ack 121637, win 1962, options [nop,nop,TS val 1370970105 ecr 3848401345], length 0
23:10:47.554582 IP 192.168.1.45.5005 > 192.168.1.44.58532: Flags [.], ack 127429, win 2143, options [nop,nop,TS val 1370970105 ecr 3848401345], length 0
23:10:47.554617 IP 192.168.1.44.58532 > 192.168.1.45.5005: Flags [P.], seq 127429:133221, ack 3, win 1004, options [nop,nop,TS val 3848401345 ecr 1370970104], length 5792
23:10:47.554622 IP 192.168.1.45.5005 > 192.168.1.44.58532: Flags [.], ack 133221, win 2324, options [nop,nop,TS val 1370970105 ecr 3848401345], length 0
23:10:47.554879 IP 192.168.1.44.58532 > 192.168.1.45.5005: Flags [P.], seq 133221:139013, ack 3, win 1004, options [nop,nop,TS val 3848401346 ecr 1370970105], length 5792
23:10:47.554880 IP 192.168.1.44.58532 > 192.168.1.45.5005: Flags [P.], seq 139013:141909, ack 3, win 1004, options [nop,nop,TS val 3848401346 ecr 1370970105], length 2896
23:10:47.554996 IP 192.168.1.44.58532 > 192.168.1.45.5005: Flags [P.], seq 141909:144805, ack 3, win 1004, options [nop,nop,TS val 3848401346 ecr 1370970105], length 2896
23:10:47.554996 IP 192.168.1.44.58532 > 192.168.1.45.5005: Flags [P.], seq 144805:150597, ack 3, win 1004, options [nop,nop,TS val 3848401346 ecr 1370970105], length 5792
23:10:47.554996 IP 192.168.1.44.58532 > 192.168.1.45.5005: Flags [.], seq 150597:159285, ack 3, win 1004, options [nop,nop,TS val 3848401346 ecr 1370970105], length 8688
23:10:47.555084 IP 192.168.1.44.58532 > 192.168.1.45.5005: Flags [P.], seq 159285:167973, ack 3, win 1004, options [nop,nop,TS val 3848401346 ecr 1370970105], length 8688
23:10:47.555084 IP 192.168.1.44.58532 > 192.168.1.45.5005: Flags [P.], seq 167973:173765, ack 3, win 1004, options [nop,nop,TS val 3848401346 ecr 1370970105], length 5792
23:10:47.555113 IP 192.168.1.44.58532 > 192.168.1.45.5005: Flags [.], seq 173765:178109, ack 3, win 1004, options [nop,nop,TS val 3848401346 ecr 1370970105], length 4344
23:10:47.555191 IP 192.168.1.44.58532 > 192.168.1.45.5005: Flags [P.], seq 178109:191141, ack 3, win 1004, options [nop,nop,TS val 3848401346 ecr 1370970105], length 13032
23:10:47.555223 IP 192.168.1.45.5005 > 192.168.1.44.58532: Flags [.], ack 159285, win 3138, options [nop,nop,TS val 1370970105 ecr 3848401346], length 0
23:10:47.555239 IP 192.168.1.45.5005 > 192.168.1.44.58532: Flags [.], ack 178109, win 3727, options [nop,nop,TS val 1370970105 ecr 3848401346], length 0
23:10:47.555248 IP 192.168.1.45.5005 > 192.168.1.44.58532: Flags [.], ack 191141, win 4134, options [nop,nop,TS val 1370970105 ecr 3848401346], length 0
23:10:47.555704 IP 192.168.1.44.58532 > 192.168.1.45.5005: Flags [.], seq 191141:201277, ack 3, win 1004, options [nop,nop,TS val 3848401346 ecr 1370970105], length 10136
23:10:47.555716 IP 192.168.1.45.5005 > 192.168.1.44.58532: Flags [.], ack 201277, win 4451, options [nop,nop,TS val 1370970106 ecr 3848401346], length 0
23:10:47.555866 IP 192.168.1.44.58532 > 192.168.1.45.5005: Flags [P.], seq 201277:205621, ack 3, win 1004, options [nop,nop,TS val 3848401346 ecr 1370970105], length 4344
23:10:47.555866 IP 192.168.1.44.58532 > 192.168.1.45.5005: Flags [.], seq 205621:227341, ack 3, win 1004, options [nop,nop,TS val 3848401346 ecr 1370970105], length 21720
23:10:47.555882 IP 192.168.1.45.5005 > 192.168.1.44.58532: Flags [.], ack 205621, win 4586, options [nop,nop,TS val 1370970106 ecr 3848401346], length 0
23:10:47.555901 IP 192.168.1.45.5005 > 192.168.1.44.58532: Flags [.], ack 227341, win 5265, options [nop,nop,TS val 1370970106 ecr 3848401346], length 0
23:10:47.555997 IP 192.168.1.44.58532 > 192.168.1.45.5005: Flags [P.], seq 227341:237477, ack 3, win 1004, options [nop,nop,TS val 3848401346 ecr 1370970105], length 10136
23:10:47.555998 IP 192.168.1.44.58532 > 192.168.1.45.5005: Flags [P.], seq 237477:243269, ack 3, win 1004, options [nop,nop,TS val 3848401346 ecr 1370970105], length 5792
23:10:47.556009 IP 192.168.1.45.5005 > 192.168.1.44.58532: Flags [.], ack 237477, win 5582, options [nop,nop,TS val 1370970106 ecr 3848401346], length 0
23:10:47.556028 IP 192.168.1.45.5005 > 192.168.1.44.58532: Flags [.], ack 243269, win 5763, options [nop,nop,TS val 1370970106 ecr 3848401346], length 0
23:10:47.556088 IP 192.168.1.44.58532 > 192.168.1.45.5005: Flags [.], seq 243269:259197, ack 3, win 1004, options [nop,nop,TS val 3848401346 ecr 1370970105], length 15928
23:10:47.556100 IP 192.168.1.45.5005 > 192.168.1.44.58532: Flags [.], ack 259197, win 6261, options [nop,nop,TS val 1370970106 ecr 3848401346], length 0
23:10:47.556221 IP 192.168.1.44.58532 > 192.168.1.45.5005: Flags [P.], seq 259197:269333, ack 3, win 1004, options [nop,nop,TS val 3848401346 ecr 1370970105], length 10136
23:10:47.556222 IP 192.168.1.44.58532 > 192.168.1.45.5005: Flags [.], seq 269333:278021, ack 3, win 1004, options [nop,nop,TS val 3848401347 ecr 1370970105], length 8688
23:10:47.556235 IP 192.168.1.45.5005 > 192.168.1.44.58532: Flags [.], ack 269333, win 6577, options [nop,nop,TS val 1370970106 ecr 3848401346], length 0
23:10:47.556254 IP 192.168.1.45.5005 > 192.168.1.44.58532: Flags [.], ack 278021, win 6849, options [nop,nop,TS val 1370970106 ecr 3848401347], length 0
23:10:47.556357 IP 192.168.1.44.58532 > 192.168.1.45.5005: Flags [P.], seq 278021:280917, ack 3, win 1004, options [nop,nop,TS val 3848401347 ecr 1370970105], length 2896
23:10:47.556357 IP 192.168.1.44.58532 > 192.168.1.45.5005: Flags [P.], seq 280917:301189, ack 3, win 1004, options [nop,nop,TS val 3848401347 ecr 1370970105], length 20272
23:10:47.556371 IP 192.168.1.45.5005 > 192.168.1.44.58532: Flags [.], ack 280917, win 6939, options [nop,nop,TS val 1370970107 ecr 3848401347], length 0
23:10:47.556390 IP 192.168.1.45.5005 > 192.168.1.44.58532: Flags [.], ack 301189, win 7573, options [nop,nop,TS val 1370970107 ecr 3848401347], length 0
23:10:47.556450 IP 192.168.1.44.58532 > 192.168.1.45.5005: Flags [P.], seq 301189:306981, ack 3, win 1004, options [nop,nop,TS val 3848401347 ecr 1370970105], length 5792
23:10:47.556451 IP 192.168.1.44.58532 > 192.168.1.45.5005: Flags [.], seq 306981:312773, ack 3, win 1004, options [nop,nop,TS val 3848401347 ecr 1370970106], length 5792
23:10:47.556461 IP 192.168.1.45.5005 > 192.168.1.44.58532: Flags [.], ack 306981, win 7754, options [nop,nop,TS val 1370970107 ecr 3848401347], length 0
23:10:47.556479 IP 192.168.1.45.5005 > 192.168.1.44.58532: Flags [.], ack 312773, win 7935, options [nop,nop,TS val 1370970107 ecr 3848401347], length 0
23:10:47.556576 IP 192.168.1.44.58532 > 192.168.1.45.5005: Flags [P.], seq 312773:327253, ack 3, win 1004, options [nop,nop,TS val 3848401347 ecr 1370970106], length 14480
23:10:47.556586 IP 192.168.1.45.5005 > 192.168.1.44.58532: Flags [.], ack 327253, win 8387, options [nop,nop,TS val 1370970107 ecr 3848401347], length 0
23:10:47.556660 IP 192.168.1.44.58532 > 192.168.1.45.5005: Flags [P.], seq 327253:333045, ack 3, win 1004, options [nop,nop,TS val 3848401347 ecr 1370970106], length 5792
23:10:47.556660 IP 192.168.1.44.58532 > 192.168.1.45.5005: Flags [P.], seq 333045:335941, ack 3, win 1004, options [nop,nop,TS val 3848401347 ecr 1370970106], length 2896
23:10:47.556660 IP 192.168.1.44.58532 > 192.168.1.45.5005: Flags [.], seq 335941:343181, ack 3, win 1004, options [nop,nop,TS val 3848401347 ecr 1370970106], length 7240
23:10:47.556673 IP 192.168.1.45.5005 > 192.168.1.44.58532: Flags [.], ack 333045, win 8568, options [nop,nop,TS val 1370970107 ecr 3848401347], length 0
23:10:47.556701 IP 192.168.1.45.5005 > 192.168.1.44.58532: Flags [.], ack 335941, win 8659, options [nop,nop,TS val 1370970107 ecr 3848401347], length 0
23:10:47.556720 IP 192.168.1.45.5005 > 192.168.1.44.58532: Flags [.], ack 343181, win 8885, options [nop,nop,TS val 1370970107 ecr 3848401347], length 0
23:10:47.556825 IP 192.168.1.44.58532 > 192.168.1.45.5005: Flags [P.], seq 343181:364901, ack 3, win 1004, options [nop,nop,TS val 3848401347 ecr 1370970106], length 21720
23:10:47.556837 IP 192.168.1.45.5005 > 192.168.1.44.58532: Flags [.], ack 364901, win 9564, options [nop,nop,TS val 1370970107 ecr 3848401347], length 0
23:10:47.556888 IP 192.168.1.44.58532 > 192.168.1.45.5005: Flags [P.], seq 364901:379381, ack 3, win 1004, options [nop,nop,TS val 3848401347 ecr 1370970106], length 14480
23:10:47.556897 IP 192.168.1.45.5005 > 192.168.1.44.58532: Flags [.], ack 379381, win 10016, options [nop,nop,TS val 1370970107 ecr 3848401347], length 0
23:10:47.556945 IP 192.168.1.44.58532 > 192.168.1.45.5005: Flags [.], seq 379381:383725, ack 3, win 1004, options [nop,nop,TS val 3848401347 ecr 1370970106], length 4344
23:10:47.556952 IP 192.168.1.45.5005 > 192.168.1.44.58532: Flags [.], ack 383725, win 10152, options [nop,nop,TS val 1370970107 ecr 3848401347], length 0
23:10:47.557051 IP 192.168.1.44.58532 > 192.168.1.45.5005: Flags [P.], seq 383725:396757, ack 3, win 1004, options [nop,nop,TS val 3848401347 ecr 1370970106], length 13032
23:10:47.557060 IP 192.168.1.45.5005 > 192.168.1.44.58532: Flags [.], ack 396757, win 10559, options [nop,nop,TS val 1370970107 ecr 3848401347], length 0
23:10:47.557109 IP 192.168.1.44.58532 > 192.168.1.45.5005: Flags [P.], seq 396757:399653, ack 3, win 1004, options [nop,nop,TS val 3848401347 ecr 1370970106], length 2896
23:10:47.557109 IP 192.168.1.44.58532 > 192.168.1.45.5005: Flags [P.], seq 399653:411237, ack 3, win 1004, options [nop,nop,TS val 3848401347 ecr 1370970106], length 11584
23:10:47.557122 IP 192.168.1.45.5005 > 192.168.1.44.58532: Flags [.], ack 399653, win 10650, options [nop,nop,TS val 1370970107 ecr 3848401347], length 0
23:10:47.557139 IP 192.168.1.45.5005 > 192.168.1.44.58532: Flags [.], ack 411237, win 11012, options [nop,nop,TS val 1370970107 ecr 3848401347], length 0
23:10:47.557180 IP 192.168.1.44.58532 > 192.168.1.45.5005: Flags [.], seq 411237:419925, ack 3, win 1004, options [nop,nop,TS val 3848401347 ecr 1370970106], length 8688
23:10:47.557188 IP 192.168.1.45.5005 > 192.168.1.44.58532: Flags [.], ack 419925, win 11283, options [nop,nop,TS val 1370970107 ecr 3848401347], length 0
23:10:47.557304 IP 192.168.1.44.58532 > 192.168.1.45.5005: Flags [P.], seq 419925:428613, ack 3, win 1004, options [nop,nop,TS val 3848401347 ecr 1370970106], length 8688
23:10:47.557305 IP 192.168.1.44.58532 > 192.168.1.45.5005: Flags [.], seq 428613:438749, ack 3, win 1004, options [nop,nop,TS val 3848401347 ecr 1370970106], length 10136
23:10:47.557317 IP 192.168.1.45.5005 > 192.168.1.44.58532: Flags [.], ack 428613, win 11555, options [nop,nop,TS val 1370970107 ecr 3848401347], length 0
23:10:47.557336 IP 192.168.1.45.5005 > 192.168.1.44.58532: Flags [.], ack 438749, win 11872, options [nop,nop,TS val 1370970108 ecr 3848401347], length 0
23:10:47.557440 IP 192.168.1.44.58532 > 192.168.1.45.5005: Flags [P.], seq 438749:460469, ack 3, win 1004, options [nop,nop,TS val 3848401347 ecr 1370970106], length 21720
23:10:47.557452 IP 192.168.1.45.5005 > 192.168.1.44.58532: Flags [.], ack 460469, win 12550, options [nop,nop,TS val 1370970108 ecr 3848401347], length 0
23:10:47.557509 IP 192.168.1.44.58532 > 192.168.1.45.5005: Flags [P.], seq 460469:463365, ack 3, win 1004, options [nop,nop,TS val 3848401347 ecr 1370970106], length 2896
23:10:47.557510 IP 192.168.1.44.58532 > 192.168.1.45.5005: Flags [.], seq 463365:469157, ack 3, win 1004, options [nop,nop,TS val 3848401348 ecr 1370970107], length 5792
23:10:47.557519 IP 192.168.1.45.5005 > 192.168.1.44.58532: Flags [.], ack 463365, win 12641, options [nop,nop,TS val 1370970108 ecr 3848401347], length 0
23:10:47.557538 IP 192.168.1.45.5005 > 192.168.1.44.58532: Flags [.], ack 469157, win 12822, options [nop,nop,TS val 1370970108 ecr 3848401348], length 0
23:10:47.557657 IP 192.168.1.44.58532 > 192.168.1.45.5005: Flags [P.], seq 469157:492325, ack 3, win 1004, options [nop,nop,TS val 3848401348 ecr 1370970107], length 23168
23:10:47.557670 IP 192.168.1.45.5005 > 192.168.1.44.58532: Flags [.], ack 492325, win 13546, options [nop,nop,TS val 1370970108 ecr 3848401348], length 0
23:10:47.557724 IP 192.168.1.44.58532 > 192.168.1.45.5005: Flags [.], seq 492325:501013, ack 3, win 1004, options [nop,nop,TS val 3848401348 ecr 1370970107], length 8688
23:10:47.557732 IP 192.168.1.45.5005 > 192.168.1.44.58532: Flags [.], ack 501013, win 13817, options [nop,nop,TS val 1370970108 ecr 3848401348], length 0
23:10:47.557843 IP 192.168.1.44.58532 > 192.168.1.45.5005: Flags [P.], seq 501013:508253, ack 3, win 1004, options [nop,nop,TS val 3848401348 ecr 1370970107], length 7240
23:10:47.557843 IP 192.168.1.44.58532 > 192.168.1.45.5005: Flags [.], seq 508253:519837, ack 3, win 1004, options [nop,nop,TS val 3848401348 ecr 1370970107], length 11584
23:10:47.557856 IP 192.168.1.45.5005 > 192.168.1.44.58532: Flags [.], ack 508253, win 14044, options [nop,nop,TS val 1370970108 ecr 3848401348], length 0
23:10:47.557875 IP 192.168.1.45.5005 > 192.168.1.44.58532: Flags [.], ack 519837, win 14406, options [nop,nop,TS val 1370970108 ecr 3848401348], length 0
23:10:47.557983 IP 192.168.1.44.58532 > 192.168.1.45.5005: Flags [P.], seq 519837:524181, ack 3, win 1004, options [nop,nop,TS val 3848401348 ecr 1370970107], length 4344
23:10:47.557983 IP 192.168.1.44.58532 > 192.168.1.45.5005: Flags [P.], seq 524181:532869, ack 3, win 1004, options [nop,nop,TS val 3848401348 ecr 1370970107], length 8688
23:10:47.557993 IP 192.168.1.45.5005 > 192.168.1.44.58532: Flags [.], ack 524181, win 14541, options [nop,nop,TS val 1370970108 ecr 3848401348], length 0
23:10:47.558012 IP 192.168.1.45.5005 > 192.168.1.44.58532: Flags [.], ack 532869, win 14813, options [nop,nop,TS val 1370970108 ecr 3848401348], length 0
23:10:47.558058 IP 192.168.1.44.58532 > 192.168.1.45.5005: Flags [P.], seq 532869:556037, ack 3, win 1004, options [nop,nop,TS val 3848401348 ecr 1370970107], length 23168
23:10:47.558070 IP 192.168.1.45.5005 > 192.168.1.44.58532: Flags [.], ack 556037, win 15537, options [nop,nop,TS val 1370970108 ecr 3848401348], length 0
23:10:47.558106 IP 192.168.1.44.58532 > 192.168.1.45.5005: Flags [.], seq 556037:560381, ack 3, win 1004, options [nop,nop,TS val 3848401348 ecr 1370970107], length 4344
23:10:47.558112 IP 192.168.1.45.5005 > 192.168.1.44.58532: Flags [.], ack 560381, win 15673, options [nop,nop,TS val 1370970108 ecr 3848401348], length 0
23:10:47.558248 IP 192.168.1.44.58532 > 192.168.1.45.5005: Flags [.], seq 560381:580653, ack 3, win 1004, options [nop,nop,TS val 3848401348 ecr 1370970107], length 20272
23:10:47.558261 IP 192.168.1.45.5005 > 192.168.1.44.58532: Flags [.], ack 580653, win 16306, options [nop,nop,TS val 1370970108 ecr 3848401348], length 0
23:10:47.558407 IP 192.168.1.44.58532 > 192.168.1.45.5005: Flags [P.], seq 580653:587893, ack 3, win 1004, options [nop,nop,TS val 3848401348 ecr 1370970107], length 7240
23:10:47.558407 IP 192.168.1.44.58532 > 192.168.1.45.5005: Flags [.], seq 587893:600925, ack 3, win 1004, options [nop,nop,TS val 3848401348 ecr 1370970107], length 13032
23:10:47.558437 IP 192.168.1.45.5005 > 192.168.1.44.58532: Flags [.], ack 587893, win 16532, options [nop,nop,TS val 1370970109 ecr 3848401348], length 0
23:10:47.558456 IP 192.168.1.45.5005 > 192.168.1.44.58532: Flags [.], ack 600925, win 16940, options [nop,nop,TS val 1370970109 ecr 3848401348], length 0
23:10:47.558565 IP 192.168.1.44.58532 > 192.168.1.45.5005: Flags [P.], seq 600925:619749, ack 3, win 1004, options [nop,nop,TS val 3848401348 ecr 1370970107], length 18824
23:10:47.558590 IP 192.168.1.45.5005 > 192.168.1.44.58532: Flags [.], ack 619749, win 17528, options [nop,nop,TS val 1370970109 ecr 3848401348], length 0
23:10:47.558703 IP 192.168.1.44.58532 > 192.168.1.45.5005: Flags [.], seq 619749:640021, ack 3, win 1004, options [nop,nop,TS val 3848401349 ecr 1370970108], length 20272
23:10:47.558716 IP 192.168.1.45.5005 > 192.168.1.44.58532: Flags [.], ack 640021, win 18161, options [nop,nop,TS val 1370970109 ecr 3848401349], length 0
23:10:47.558893 IP 192.168.1.44.58532 > 192.168.1.45.5005: Flags [.], seq 640021:674773, ack 3, win 1004, options [nop,nop,TS val 3848401349 ecr 1370970108], length 34752
23:10:47.558911 IP 192.168.1.45.5005 > 192.168.1.44.58532: Flags [.], ack 674773, win 19247, options [nop,nop,TS val 1370970109 ecr 3848401349], length 0
23:10:47.559032 IP 192.168.1.44.58532 > 192.168.1.45.5005: Flags [P.], seq 674773:684909, ack 3, win 1004, options [nop,nop,TS val 3848401349 ecr 1370970108], length 10136
23:10:47.559032 IP 192.168.1.44.58532 > 192.168.1.45.5005: Flags [.], seq 684909:696493, ack 3, win 1004, options [nop,nop,TS val 3848401349 ecr 1370970108], length 11584
23:10:47.559046 IP 192.168.1.45.5005 > 192.168.1.44.58532: Flags [.], ack 684909, win 19475, options [nop,nop,TS val 1370970109 ecr 3848401349], length 0
23:10:47.559065 IP 192.168.1.45.5005 > 192.168.1.44.58532: Flags [.], ack 696493, win 19355, options [nop,nop,TS val 1370970109 ecr 3848401349], length 0
23:10:47.559211 IP 192.168.1.44.58532 > 192.168.1.45.5005: Flags [.], seq 696493:724005, ack 3, win 1004, options [nop,nop,TS val 3848401349 ecr 1370970108], length 27512
23:10:47.559227 IP 192.168.1.45.5005 > 192.168.1.44.58532: Flags [.], ack 724005, win 19066, options [nop,nop,TS val 1370970109 ecr 3848401349], length 0
23:10:47.559350 IP 192.168.1.44.58532 > 192.168.1.45.5005: Flags [.], seq 724005:745725, ack 3, win 1004, options [nop,nop,TS val 3848401349 ecr 1370970108], length 21720
23:10:47.559363 IP 192.168.1.45.5005 > 192.168.1.44.58532: Flags [.], ack 745725, win 18839, options [nop,nop,TS val 1370970110 ecr 3848401349], length 0
23:10:47.559484 IP 192.168.1.44.58532 > 192.168.1.45.5005: Flags [P.], seq 745725:750069, ack 3, win 1004, options [nop,nop,TS val 3848401349 ecr 1370970108], length 4344
23:10:47.559484 IP 192.168.1.44.58532 > 192.168.1.45.5005: Flags [.], seq 750069:765997, ack 3, win 1004, options [nop,nop,TS val 3848401350 ecr 1370970109], length 15928
23:10:47.559497 IP 192.168.1.45.5005 > 192.168.1.44.58532: Flags [.], ack 750069, win 18794, options [nop,nop,TS val 1370970110 ecr 3848401349], length 0
23:10:47.559516 IP 192.168.1.45.5005 > 192.168.1.44.58532: Flags [.], ack 765997, win 18627, options [nop,nop,TS val 1370970110 ecr 3848401350], length 0
23:10:47.559663 IP 192.168.1.44.58532 > 192.168.1.45.5005: Flags [.], seq 765997:792061, ack 3, win 1004, options [nop,nop,TS val 3848401350 ecr 1370970109], length 26064
23:10:47.559678 IP 192.168.1.45.5005 > 192.168.1.44.58532: Flags [.], ack 792061, win 18355, options [nop,nop,TS val 1370970110 ecr 3848401350], length 0
23:10:47.559790 IP 192.168.1.44.58532 > 192.168.1.45.5005: Flags [.], seq 792061:812333, ack 3, win 1004, options [nop,nop,TS val 3848401350 ecr 1370970109], length 20272
23:10:47.559802 IP 192.168.1.45.5005 > 192.168.1.44.58532: Flags [.], ack 812333, win 18143, options [nop,nop,TS val 1370970110 ecr 3848401350], length 0
23:10:47.559928 IP 192.168.1.44.58532 > 192.168.1.45.5005: Flags [P.], seq 812333:815229, ack 3, win 1004, options [nop,nop,TS val 3848401350 ecr 1370970109], length 2896
23:10:47.559928 IP 192.168.1.44.58532 > 192.168.1.45.5005: Flags [.], seq 815229:826813, ack 3, win 1004, options [nop,nop,TS val 3848401350 ecr 1370970109], length 11584
23:10:47.559940 IP 192.168.1.45.5005 > 192.168.1.44.58532: Flags [.], ack 815229, win 18113, options [nop,nop,TS val 1370970110 ecr 3848401350], length 0
23:10:47.559959 IP 192.168.1.45.5005 > 192.168.1.44.58532: Flags [.], ack 826813, win 17991, options [nop,nop,TS val 1370970110 ecr 3848401350], length 0
23:10:47.560105 IP 192.168.1.44.58532 > 192.168.1.45.5005: Flags [.], seq 826813:854325, ack 3, win 1004, options [nop,nop,TS val 3848401350 ecr 1370970109], length 27512
23:10:47.560122 IP 192.168.1.45.5005 > 192.168.1.44.58532: Flags [.], ack 854325, win 17702, options [nop,nop,TS val 1370970110 ecr 3848401350], length 0
23:10:47.560237 IP 192.168.1.44.58532 > 192.168.1.45.5005: Flags [.], seq 854325:874597, ack 3, win 1004, options [nop,nop,TS val 3848401350 ecr 1370970109], length 20272
23:10:47.560249 IP 192.168.1.45.5005 > 192.168.1.44.58532: Flags [.], ack 874597, win 17490, options [nop,nop,TS val 1370970110 ecr 3848401350], length 0
23:10:47.560370 IP 192.168.1.44.58532 > 192.168.1.45.5005: Flags [P.], seq 874597:880389, ack 3, win 1004, options [nop,nop,TS val 3848401350 ecr 1370970109], length 5792
23:10:47.560370 IP 192.168.1.44.58532 > 192.168.1.45.5005: Flags [.], seq 880389:894869, ack 3, win 1004, options [nop,nop,TS val 3848401351 ecr 1370970110], length 14480
23:10:47.560383 IP 192.168.1.45.5005 > 192.168.1.44.58532: Flags [.], ack 880389, win 17430, options [nop,nop,TS val 1370970111 ecr 3848401350], length 0
23:10:47.560401 IP 192.168.1.45.5005 > 192.168.1.44.58532: Flags [.], ack 894869, win 17278, options [nop,nop,TS val 1370970111 ecr 3848401351], length 0
23:10:47.560540 IP 192.168.1.44.58532 > 192.168.1.45.5005: Flags [.], seq 894869:922381, ack 3, win 1004, options [nop,nop,TS val 3848401351 ecr 1370970110], length 27512
23:10:47.560554 IP 192.168.1.45.5005 > 192.168.1.44.58532: Flags [.], ack 922381, win 16989, options [nop,nop,TS val 1370970111 ecr 3848401351], length 0
23:10:47.560690 IP 192.168.1.44.58532 > 192.168.1.45.5005: Flags [.], seq 922381:942653, ack 3, win 1004, options [nop,nop,TS val 3848401351 ecr 1370970110], length 20272
23:10:47.560702 IP 192.168.1.45.5005 > 192.168.1.44.58532: Flags [.], ack 942653, win 16777, options [nop,nop,TS val 1370970111 ecr 3848401351], length 0
23:10:47.560822 IP 192.168.1.44.58532 > 192.168.1.45.5005: Flags [P.], seq 942653:945549, ack 3, win 1004, options [nop,nop,TS val 3848401351 ecr 1370970110], length 2896
23:10:47.560823 IP 192.168.1.44.58532 > 192.168.1.45.5005: Flags [.], seq 945549:964373, ack 3, win 1004, options [nop,nop,TS val 3848401351 ecr 1370970110], length 18824
23:10:47.560837 IP 192.168.1.45.5005 > 192.168.1.44.58532: Flags [.], ack 945549, win 16747, options [nop,nop,TS val 1370970111 ecr 3848401351], length 0
23:10:47.560896 IP 192.168.1.44.58532 > 192.168.1.45.5005: Flags [.], seq 964373:984645, ack 3, win 1004, options [nop,nop,TS val 3848401351 ecr 1370970110], length 20272
23:10:47.560936 IP 192.168.1.44.58532 > 192.168.1.45.5005: Flags [.], seq 984645:1004917, ack 3, win 1004, options [nop,nop,TS val 3848401351 ecr 1370970110], length 20272
23:10:47.560968 IP 192.168.1.44.58532 > 192.168.1.45.5005: Flags [P.], seq 1004917:1010709, ack 3, win 1004, options [nop,nop,TS val 3848401351 ecr 1370970110], length 5792
23:10:47.560968 IP 192.168.1.44.58532 > 192.168.1.45.5005: Flags [.], seq 1010709:1022293, ack 3, win 1004, options [nop,nop,TS val 3848401351 ecr 1370970110], length 11584
23:10:47.561002 IP 192.168.1.44.58532 > 192.168.1.45.5005: Flags [.], seq 1022293:1039669, ack 3, win 1004, options [nop,nop,TS val 3848401351 ecr 1370970110], length 17376
23:10:47.561034 IP 192.168.1.44.58532 > 192.168.1.45.5005: Flags [.], seq 1039669:1057045, ack 3, win 1004, options [nop,nop,TS val 3848401351 ecr 1370970110], length 17376
23:10:47.561066 IP 192.168.1.44.58532 > 192.168.1.45.5005: Flags [.], seq 1057045:1074421, ack 3, win 1004, options [nop,nop,TS val 3848401351 ecr 1370970110], length 17376
23:10:47.561097 IP 192.168.1.44.58532 > 192.168.1.45.5005: Flags [P.], seq 1074421:1075869, ack 3, win 1004, options [nop,nop,TS val 3848401351 ecr 1370970110], length 1448
23:10:47.561097 IP 192.168.1.44.58532 > 192.168.1.45.5005: Flags [.], seq 1075869:1091797, ack 3, win 1004, options [nop,nop,TS val 3848401352 ecr 1370970111], length 15928
23:10:47.561131 IP 192.168.1.44.58532 > 192.168.1.45.5005: Flags [.], seq 1091797:1109173, ack 3, win 1004, options [nop,nop,TS val 3848401352 ecr 1370970111], length 17376
23:10:47.561162 IP 192.168.1.44.58532 > 192.168.1.45.5005: Flags [.], seq 1109173:1127997, ack 3, win 1004, options [nop,nop,TS val 3848401352 ecr 1370970111], length 18824
23:10:47.561187 IP 192.168.1.44.58532 > 192.168.1.45.5005: Flags [P.], seq 1127997:1141029, ack 3, win 1004, options [nop,nop,TS val 3848401352 ecr 1370970111], length 13032
23:10:47.561466 IP 192.168.1.45.5005 > 192.168.1.44.58532: Flags [.], ack 1141029, win 19475, options [nop,nop,TS val 1370970112 ecr 3848401351], length 0
23:10:47.561598 IP 192.168.1.44.58532 > 192.168.1.45.5005: Flags [.], seq 1141029:1149717, ack 3, win 1004, options [nop,nop,TS val 3848401352 ecr 1370970112], length 8688
23:10:47.561603 IP 192.168.1.45.5005 > 192.168.1.44.58532: Flags [.], ack 1149717, win 19746, options [nop,nop,TS val 1370970112 ecr 3848401352], length 0
23:10:47.561649 IP 192.168.1.44.58532 > 192.168.1.45.5005: Flags [.], seq 1149717:1171437, ack 3, win 1004, options [nop,nop,TS val 3848401352 ecr 1370970112], length 21720
23:10:47.561654 IP 192.168.1.45.5005 > 192.168.1.44.58532: Flags [.], ack 1171437, win 20425, options [nop,nop,TS val 1370970112 ecr 3848401352], length 0
23:10:47.561690 IP 192.168.1.44.58532 > 192.168.1.45.5005: Flags [.], seq 1171437:1193157, ack 3, win 1004, options [nop,nop,TS val 3848401352 ecr 1370970112], length 21720
23:10:47.561695 IP 192.168.1.45.5005 > 192.168.1.44.58532: Flags [.], ack 1193157, win 21104, options [nop,nop,TS val 1370970112 ecr 3848401352], length 0
23:10:47.561726 IP 192.168.1.44.58532 > 192.168.1.45.5005: Flags [P.], seq 1193157:1206189, ack 3, win 1004, options [nop,nop,TS val 3848401352 ecr 1370970112], length 13032
23:10:47.561729 IP 192.168.1.45.5005 > 192.168.1.44.58532: Flags [.], ack 1206189, win 21511, options [nop,nop,TS val 1370970112 ecr 3848401352], length 0
23:10:47.561743 IP 192.168.1.44.58532 > 192.168.1.45.5005: Flags [.], seq 1206189:1219221, ack 3, win 1004, options [nop,nop,TS val 3848401352 ecr 1370970112], length 13032
23:10:47.561745 IP 192.168.1.45.5005 > 192.168.1.44.58532: Flags [.], ack 1219221, win 21918, options [nop,nop,TS val 1370970112 ecr 3848401352], length 0
23:10:47.561771 IP 192.168.1.44.58532 > 192.168.1.45.5005: Flags [.], seq 1219221:1230805, ack 3, win 1004, options [nop,nop,TS val 3848401352 ecr 1370970112], length 11584
23:10:47.561773 IP 192.168.1.45.5005 > 192.168.1.44.58532: Flags [.], ack 1230805, win 22280, options [nop,nop,TS val 1370970112 ecr 3848401352], length 0
23:10:47.561801 IP 192.168.1.44.58532 > 192.168.1.45.5005: Flags [.], seq 1230805:1245285, ack 3, win 1004, options [nop,nop,TS val 3848401352 ecr 1370970112], length 14480
23:10:47.561803 IP 192.168.1.45.5005 > 192.168.1.44.58532: Flags [.], ack 1245285, win 22733, options [nop,nop,TS val 1370970112 ecr 3848401352], length 0
23:10:47.561832 IP 192.168.1.44.58532 > 192.168.1.45.5005: Flags [.], seq 1245285:1259765, ack 3, win 1004, options [nop,nop,TS val 3848401352 ecr 1370970112], length 14480
23:10:47.561835 IP 192.168.1.45.5005 > 192.168.1.44.58532: Flags [.], ack 1259765, win 23185, options [nop,nop,TS val 1370970112 ecr 3848401352], length 0
23:10:47.561856 IP 192.168.1.44.58532 > 192.168.1.45.5005: Flags [P.], seq 1259765:1271349, ack 3, win 1004, options [nop,nop,TS val 3848401352 ecr 1370970112], length 11584
23:10:47.561858 IP 192.168.1.45.5005 > 192.168.1.44.58532: Flags [.], ack 1271349, win 23280, options [nop,nop,TS val 1370970112 ecr 3848401352], length 0
23:10:47.561867 IP 192.168.1.44.58532 > 192.168.1.45.5005: Flags [.], seq 1271349:1277141, ack 3, win 1004, options [nop,nop,TS val 3848401352 ecr 1370970112], length 5792
23:10:47.561898 IP 192.168.1.44.58532 > 192.168.1.45.5005: Flags [.], seq 1277141:1287277, ack 3, win 1004, options [nop,nop,TS val 3848401352 ecr 1370970112], length 10136
23:10:47.561920 IP 192.168.1.44.58532 > 192.168.1.45.5005: Flags [.], seq 1287277:1295965, ack 3, win 1004, options [nop,nop,TS val 3848401352 ecr 1370970112], length 8688
23:10:47.561950 IP 192.168.1.44.58532 > 192.168.1.45.5005: Flags [.], seq 1295965:1306101, ack 3, win 1004, options [nop,nop,TS val 3848401352 ecr 1370970112], length 10136
23:10:47.561976 IP 192.168.1.44.58532 > 192.168.1.45.5005: Flags [.], seq 1306101:1317685, ack 3, win 1004, options [nop,nop,TS val 3848401352 ecr 1370970112], length 11584
23:10:47.562001 IP 192.168.1.44.58532 > 192.168.1.45.5005: Flags [.], seq 1317685:1332165, ack 3, win 1004, options [nop,nop,TS val 3848401352 ecr 1370970112], length 14480
23:10:47.562027 IP 192.168.1.44.58532 > 192.168.1.45.5005: Flags [P.], seq 1332165:1336509, ack 3, win 1004, options [nop,nop,TS val 3848401352 ecr 1370970112], length 4344
23:10:47.562027 IP 192.168.1.44.58532 > 192.168.1.45.5005: Flags [.], seq 1336509:1346645, ack 3, win 1004, options [nop,nop,TS val 3848401352 ecr 1370970112], length 10136
23:10:47.562054 IP 192.168.1.44.58532 > 192.168.1.45.5005: Flags [.], seq 1346645:1362573, ack 3, win 1004, options [nop,nop,TS val 3848401352 ecr 1370970112], length 15928
23:10:47.562078 IP 192.168.1.44.58532 > 192.168.1.45.5005: Flags [.], seq 1362573:1377053, ack 3, win 1004, options [nop,nop,TS val 3848401352 ecr 1370970112], length 14480
23:10:47.562103 IP 192.168.1.44.58532 > 192.168.1.45.5005: Flags [P.], seq 1377053:1378501, ack 3, win 1004, options [nop,nop,TS val 3848401352 ecr 1370970112], length 1448
23:10:47.562103 IP 192.168.1.44.58532 > 192.168.1.45.5005: Flags [P.], seq 1378501:1387189, ack 3, win 1004, options [nop,nop,TS val 3848401353 ecr 1370970112], length 8688
23:10:47.562103 IP 192.168.1.44.58532 > 192.168.1.45.5005: Flags [.], seq 1387189:1390085, ack 3, win 1004, options [nop,nop,TS val 3848401353 ecr 1370970112], length 2896
23:10:47.562125 IP 192.168.1.44.58532 > 192.168.1.45.5005: Flags [P.], seq 1390085:1401669, ack 3, win 1004, options [nop,nop,TS val 3848401353 ecr 1370970112], length 11584
23:10:47.562131 IP 192.168.1.44.58532 > 192.168.1.45.5005: Flags [.], seq 1401669:1406013, ack 3, win 1004, options [nop,nop,TS val 3848401353 ecr 1370970112], length 4344
23:10:47.562157 IP 192.168.1.44.58532 > 192.168.1.45.5005: Flags [P.], seq 1406013:1410357, ack 3, win 1004, options [nop,nop,TS val 3848401353 ecr 1370970112], length 4344
23:10:47.562157 IP 192.168.1.44.58532 > 192.168.1.45.5005: Flags [.], seq 1410357:1420493, ack 3, win 1004, options [nop,nop,TS val 3848401353 ecr 1370970112], length 10136
23:10:47.562178 IP 192.168.1.44.58532 > 192.168.1.45.5005: Flags [P.], seq 1420493:1432077, ack 3, win 1004, options [nop,nop,TS val 3848401353 ecr 1370970112], length 11584
23:10:47.562187 IP 192.168.1.44.58532 > 192.168.1.45.5005: Flags [.], seq 1432077:1434973, ack 3, win 1004, options [nop,nop,TS val 3848401353 ecr 1370970112], length 2896
23:10:47.562207 IP 192.168.1.44.58532 > 192.168.1.45.5005: Flags [P.], seq 1434973:1446557, ack 3, win 1004, options [nop,nop,TS val 3848401353 ecr 1370970112], length 11584
23:10:47.562212 IP 192.168.1.44.58532 > 192.168.1.45.5005: Flags [.], seq 1446557:1448005, ack 3, win 1004, options [nop,nop,TS val 3848401353 ecr 1370970112], length 1448
23:10:47.562239 IP 192.168.1.44.58532 > 192.168.1.45.5005: Flags [P.], seq 1448005:1459589, ack 3, win 1004, options [nop,nop,TS val 3848401353 ecr 1370970112], length 11584
23:10:47.562246 IP 192.168.1.44.58532 > 192.168.1.45.5005: Flags [P.], seq 1459589:1466829, ack 3, win 1004, options [nop,nop,TS val 3848401353 ecr 1370970112], length 7240
23:10:47.562275 IP 192.168.1.44.58532 > 192.168.1.45.5005: Flags [P.], seq 1466829:1472621, ack 3, win 1004, options [nop,nop,TS val 3848401353 ecr 1370970112], length 5792
23:10:47.562275 IP 192.168.1.44.58532 > 192.168.1.45.5005: Flags [.], seq 1472621:1481309, ack 3, win 1004, options [nop,nop,TS val 3848401353 ecr 1370970112], length 8688
23:10:47.562298 IP 192.168.1.44.58532 > 192.168.1.45.5005: Flags [P.], seq 1481309:1487101, ack 3, win 1004, options [nop,nop,TS val 3848401353 ecr 1370970112], length 5792
23:10:47.562449 IP 192.168.1.45.5005 > 192.168.1.44.58532: Flags [.], ack 1487101, win 23280, options [nop,nop,TS val 1370970113 ecr 3848401352], length 0
23:10:47.562521 IP 192.168.1.44.58532 > 192.168.1.45.5005: Flags [.], seq 1487101:1492893, ack 3, win 1004, options [nop,nop,TS val 3848401353 ecr 1370970113], length 5792
23:10:47.562524 IP 192.168.1.45.5005 > 192.168.1.44.58532: Flags [.], ack 1492893, win 23461, options [nop,nop,TS val 1370970113 ecr 3848401353], length 0
23:10:47.562554 IP 192.168.1.44.58532 > 192.168.1.45.5005: Flags [.], seq 1492893:1508821, ack 3, win 1004, options [nop,nop,TS val 3848401353 ecr 1370970113], length 15928
23:10:47.562557 IP 192.168.1.45.5005 > 192.168.1.44.58532: Flags [.], ack 1508821, win 23959, options [nop,nop,TS val 1370970113 ecr 3848401353], length 0
23:10:47.562586 IP 192.168.1.44.58532 > 192.168.1.45.5005: Flags [.], seq 1508821:1523301, ack 3, win 1004, options [nop,nop,TS val 3848401353 ecr 1370970113], length 14480
23:10:47.562588 IP 192.168.1.45.5005 > 192.168.1.44.58532: Flags [.], ack 1523301, win 24411, options [nop,nop,TS val 1370970113 ecr 3848401353], length 0
23:10:47.562617 IP 192.168.1.44.58532 > 192.168.1.45.5005: Flags [P.], seq 1523301:1531989, ack 3, win 1004, options [nop,nop,TS val 3848401353 ecr 1370970113], length 8688
23:10:47.562617 IP 192.168.1.44.58532 > 192.168.1.45.5005: Flags [.], seq 1531989:1537781, ack 3, win 1004, options [nop,nop,TS val 3848401353 ecr 1370970113], length 5792
23:10:47.562620 IP 192.168.1.45.5005 > 192.168.1.44.58532: Flags [.], ack 1531989, win 24683, options [nop,nop,TS val 1370970113 ecr 3848401353], length 0
23:10:47.562624 IP 192.168.1.45.5005 > 192.168.1.44.58532: Flags [.], ack 1537781, win 24864, options [nop,nop,TS val 1370970113 ecr 3848401353], length 0
23:10:47.562662 IP 192.168.1.44.58532 > 192.168.1.45.5005: Flags [.], seq 1537781:1556605, ack 3, win 1004, options [nop,nop,TS val 3848401353 ecr 1370970113], length 18824
23:10:47.562664 IP 192.168.1.45.5005 > 192.168.1.44.58532: Flags [.], ack 1556605, win 25452, options [nop,nop,TS val 1370970113 ecr 3848401353], length 0
23:10:47.562691 IP 192.168.1.44.58532 > 192.168.1.45.5005: Flags [.], seq 1556605:1569637, ack 3, win 1004, options [nop,nop,TS val 3848401353 ecr 1370970113], length 13032
23:10:47.562693 IP 192.168.1.45.5005 > 192.168.1.44.58532: Flags [.], ack 1569637, win 25480, options [nop,nop,TS val 1370970113 ecr 3848401353], length 0
23:10:47.562721 IP 192.168.1.44.58532 > 192.168.1.45.5005: Flags [.], seq 1569637:1584117, ack 3, win 1004, options [nop,nop,TS val 3848401353 ecr 1370970113], length 14480
23:10:47.562744 IP 192.168.1.44.58532 > 192.168.1.45.5005: Flags [.], seq 1584117:1595701, ack 3, win 1004, options [nop,nop,TS val 3848401353 ecr 1370970113], length 11584
23:10:47.562770 IP 192.168.1.44.58532 > 192.168.1.45.5005: Flags [P.], seq 1595701:1597149, ack 3, win 1004, options [nop,nop,TS val 3848401353 ecr 1370970113], length 1448
23:10:47.562770 IP 192.168.1.44.58532 > 192.168.1.45.5005: Flags [.], seq 1597149:1608733, ack 3, win 1004, options [nop,nop,TS val 3848401353 ecr 1370970113], length 11584
23:10:47.562795 IP 192.168.1.44.58532 > 192.168.1.45.5005: Flags [.], seq 1608733:1623213, ack 3, win 1004, options [nop,nop,TS val 3848401353 ecr 1370970113], length 14480
23:10:47.562904 IP 192.168.1.45.5005 > 192.168.1.44.58532: Flags [.], ack 1623213, win 25480, options [nop,nop,TS val 1370970113 ecr 3848401353], length 0
23:10:47.562954 IP 192.168.1.44.58532 > 192.168.1.45.5005: Flags [P.], seq 1623213:1662309, ack 3, win 1004, options [nop,nop,TS val 3848401353 ecr 1370970113], length 39096
23:10:47.562960 IP 192.168.1.45.5005 > 192.168.1.44.58532: Flags [.], ack 1662309, win 25934, options [nop,nop,TS val 1370970113 ecr 3848401353], length 0
23:10:47.562988 IP 192.168.1.44.58532 > 192.168.1.45.5005: Flags [.], seq 1662309:1715885, ack 3, win 1004, options [nop,nop,TS val 3848401353 ecr 1370970113], length 53576
23:10:47.563100 IP 192.168.1.45.5005 > 192.168.1.44.58532: Flags [.], ack 1715885, win 25934, options [nop,nop,TS val 1370970113 ecr 3848401353], length 0
23:10:47.563139 IP 192.168.1.44.58532 > 192.168.1.45.5005: Flags [P.], seq 1715885:1727469, ack 3, win 1004, options [nop,nop,TS val 3848401353 ecr 1370970113], length 11584
23:10:47.563142 IP 192.168.1.45.5005 > 192.168.1.44.58532: Flags [.], ack 1727469, win 26221, options [nop,nop,TS val 1370970113 ecr 3848401353], length 0
23:10:47.563155 IP 192.168.1.44.58532 > 192.168.1.45.5005: Flags [P.], seq 1727469:1741949, ack 3, win 1004, options [nop,nop,TS val 3848401353 ecr 1370970113], length 14480
23:10:47.563166 IP 192.168.1.44.58532 > 192.168.1.45.5005: Flags [P.], seq 1741949:1747741, ack 3, win 1004, options [nop,nop,TS val 3848401354 ecr 1370970113], length 5792
23:10:47.563166 IP 192.168.1.44.58532 > 192.168.1.45.5005: Flags [P.], seq 1747741:1763669, ack 3, win 1004, options [nop,nop,TS val 3848401354 ecr 1370970113], length 15928
23:10:47.563172 IP 192.168.1.44.58532 > 192.168.1.45.5005: Flags [P.], seq 1763669:1779597, ack 3, win 1004, options [nop,nop,TS val 3848401354 ecr 1370970113], length 15928
23:10:47.563181 IP 192.168.1.44.58532 > 192.168.1.45.5005: Flags [P.], seq 1779597:1788285, ack 3, win 1004, options [nop,nop,TS val 3848401354 ecr 1370970113], length 8688
23:10:47.563181 IP 192.168.1.44.58532 > 192.168.1.45.5005: Flags [P.], seq 1788285:1792629, ack 3, win 1004, options [nop,nop,TS val 3848401354 ecr 1370970113], length 4344
23:10:47.563189 IP 192.168.1.44.58532 > 192.168.1.45.5005: Flags [.], seq 1792629:1808557, ack 3, win 1004, options [nop,nop,TS val 3848401354 ecr 1370970113], length 15928
23:10:47.563298 IP 192.168.1.45.5005 > 192.168.1.44.58532: Flags [.], ack 1808557, win 26221, options [nop,nop,TS val 1370970113 ecr 3848401353], length 0
23:10:47.563353 IP 192.168.1.44.58532 > 192.168.1.45.5005: Flags [P.], seq 1808557:1857789, ack 3, win 1004, options [nop,nop,TS val 3848401354 ecr 1370970113], length 49232
23:10:47.563377 IP 192.168.1.44.58532 > 192.168.1.45.5005: Flags [.], seq 1857789:1901229, ack 3, win 1004, options [nop,nop,TS val 3848401354 ecr 1370970113], length 43440
23:10:47.563489 IP 192.168.1.45.5005 > 192.168.1.44.58532: Flags [.], ack 1901229, win 26221, options [nop,nop,TS val 1370970114 ecr 3848401354], length 0
23:10:47.563517 IP 192.168.1.44.58532 > 192.168.1.45.5005: Flags [P.], seq 1901229:1922949, ack 3, win 1004, options [nop,nop,TS val 3848401354 ecr 1370970113], length 21720
23:10:47.563565 IP 192.168.1.44.58532 > 192.168.1.45.5005: Flags [P.], seq 1922949:1988109, ack 3, win 1004, options [nop,nop,TS val 3848401354 ecr 1370970113], length 65160
23:10:47.563574 IP 192.168.1.44.58532 > 192.168.1.45.5005: Flags [.], seq 1988109:1993901, ack 3, win 1004, options [nop,nop,TS val 3848401354 ecr 1370970113], length 5792
23:10:47.563705 IP 192.168.1.45.5005 > 192.168.1.44.58532: Flags [.], ack 1993901, win 26221, options [nop,nop,TS val 1370970114 ecr 3848401354], length 0
23:10:47.563788 IP 192.168.1.44.58532 > 192.168.1.45.5005: Flags [P.], seq 1993901:2053269, ack 3, win 1004, options [nop,nop,TS val 3848401354 ecr 1370970113], length 59368
23:10:47.563807 IP 192.168.1.44.58532 > 192.168.1.45.5005: Flags [.], seq 2053269:2086573, ack 3, win 1004, options [nop,nop,TS val 3848401355 ecr 1370970114], length 33304
23:10:47.563938 IP 192.168.1.45.5005 > 192.168.1.44.58532: Flags [.], ack 2086573, win 26221, options [nop,nop,TS val 1370970114 ecr 3848401354], length 0
23:10:47.563989 IP 192.168.1.44.58532 > 192.168.1.45.5005: Flags [P.], seq 2086573:2118429, ack 3, win 1004, options [nop,nop,TS val 3848401355 ecr 1370970114], length 31856
23:10:47.564022 IP 192.168.1.44.58532 > 192.168.1.45.5005: Flags [.], seq 2118429:2179245, ack 3, win 1004, options [nop,nop,TS val 3848401355 ecr 1370970114], length 60816
23:10:47.564178 IP 192.168.1.45.5005 > 192.168.1.44.58532: Flags [.], ack 2179245, win 26221, options [nop,nop,TS val 1370970114 ecr 3848401355], length 0
23:10:47.564240 IP 192.168.1.44.58532 > 192.168.1.45.5005: Flags [P.], seq 2179245:2183589, ack 3, win 1004, options [nop,nop,TS val 3848401355 ecr 1370970114], length 4344
23:10:47.564240 IP 192.168.1.44.58532 > 192.168.1.45.5005: Flags [P.], seq 2183589:2248749, ack 3, win 1004, options [nop,nop,TS val 3848401355 ecr 1370970114], length 65160
23:10:47.564249 IP 192.168.1.45.5005 > 192.168.1.44.58532: Flags [.], ack 2183589, win 26296, options [nop,nop,TS val 1370970114 ecr 3848401355], length 0
23:10:47.564264 IP 192.168.1.44.58532 > 192.168.1.45.5005: Flags [.], seq 2248749:2271917, ack 3, win 1004, options [nop,nop,TS val 3848401355 ecr 1370970114], length 23168
23:10:47.564372 IP 192.168.1.45.5005 > 192.168.1.44.58532: Flags [.], ack 2271917, win 26296, options [nop,nop,TS val 1370970115 ecr 3848401355], length 0
23:10:47.564414 IP 192.168.1.44.58532 > 192.168.1.45.5005: Flags [P.], seq 2271917:2313909, ack 3, win 1004, options [nop,nop,TS val 3848401355 ecr 1370970114], length 41992
23:10:47.564429 IP 192.168.1.44.58532 > 192.168.1.45.5005: Flags [R.], seq 2313909, ack 3, win 1004, options [nop,nop,TS val 3848401355 ecr 1370970114], length 0
23:10:47.564429 IP 192.168.1.44.58532 > 192.168.1.45.5005: Flags [R], seq 1855330617, win 0, length 0
23:10:47.564429 IP 192.168.1.44.58532 > 192.168.1.45.5005: Flags [R], seq 1855334961, win 0, length 0
23:10:47.564429 IP 192.168.1.44.58532 > 192.168.1.45.5005: Flags [R], seq 1855423289, win 0, length 0

306 packets captured
306 packets received by filter
0 packets dropped by kernel
