tcpdump: verbose output suppressed, use -v[v]... for full protocol decode
listening on enp0s8, link-type EN10MB (Ethernet), snapshot length 262144 bytes
02:11:01.124814 IP 192.168.1.74.39420 > 192.168.1.45.5005: Flags [S], seq 1165318726, win 64240, options [mss 1460,sackOK,TS val 223657137 ecr 0,nop,wscale 6], length 0
02:11:01.124836 IP 192.168.1.45.5005 > 192.168.1.74.39420: Flags [S.], seq 4426399, ack 1165318727, win 65160, options [mss 1460,sackOK,TS val 1988616462 ecr 223657137,nop,wscale 6], length 0
02:11:01.125048 IP 192.168.1.74.39420 > 192.168.1.45.5005: Flags [.], ack 1, win 1004, options [nop,nop,TS val 223657137 ecr 1988616462], length 0
02:11:01.126133 IP 192.168.1.74.39420 > 192.168.1.45.5005: Flags [P.], seq 1:5, ack 1, win 1004, options [nop,nop,TS val 223657138 ecr 1988616462], length 4
02:11:01.126147 IP 192.168.1.45.5005 > 192.168.1.74.39420: Flags [.], ack 5, win 1019, options [nop,nop,TS val 1988616463 ecr 223657138], length 0
02:11:01.126446 IP 192.168.1.45.5005 > 192.168.1.74.39420: Flags [P.], seq 1:3, ack 5, win 1019, options [nop,nop,TS val 1988616464 ecr 223657138], length 2
02:11:01.126582 IP 192.168.1.74.39420 > 192.168.1.45.5005: Flags [.], ack 3, win 1004, options [nop,nop,TS val 223657138 ecr 1988616464], length 0
02:11:01.126831 IP 192.168.1.74.39420 > 192.168.1.45.5005: Flags [P.], seq 5:7245, ack 3, win 1004, options [nop,nop,TS val 223657138 ecr 1988616464], length 7240
02:11:01.126831 IP 192.168.1.74.39420 > 192.168.1.45.5005: Flags [P.], seq 7245:14485, ack 3, win 1004, options [nop,nop,TS val 223657138 ecr 1988616464], length 7240
02:11:01.134806 IP 192.168.1.74.39420 > 192.168.1.45.5005: Flags [.], seq 14485:15933, ack 3, win 1004, options [nop,nop,TS val 223657146 ecr 1988616464], length 1448
02:11:01.168736 IP 192.168.1.45.5005 > 192.168.1.74.39420: Flags [.], ack 15933, win 857, options [nop,nop,TS val 1988616506 ecr 223657138], length 0
02:11:01.169519 IP 192.168.1.74.39420 > 192.168.1.45.5005: Flags [P.], seq 15933:26069, ack 3, win 1004, options [nop,nop,TS val 223657181 ecr 1988616506], length 10136
02:11:01.169519 IP 192.168.1.74.39420 > 192.168.1.45.5005: Flags [.], seq 26069:30413, ack 3, win 1004, options [nop,nop,TS val 223657181 ecr 1988616506], length 4344
02:11:01.169549 IP 192.168.1.45.5005 > 192.168.1.74.39420: Flags [.], ack 26069, win 752, options [nop,nop,TS val 1988616507 ecr 223657181], length 0
02:11:01.169584 IP 192.168.1.45.5005 > 192.168.1.74.39420: Flags [.], ack 30413, win 705, options [nop,nop,TS val 1988616507 ecr 223657181], length 0
02:11:01.169672 IP 192.168.1.74.39420 > 192.168.1.45.5005: Flags [P.], seq 30413:36205, ack 3, win 1004, options [nop,nop,TS val 223657181 ecr 1988616506], length 5792
02:11:01.169672 IP 192.168.1.74.39420 > 192.168.1.45.5005: Flags [P.], seq 36205:46341, ack 3, win 1004, options [nop,nop,TS val 223657181 ecr 1988616506], length 10136
02:11:01.169682 IP 192.168.1.45.5005 > 192.168.1.74.39420: Flags [.], ack 36205, win 645, options [nop,nop,TS val 1988616507 ecr 223657181], length 0
02:11:01.169695 IP 192.168.1.45.5005 > 192.168.1.74.39420: Flags [.], ack 46341, win 540, options [nop,nop,TS val 1988616507 ecr 223657181], length 0
02:11:01.170127 IP 192.168.1.74.39420 > 192.168.1.45.5005: Flags [.], seq 46341:59373, ack 3, win 1004, options [nop,nop,TS val 223657182 ecr 1988616507], length 13032
02:11:01.170239 IP 192.168.1.74.39420 > 192.168.1.45.5005: Flags [P.], seq 59373:62269, ack 3, win 1004, options [nop,nop,TS val 223657182 ecr 1988616507], length 2896
02:11:01.170239 IP 192.168.1.74.39420 > 192.168.1.45.5005: Flags [P.], seq 62269:66613, ack 3, win 1004, options [nop,nop,TS val 223657182 ecr 1988616507], length 4344
02:11:01.170239 IP 192.168.1.74.39420 > 192.168.1.45.5005: Flags [P.], seq 66613:75301, ack 3, win 1004, options [nop,nop,TS val 223657182 ecr 1988616507], length 8688
02:11:01.170281 IP 192.168.1.74.39420 > 192.168.1.45.5005: Flags [P.], seq 75301:77485, ack 3, win 1004, options [nop,nop,TS val 223657182 ecr 1988616507], length 2184
02:11:01.170281 IP 192.168.1.74.39420 > 192.168.1.45.5005: Flags [P.], seq 77485:78197, ack 3, win 1004, options [nop,nop,TS val 223657182 ecr 1988616507], length 712
02:11:01.170281 IP 192.168.1.74.39420 > 192.168.1.45.5005: Flags [.], seq 78197:79645, ack 3, win 1004, options [nop,nop,TS val 223657182 ecr 1988616507], length 1448
02:11:01.186222 IP 192.168.1.74.39420 > 192.168.1.45.5005: Flags [.], seq 78197:79645, ack 3, win 1004, options [nop,nop,TS val 223657198 ecr 1988616507], length 1448
02:11:01.212684 IP 192.168.1.45.5005 > 192.168.1.74.39420: Flags [.], ack 79645, win 176, options [nop,nop,TS val 1988616550 ecr 223657182,nop,nop,sack 1 {78197:79645}], length 0
02:11:01.213511 IP 192.168.1.74.39420 > 192.168.1.45.5005: Flags [P.], seq 79645:90909, ack 3, win 1004, options [nop,nop,TS val 223657225 ecr 1988616550], length 11264
02:11:01.234173 IP 192.168.1.74.39420 > 192.168.1.45.5005: Flags [.], seq 89781:90909, ack 3, win 1004, options [nop,nop,TS val 223657246 ecr 1988616550], length 1128
02:11:01.256660 IP 192.168.1.45.5005 > 192.168.1.74.39420: Flags [.], ack 90909, win 0, options [nop,nop,TS val 1988616594 ecr 223657225,nop,nop,sack 1 {89781:90909}], length 0
02:11:01.474160 IP 192.168.1.74.39420 > 192.168.1.45.5005: Flags [.], ack 3, win 1004, options [nop,nop,TS val 223657486 ecr 1988616594], length 0
02:11:01.474188 IP 192.168.1.45.5005 > 192.168.1.74.39420: Flags [.], ack 90909, win 0, options [nop,nop,TS val 1988616811 ecr 223657225], length 0
02:11:01.914229 IP 192.168.1.74.39420 > 192.168.1.45.5005: Flags [.], ack 3, win 1004, options [nop,nop,TS val 223657926 ecr 1988616811], length 0
02:11:02.810224 IP 192.168.1.74.39420 > 192.168.1.45.5005: Flags [.], ack 3, win 1004, options [nop,nop,TS val 223658822 ecr 1988616811], length 0
02:11:02.810250 IP 192.168.1.45.5005 > 192.168.1.74.39420: Flags [.], ack 90909, win 0, options [nop,nop,TS val 1988618147 ecr 223657225], length 0
02:11:04.570357 IP 192.168.1.74.39420 > 192.168.1.45.5005: Flags [.], ack 3, win 1004, options [nop,nop,TS val 223660582 ecr 1988618147], length 0
02:11:04.570384 IP 192.168.1.45.5005 > 192.168.1.74.39420: Flags [.], ack 90909, win 0, options [nop,nop,TS val 1988619907 ecr 223657225], length 0
02:11:08.282061 IP 192.168.1.74.39420 > 192.168.1.45.5005: Flags [.], ack 3, win 1004, options [nop,nop,TS val 223664294 ecr 1988619907], length 0
02:11:08.282088 IP 192.168.1.45.5005 > 192.168.1.74.39420: Flags [.], ack 90909, win 0, options [nop,nop,TS val 1988623619 ecr 223657225], length 0
02:11:15.450059 IP 192.168.1.74.39420 > 192.168.1.45.5005: Flags [.], ack 3, win 1004, options [nop,nop,TS val 223671462 ecr 1988623619], length 0
02:11:15.450087 IP 192.168.1.45.5005 > 192.168.1.74.39420: Flags [.], ack 90909, win 0, options [nop,nop,TS val 1988630787 ecr 223657225], length 0
02:11:16.126958 IP 192.168.1.45.5005 > 192.168.1.74.39420: Flags [.], ack 90909, win 1002, options [nop,nop,TS val 1988631464 ecr 223657225], length 0
02:11:16.127951 IP 192.168.1.74.39420 > 192.168.1.45.5005: Flags [P.], seq 90909:98149, ack 3, win 1004, options [nop,nop,TS val 223672140 ecr 1988631464], length 7240
02:11:16.127951 IP 192.168.1.74.39420 > 192.168.1.45.5005: Flags [P.], seq 98149:105389, ack 3, win 1004, options [nop,nop,TS val 223672140 ecr 1988631464], length 7240
02:11:16.127991 IP 192.168.1.45.5005 > 192.168.1.74.39420: Flags [.], ack 98149, win 1228, options [nop,nop,TS val 1988631465 ecr 223672140], length 0
02:11:16.128019 IP 192.168.1.45.5005 > 192.168.1.74.39420: Flags [.], ack 105389, win 1454, options [nop,nop,TS val 1988631465 ecr 223672140], length 0
02:11:16.128409 IP 192.168.1.74.39420 > 192.168.1.45.5005: Flags [P.], seq 105389:108285, ack 3, win 1004, options [nop,nop,TS val 223672140 ecr 1988631465], length 2896
02:11:16.128410 IP 192.168.1.74.39420 > 192.168.1.45.5005: Flags [P.], seq 108285:110053, ack 3, win 1004, options [nop,nop,TS val 223672140 ecr 1988631465], length 1768
02:11:16.128410 IP 192.168.1.74.39420 > 192.168.1.45.5005: Flags [P.], seq 110053:112949, ack 3, win 1004, options [nop,nop,TS val 223672140 ecr 1988631465], length 2896
02:11:16.128425 IP 192.168.1.45.5005 > 192.168.1.74.39420: Flags [.], ack 108285, win 1545, options [nop,nop,TS val 1988631466 ecr 223672140], length 0
02:11:16.128463 IP 192.168.1.45.5005 > 192.168.1.74.39420: Flags [.], ack 110053, win 1600, options [nop,nop,TS val 1988631466 ecr 223672140], length 0
02:11:16.128549 IP 192.168.1.45.5005 > 192.168.1.74.39420: Flags [.], ack 112949, win 1690, options [nop,nop,TS val 1988631466 ecr 223672140], length 0
02:11:16.128721 IP 192.168.1.74.39420 > 192.168.1.45.5005: Flags [P.], seq 112949:115845, ack 3, win 1004, options [nop,nop,TS val 223672141 ecr 1988631465], length 2896
02:11:16.128721 IP 192.168.1.74.39420 > 192.168.1.45.5005: Flags [P.], seq 115845:120189, ack 3, win 1004, options [nop,nop,TS val 223672141 ecr 1988631465], length 4344
02:11:16.128721 IP 192.168.1.74.39420 > 192.168.1.45.5005: Flags [P.], seq 120189:124533, ack 3, win 1004, options [nop,nop,TS val 223672141 ecr 1988631465], length 4344
02:11:16.128734 IP 192.168.1.45.5005 > 192.168.1.74.39420: Flags [.], ack 115845, win 1781, options [nop,nop,TS val 1988631466 ecr 223672141], length 0
02:11:16.128758 IP 192.168.1.45.5005 > 192.168.1.74.39420: Flags [.], ack 120189, win 1917, options [nop,nop,TS val 1988631466 ecr 223672141], length 0
02:11:16.128773 IP 192.168.1.45.5005 > 192.168.1.74.39420: Flags [.], ack 124533, win 2052, options [nop,nop,TS val 1988631466 ecr 223672141], length 0
02:11:16.128817 IP 192.168.1.74.39420 > 192.168.1.45.5005: Flags [P.], seq 124533:128877, ack 3, win 1004, options [nop,nop,TS val 223672141 ecr 1988631466], length 4344
02:11:16.128817 IP 192.168.1.74.39420 > 192.168.1.45.5005: Flags [P.], seq 128877:134669, ack 3, win 1004, options [nop,nop,TS val 223672141 ecr 1988631466], length 5792
02:11:16.128829 IP 192.168.1.45.5005 > 192.168.1.74.39420: Flags [.], ack 128877, win 2188, options [nop,nop,TS val 1988631466 ecr 223672141], length 0
02:11:16.128851 IP 192.168.1.45.5005 > 192.168.1.74.39420: Flags [.], ack 134669, win 2369, options [nop,nop,TS val 1988631466 ecr 223672141], length 0
02:11:16.128973 IP 192.168.1.74.39420 > 192.168.1.45.5005: Flags [P.], seq 134669:139013, ack 3, win 1004, options [nop,nop,TS val 223672141 ecr 1988631466], length 4344
02:11:16.128974 IP 192.168.1.74.39420 > 192.168.1.45.5005: Flags [P.], seq 139013:141909, ack 3, win 1004, options [nop,nop,TS val 223672141 ecr 1988631466], length 2896
02:11:16.128974 IP 192.168.1.74.39420 > 192.168.1.45.5005: Flags [.], seq 141909:143357, ack 3, win 1004, options [nop,nop,TS val 223672141 ecr 1988631466], length 1448
02:11:16.128986 IP 192.168.1.45.5005 > 192.168.1.74.39420: Flags [.], ack 139013, win 2505, options [nop,nop,TS val 1988631466 ecr 223672141], length 0
02:11:16.129012 IP 192.168.1.45.5005 > 192.168.1.74.39420: Flags [.], ack 141909, win 2595, options [nop,nop,TS val 1988631466 ecr 223672141], length 0
02:11:16.129037 IP 192.168.1.45.5005 > 192.168.1.74.39420: Flags [.], ack 143357, win 2641, options [nop,nop,TS val 1988631466 ecr 223672141], length 0
02:11:16.129143 IP 192.168.1.74.39420 > 192.168.1.45.5005: Flags [P.], seq 143357:150597, ack 3, win 1004, options [nop,nop,TS val 223672141 ecr 1988631466], length 7240
02:11:16.129143 IP 192.168.1.74.39420 > 192.168.1.45.5005: Flags [P.], seq 150597:156389, ack 3, win 1004, options [nop,nop,TS val 223672141 ecr 1988631466], length 5792
02:11:16.129156 IP 192.168.1.45.5005 > 192.168.1.74.39420: Flags [.], ack 150597, win 2867, options [nop,nop,TS val 1988631466 ecr 223672141], length 0
02:11:16.129180 IP 192.168.1.45.5005 > 192.168.1.74.39420: Flags [.], ack 156389, win 3048, options [nop,nop,TS val 1988631466 ecr 223672141], length 0
02:11:16.129242 IP 192.168.1.74.39420 > 192.168.1.45.5005: Flags [P.], seq 156389:165077, ack 3, win 1004, options [nop,nop,TS val 223672141 ecr 1988631466], length 8688
02:11:16.129242 IP 192.168.1.74.39420 > 192.168.1.45.5005: Flags [P.], seq 165077:173765, ack 3, win 1004, options [nop,nop,TS val 223672141 ecr 1988631466], length 8688
02:11:16.129255 IP 192.168.1.45.5005 > 192.168.1.74.39420: Flags [.], ack 165077, win 3319, options [nop,nop,TS val 1988631466 ecr 223672141], length 0
02:11:16.129290 IP 192.168.1.45.5005 > 192.168.1.74.39420: Flags [.], ack 173765, win 3591, options [nop,nop,TS val 1988631466 ecr 223672141], length 0
02:11:16.129342 IP 192.168.1.74.39420 > 192.168.1.45.5005: Flags [P.], seq 173765:182453, ack 3, win 1004, options [nop,nop,TS val 223672141 ecr 1988631466], length 8688
02:11:16.129343 IP 192.168.1.74.39420 > 192.168.1.45.5005: Flags [P.], seq 182453:194037, ack 3, win 1004, options [nop,nop,TS val 223672141 ecr 1988631466], length 11584
02:11:16.129356 IP 192.168.1.45.5005 > 192.168.1.74.39420: Flags [.], ack 182453, win 3862, options [nop,nop,TS val 1988631466 ecr 223672141], length 0
02:11:16.129381 IP 192.168.1.45.5005 > 192.168.1.74.39420: Flags [.], ack 194037, win 4224, options [nop,nop,TS val 1988631466 ecr 223672141], length 0
02:11:16.129414 IP 192.168.1.74.39420 > 192.168.1.45.5005: Flags [P.], seq 194037:202725, ack 3, win 1004, options [nop,nop,TS val 223672141 ecr 1988631466], length 8688
02:11:16.129414 IP 192.168.1.74.39420 > 192.168.1.45.5005: Flags [P.], seq 202725:205621, ack 3, win 1004, options [nop,nop,TS val 223672141 ecr 1988631466], length 2896
02:11:16.129423 IP 192.168.1.45.5005 > 192.168.1.74.39420: Flags [.], ack 202725, win 4496, options [nop,nop,TS val 1988631467 ecr 223672141], length 0
02:11:16.129438 IP 192.168.1.45.5005 > 192.168.1.74.39420: Flags [.], ack 205621, win 4586, options [nop,nop,TS val 1988631467 ecr 223672141], length 0
02:11:16.129567 IP 192.168.1.74.39420 > 192.168.1.45.5005: Flags [P.], seq 205621:208517, ack 3, win 1004, options [nop,nop,TS val 223672141 ecr 1988631466], length 2896
02:11:16.129567 IP 192.168.1.74.39420 > 192.168.1.45.5005: Flags [P.], seq 208517:211413, ack 3, win 1004, options [nop,nop,TS val 223672141 ecr 1988631466], length 2896
02:11:16.129567 IP 192.168.1.74.39420 > 192.168.1.45.5005: Flags [.], seq 211413:222997, ack 3, win 1004, options [nop,nop,TS val 223672141 ecr 1988631466], length 11584
02:11:16.129582 IP 192.168.1.45.5005 > 192.168.1.74.39420: Flags [.], ack 208517, win 4677, options [nop,nop,TS val 1988631467 ecr 223672141], length 0
02:11:16.129712 IP 192.168.1.74.39420 > 192.168.1.45.5005: Flags [P.], seq 222997:225893, ack 3, win 1004, options [nop,nop,TS val 223672141 ecr 1988631466], length 2896
02:11:16.129712 IP 192.168.1.74.39420 > 192.168.1.45.5005: Flags [P.], seq 225893:237477, ack 3, win 1004, options [nop,nop,TS val 223672141 ecr 1988631466], length 11584
02:11:16.129726 IP 192.168.1.45.5005 > 192.168.1.74.39420: Flags [.], ack 211413, win 4767, options [nop,nop,TS val 1988631467 ecr 223672141], length 0
02:11:16.129748 IP 192.168.1.45.5005 > 192.168.1.74.39420: Flags [.], ack 222997, win 5129, options [nop,nop,TS val 1988631467 ecr 223672141], length 0
02:11:16.129750 IP 192.168.1.45.5005 > 192.168.1.74.39420: Flags [.], ack 225893, win 5220, options [nop,nop,TS val 1988631467 ecr 223672141], length 0
02:11:16.129774 IP 192.168.1.45.5005 > 192.168.1.74.39420: Flags [.], ack 237477, win 5582, options [nop,nop,TS val 1988631467 ecr 223672141], length 0
02:11:16.129842 IP 192.168.1.74.39420 > 192.168.1.45.5005: Flags [P.], seq 237477:254853, ack 3, win 1004, options [nop,nop,TS val 223672142 ecr 1988631466], length 17376
02:11:16.129854 IP 192.168.1.45.5005 > 192.168.1.74.39420: Flags [.], ack 254853, win 6125, options [nop,nop,TS val 1988631467 ecr 223672142], length 0
02:11:16.129887 IP 192.168.1.74.39420 > 192.168.1.45.5005: Flags [P.], seq 254853:269333, ack 3, win 1004, options [nop,nop,TS val 223672142 ecr 1988631466], length 14480
02:11:16.129896 IP 192.168.1.45.5005 > 192.168.1.74.39420: Flags [.], ack 269333, win 6577, options [nop,nop,TS val 1988631467 ecr 223672142], length 0
02:11:16.129946 IP 192.168.1.74.39420 > 192.168.1.45.5005: Flags [P.], seq 269333:272229, ack 3, win 1004, options [nop,nop,TS val 223672142 ecr 1988631466], length 2896
02:11:16.129946 IP 192.168.1.74.39420 > 192.168.1.45.5005: Flags [P.], seq 272229:289605, ack 3, win 1004, options [nop,nop,TS val 223672142 ecr 1988631466], length 17376
02:11:16.129956 IP 192.168.1.45.5005 > 192.168.1.74.39420: Flags [.], ack 272229, win 6668, options [nop,nop,TS val 1988631467 ecr 223672142], length 0
02:11:16.129973 IP 192.168.1.45.5005 > 192.168.1.74.39420: Flags [.], ack 289605, win 7211, options [nop,nop,TS val 1988631467 ecr 223672142], length 0
02:11:16.130031 IP 192.168.1.74.39420 > 192.168.1.45.5005: Flags [P.], seq 289605:301189, ack 3, win 1004, options [nop,nop,TS val 223672142 ecr 1988631466], length 11584
02:11:16.130041 IP 192.168.1.45.5005 > 192.168.1.74.39420: Flags [.], ack 301189, win 7573, options [nop,nop,TS val 1988631467 ecr 223672142], length 0
02:11:16.130093 IP 192.168.1.74.39420 > 192.168.1.45.5005: Flags [.], seq 301189:309877, ack 3, win 1004, options [nop,nop,TS val 223672142 ecr 1988631466], length 8688
02:11:16.130103 IP 192.168.1.45.5005 > 192.168.1.74.39420: Flags [.], ack 309877, win 7844, options [nop,nop,TS val 1988631467 ecr 223672142], length 0
02:11:16.130247 IP 192.168.1.74.39420 > 192.168.1.45.5005: Flags [P.], seq 309877:312773, ack 3, win 1004, options [nop,nop,TS val 223672142 ecr 1988631466], length 2896
02:11:16.130247 IP 192.168.1.74.39420 > 192.168.1.45.5005: Flags [P.], seq 312773:330149, ack 3, win 1004, options [nop,nop,TS val 223672142 ecr 1988631467], length 17376
02:11:16.130261 IP 192.168.1.45.5005 > 192.168.1.74.39420: Flags [.], ack 312773, win 7935, options [nop,nop,TS val 1988631467 ecr 223672142], length 0
02:11:16.130283 IP 192.168.1.45.5005 > 192.168.1.74.39420: Flags [.], ack 330149, win 8478, options [nop,nop,TS val 1988631467 ecr 223672142], length 0
02:11:16.130333 IP 192.168.1.74.39420 > 192.168.1.45.5005: Flags [P.], seq 330149:333045, ack 3, win 1004, options [nop,nop,TS val 223672142 ecr 1988631467], length 2896
02:11:16.130333 IP 192.168.1.74.39420 > 192.168.1.45.5005: Flags [P.], seq 333045:335941, ack 3, win 1004, options [nop,nop,TS val 223672142 ecr 1988631467], length 2896
02:11:16.130333 IP 192.168.1.74.39420 > 192.168.1.45.5005: Flags [P.], seq 335941:341733, ack 3, win 1004, options [nop,nop,TS val 223672142 ecr 1988631467], length 5792
02:11:16.130344 IP 192.168.1.45.5005 > 192.168.1.74.39420: Flags [.], ack 333045, win 8568, options [nop,nop,TS val 1988631467 ecr 223672142], length 0
02:11:16.130373 IP 192.168.1.45.5005 > 192.168.1.74.39420: Flags [.], ack 335941, win 8659, options [nop,nop,TS val 1988631467 ecr 223672142], length 0
02:11:16.130391 IP 192.168.1.45.5005 > 192.168.1.74.39420: Flags [.], ack 341733, win 8840, options [nop,nop,TS val 1988631467 ecr 223672142], length 0
02:11:16.130465 IP 192.168.1.74.39420 > 192.168.1.45.5005: Flags [P.], seq 341733:364901, ack 3, win 1004, options [nop,nop,TS val 223672142 ecr 1988631467], length 23168
02:11:16.130479 IP 192.168.1.45.5005 > 192.168.1.74.39420: Flags [.], ack 364901, win 9564, options [nop,nop,TS val 1988631468 ecr 223672142], length 0
02:11:16.130556 IP 192.168.1.74.39420 > 192.168.1.45.5005: Flags [.], seq 364901:385173, ack 3, win 1004, options [nop,nop,TS val 223672142 ecr 1988631467], length 20272
02:11:16.130568 IP 192.168.1.45.5005 > 192.168.1.74.39420: Flags [.], ack 385173, win 10197, options [nop,nop,TS val 1988631468 ecr 223672142], length 0
02:11:16.131192 IP 192.168.1.74.39420 > 192.168.1.45.5005: Flags [P.], seq 385173:396757, ack 3, win 1004, options [nop,nop,TS val 223672142 ecr 1988631467], length 11584
02:11:16.131259 IP 192.168.1.45.5005 > 192.168.1.74.39420: Flags [.], ack 396757, win 10559, options [nop,nop,TS val 1988631468 ecr 223672142], length 0
02:11:16.131323 IP 192.168.1.74.39420 > 192.168.1.45.5005: Flags [P.], seq 396757:399653, ack 3, win 1004, options [nop,nop,TS val 223672142 ecr 1988631467], length 2896
02:11:16.131323 IP 192.168.1.74.39420 > 192.168.1.45.5005: Flags [P.], seq 399653:428613, ack 3, win 1004, options [nop,nop,TS val 223672142 ecr 1988631467], length 28960
02:11:16.131342 IP 192.168.1.45.5005 > 192.168.1.74.39420: Flags [.], ack 399653, win 10650, options [nop,nop,TS val 1988631468 ecr 223672142], length 0
02:11:16.131361 IP 192.168.1.45.5005 > 192.168.1.74.39420: Flags [.], ack 428613, win 11555, options [nop,nop,TS val 1988631468 ecr 223672142], length 0
02:11:16.131427 IP 192.168.1.74.39420 > 192.168.1.45.5005: Flags [P.], seq 428613:460469, ack 3, win 1004, options [nop,nop,TS val 223672142 ecr 1988631467], length 31856
02:11:16.131442 IP 192.168.1.45.5005 > 192.168.1.74.39420: Flags [.], ack 460469, win 12550, options [nop,nop,TS val 1988631469 ecr 223672142], length 0
02:11:16.131506 IP 192.168.1.74.39420 > 192.168.1.45.5005: Flags [.], seq 460469:477845, ack 3, win 1004, options [nop,nop,TS val 223672143 ecr 1988631467], length 17376
02:11:16.131518 IP 192.168.1.45.5005 > 192.168.1.74.39420: Flags [.], ack 477845, win 13093, options [nop,nop,TS val 1988631469 ecr 223672143], length 0
02:11:16.131541 IP 192.168.1.74.39420 > 192.168.1.45.5005: Flags [P.], seq 477845:492325, ack 3, win 1004, options [nop,nop,TS val 223672143 ecr 1988631467], length 14480
02:11:16.131547 IP 192.168.1.45.5005 > 192.168.1.74.39420: Flags [.], ack 492325, win 13546, options [nop,nop,TS val 1988631469 ecr 223672143], length 0
02:11:16.131598 IP 192.168.1.74.39420 > 192.168.1.45.5005: Flags [P.], seq 492325:524181, ack 3, win 1004, options [nop,nop,TS val 223672143 ecr 1988631468], length 31856
02:11:16.131608 IP 192.168.1.45.5005 > 192.168.1.74.39420: Flags [.], ack 524181, win 13416, options [nop,nop,TS val 1988631469 ecr 223672143], length 0
02:11:16.131680 IP 192.168.1.74.39420 > 192.168.1.45.5005: Flags [.], seq 524181:545901, ack 3, win 1004, options [nop,nop,TS val 223672144 ecr 1988631468], length 21720
02:11:16.131688 IP 192.168.1.45.5005 > 192.168.1.74.39420: Flags [.], ack 545901, win 13189, options [nop,nop,TS val 1988631469 ecr 223672144], length 0
02:11:16.131836 IP 192.168.1.74.39420 > 192.168.1.45.5005: Flags [P.], seq 545901:556037, ack 3, win 1004, options [nop,nop,TS val 223672144 ecr 1988631468], length 10136
02:11:16.131836 IP 192.168.1.74.39420 > 192.168.1.45.5005: Flags [.], seq 556037:573413, ack 3, win 1004, options [nop,nop,TS val 223672144 ecr 1988631468], length 17376
02:11:16.131848 IP 192.168.1.45.5005 > 192.168.1.74.39420: Flags [.], ack 556037, win 13082, options [nop,nop,TS val 1988631469 ecr 223672144], length 0
02:11:16.131861 IP 192.168.1.45.5005 > 192.168.1.74.39420: Flags [.], ack 573413, win 12900, options [nop,nop,TS val 1988631469 ecr 223672144], length 0
02:11:16.131955 IP 192.168.1.74.39420 > 192.168.1.45.5005: Flags [P.], seq 573413:587893, ack 3, win 1004, options [nop,nop,TS val 223672144 ecr 1988631468], length 14480
02:11:16.131961 IP 192.168.1.45.5005 > 192.168.1.74.39420: Flags [.], ack 587893, win 12748, options [nop,nop,TS val 1988631469 ecr 223672144], length 0
02:11:16.132007 IP 192.168.1.74.39420 > 192.168.1.45.5005: Flags [.], seq 587893:600925, ack 3, win 1004, options [nop,nop,TS val 223672144 ecr 1988631469], length 13032
02:11:16.132014 IP 192.168.1.45.5005 > 192.168.1.74.39420: Flags [.], ack 600925, win 12611, options [nop,nop,TS val 1988631469 ecr 223672144], length 0
02:11:16.132126 IP 192.168.1.74.39420 > 192.168.1.45.5005: Flags [.], seq 600925:616853, ack 3, win 1004, options [nop,nop,TS val 223672144 ecr 1988631469], length 15928
02:11:16.132133 IP 192.168.1.45.5005 > 192.168.1.74.39420: Flags [.], ack 616853, win 12444, options [nop,nop,TS val 1988631469 ecr 223672144], length 0
02:11:16.132239 IP 192.168.1.74.39420 > 192.168.1.45.5005: Flags [P.], seq 616853:619749, ack 3, win 1004, options [nop,nop,TS val 223672144 ecr 1988631469], length 2896
02:11:16.132239 IP 192.168.1.74.39420 > 192.168.1.45.5005: Flags [.], seq 619749:635677, ack 3, win 1004, options [nop,nop,TS val 223672144 ecr 1988631469], length 15928
02:11:16.132248 IP 192.168.1.45.5005 > 192.168.1.74.39420: Flags [.], ack 619749, win 12414, options [nop,nop,TS val 1988631469 ecr 223672144], length 0
02:11:16.132263 IP 192.168.1.45.5005 > 192.168.1.74.39420: Flags [.], ack 635677, win 12247, options [nop,nop,TS val 1988631469 ecr 223672144], length 0
02:11:16.132368 IP 192.168.1.74.39420 > 192.168.1.45.5005: Flags [.], seq 635677:657397, ack 3, win 1004, options [nop,nop,TS val 223672144 ecr 1988631469], length 21720
02:11:16.132376 IP 192.168.1.45.5005 > 192.168.1.74.39420: Flags [.], ack 657397, win 12020, options [nop,nop,TS val 1988631469 ecr 223672144], length 0
02:11:16.132574 IP 192.168.1.74.39420 > 192.168.1.45.5005: Flags [P.], seq 657397:684909, ack 3, win 1004, options [nop,nop,TS val 223672144 ecr 1988631469], length 27512
02:11:16.132588 IP 192.168.1.45.5005 > 192.168.1.74.39420: Flags [.], ack 684909, win 11731, options [nop,nop,TS val 1988631470 ecr 223672144], length 0
02:11:16.132623 IP 192.168.1.74.39420 > 192.168.1.45.5005: Flags [.], seq 684909:697941, ack 3, win 1004, options [nop,nop,TS val 223672144 ecr 1988631469], length 13032
02:11:16.132630 IP 192.168.1.45.5005 > 192.168.1.74.39420: Flags [.], ack 697941, win 11594, options [nop,nop,TS val 1988631470 ecr 223672144], length 0
02:11:16.132731 IP 192.168.1.74.39420 > 192.168.1.45.5005: Flags [P.], seq 697941:699389, ack 3, win 1004, options [nop,nop,TS val 223672144 ecr 1988631469], length 1448
02:11:16.132731 IP 192.168.1.74.39420 > 192.168.1.45.5005: Flags [.], seq 699389:713869, ack 3, win 1004, options [nop,nop,TS val 223672144 ecr 1988631469], length 14480
02:11:16.132740 IP 192.168.1.45.5005 > 192.168.1.74.39420: Flags [.], ack 699389, win 11579, options [nop,nop,TS val 1988631470 ecr 223672144], length 0
02:11:16.132755 IP 192.168.1.45.5005 > 192.168.1.74.39420: Flags [.], ack 713869, win 11427, options [nop,nop,TS val 1988631470 ecr 223672144], length 0
02:11:16.132843 IP 192.168.1.74.39420 > 192.168.1.45.5005: Flags [P.], seq 713869:734141, ack 3, win 1004, options [nop,nop,TS val 223672144 ecr 1988631469], length 20272
02:11:16.132851 IP 192.168.1.45.5005 > 192.168.1.74.39420: Flags [.], ack 734141, win 11215, options [nop,nop,TS val 1988631470 ecr 223672144], length 0
02:11:16.132895 IP 192.168.1.74.39420 > 192.168.1.45.5005: Flags [.], seq 734141:741381, ack 3, win 1004, options [nop,nop,TS val 223672144 ecr 1988631469], length 7240
02:11:16.132901 IP 192.168.1.45.5005 > 192.168.1.74.39420: Flags [.], ack 741381, win 11138, options [nop,nop,TS val 1988631470 ecr 223672144], length 0
02:11:16.133021 IP 192.168.1.74.39420 > 192.168.1.45.5005: Flags [P.], seq 741381:750069, ack 3, win 1004, options [nop,nop,TS val 223672144 ecr 1988631469], length 8688
02:11:16.133021 IP 192.168.1.74.39420 > 192.168.1.45.5005: Flags [.], seq 750069:757309, ack 3, win 1004, options [nop,nop,TS val 223672144 ecr 1988631469], length 7240
02:11:16.133121 IP 192.168.1.74.39420 > 192.168.1.45.5005: Flags [.], seq 757309:774685, ack 3, win 1004, options [nop,nop,TS val 223672144 ecr 1988631469], length 17376
02:11:16.133200 IP 192.168.1.74.39420 > 192.168.1.45.5005: Flags [.], seq 774685:787717, ack 3, win 1004, options [nop,nop,TS val 223672144 ecr 1988631469], length 13032
02:11:16.133284 IP 192.168.1.74.39420 > 192.168.1.45.5005: Flags [.], seq 787717:802197, ack 3, win 1004, options [nop,nop,TS val 223672144 ecr 1988631469], length 14480
02:11:16.133354 IP 192.168.1.74.39420 > 192.168.1.45.5005: Flags [P.], seq 802197:815229, ack 3, win 1004, options [nop,nop,TS val 223672144 ecr 1988631469], length 13032
02:11:16.133372 IP 192.168.1.74.39420 > 192.168.1.45.5005: Flags [.], seq 815229:816677, ack 3, win 1004, options [nop,nop,TS val 223672145 ecr 1988631470], length 1448
02:11:16.133464 IP 192.168.1.74.39420 > 192.168.1.45.5005: Flags [.], seq 816677:829709, ack 3, win 1004, options [nop,nop,TS val 223672145 ecr 1988631470], length 13032
02:11:16.133548 IP 192.168.1.74.39420 > 192.168.1.45.5005: Flags [.], seq 829709:845637, ack 3, win 1004, options [nop,nop,TS val 223672145 ecr 1988631470], length 15928
02:11:16.133650 IP 192.168.1.74.39420 > 192.168.1.45.5005: Flags [.], seq 845637:861565, ack 3, win 1004, options [nop,nop,TS val 223672145 ecr 1988631470], length 15928
02:11:16.133734 IP 192.168.1.74.39420 > 192.168.1.45.5005: Flags [P.], seq 861565:880389, ack 3, win 1004, options [nop,nop,TS val 223672145 ecr 1988631470], length 18824
02:11:16.134322 IP 192.168.1.45.5005 > 192.168.1.74.39420: Flags [.], ack 880389, win 13546, options [nop,nop,TS val 1988631471 ecr 223672144], length 0
02:11:16.134781 IP 192.168.1.74.39420 > 192.168.1.45.5005: Flags [.], seq 880389:896317, ack 3, win 1004, options [nop,nop,TS val 223672147 ecr 1988631471], length 15928
02:11:16.134786 IP 192.168.1.45.5005 > 192.168.1.74.39420: Flags [.], ack 896317, win 14044, options [nop,nop,TS val 1988631472 ecr 223672147], length 0
02:11:16.134826 IP 192.168.1.74.39420 > 192.168.1.45.5005: Flags [.], seq 896317:922381, ack 3, win 1004, options [nop,nop,TS val 223672147 ecr 1988631471], length 26064
02:11:16.134831 IP 192.168.1.45.5005 > 192.168.1.74.39420: Flags [.], ack 922381, win 14858, options [nop,nop,TS val 1988631472 ecr 223672147], length 0
02:11:16.134863 IP 192.168.1.74.39420 > 192.168.1.45.5005: Flags [P.], seq 922381:945549, ack 3, win 1004, options [nop,nop,TS val 223672147 ecr 1988631471], length 23168
02:11:16.134866 IP 192.168.1.45.5005 > 192.168.1.74.39420: Flags [.], ack 945549, win 15582, options [nop,nop,TS val 1988631472 ecr 223672147], length 0
02:11:16.134884 IP 192.168.1.74.39420 > 192.168.1.45.5005: Flags [.], seq 945549:955685, ack 3, win 1004, options [nop,nop,TS val 223672147 ecr 1988631471], length 10136
02:11:16.134887 IP 192.168.1.45.5005 > 192.168.1.74.39420: Flags [.], ack 955685, win 15899, options [nop,nop,TS val 1988631472 ecr 223672147], length 0
02:11:16.134931 IP 192.168.1.74.39420 > 192.168.1.45.5005: Flags [.], seq 955685:984645, ack 3, win 1004, options [nop,nop,TS val 223672147 ecr 1988631471], length 28960
02:11:16.134934 IP 192.168.1.45.5005 > 192.168.1.74.39420: Flags [.], ack 984645, win 16804, options [nop,nop,TS val 1988631472 ecr 223672147], length 0
02:11:16.134967 IP 192.168.1.74.39420 > 192.168.1.45.5005: Flags [.], seq 984645:1003469, ack 3, win 1004, options [nop,nop,TS val 223672147 ecr 1988631471], length 18824
02:11:16.134969 IP 192.168.1.45.5005 > 192.168.1.74.39420: Flags [.], ack 1003469, win 17392, options [nop,nop,TS val 1988631472 ecr 223672147], length 0
02:11:16.135001 IP 192.168.1.74.39420 > 192.168.1.45.5005: Flags [P.], seq 1003469:1010709, ack 3, win 1004, options [nop,nop,TS val 223672147 ecr 1988631471], length 7240
02:11:16.135001 IP 192.168.1.74.39420 > 192.168.1.45.5005: Flags [.], seq 1010709:1022293, ack 3, win 1004, options [nop,nop,TS val 223672147 ecr 1988631471], length 11584
02:11:16.135004 IP 192.168.1.45.5005 > 192.168.1.74.39420: Flags [.], ack 1010709, win 17618, options [nop,nop,TS val 1988631472 ecr 223672147], length 0
02:11:16.135008 IP 192.168.1.45.5005 > 192.168.1.74.39420: Flags [.], ack 1022293, win 17980, options [nop,nop,TS val 1988631472 ecr 223672147], length 0
02:11:16.135051 IP 192.168.1.74.39420 > 192.168.1.45.5005: Flags [.], seq 1022293:1049805, ack 3, win 1004, options [nop,nop,TS val 223672147 ecr 1988631471], length 27512
02:11:16.135058 IP 192.168.1.45.5005 > 192.168.1.74.39420: Flags [.], ack 1049805, win 18840, options [nop,nop,TS val 1988631472 ecr 223672147], length 0
02:11:16.135092 IP 192.168.1.74.39420 > 192.168.1.45.5005: Flags [P.], seq 1049805:1074421, ack 3, win 1004, options [nop,nop,TS val 223672147 ecr 1988631471], length 24616
02:11:16.135095 IP 192.168.1.45.5005 > 192.168.1.74.39420: Flags [.], ack 1074421, win 19609, options [nop,nop,TS val 1988631472 ecr 223672147], length 0
02:11:16.135105 IP 192.168.1.74.39420 > 192.168.1.45.5005: Flags [.], seq 1074421:1083109, ack 3, win 1004, options [nop,nop,TS val 223672147 ecr 1988631472], length 8688
02:11:16.135106 IP 192.168.1.45.5005 > 192.168.1.74.39420: Flags [.], ack 1083109, win 19881, options [nop,nop,TS val 1988631472 ecr 223672147], length 0
02:11:16.135143 IP 192.168.1.74.39420 > 192.168.1.45.5005: Flags [P.], seq 1083109:1090349, ack 3, win 1004, options [nop,nop,TS val 223672147 ecr 1988631472], length 7240
02:11:16.135143 IP 192.168.1.74.39420 > 192.168.1.45.5005: Flags [.], seq 1090349:1101933, ack 3, win 1004, options [nop,nop,TS val 223672147 ecr 1988631472], length 11584
02:11:16.135148 IP 192.168.1.45.5005 > 192.168.1.74.39420: Flags [.], ack 1090349, win 20107, options [nop,nop,TS val 1988631472 ecr 223672147], length 0
02:11:16.135154 IP 192.168.1.45.5005 > 192.168.1.74.39420: Flags [.], ack 1101933, win 20469, options [nop,nop,TS val 1988631472 ecr 223672147], length 0
02:11:16.135187 IP 192.168.1.74.39420 > 192.168.1.45.5005: Flags [P.], seq 1101933:1117861, ack 3, win 1004, options [nop,nop,TS val 223672147 ecr 1988631472], length 15928
02:11:16.135189 IP 192.168.1.45.5005 > 192.168.1.74.39420: Flags [.], ack 1117861, win 20967, options [nop,nop,TS val 1988631472 ecr 223672147], length 0
02:11:16.135203 IP 192.168.1.74.39420 > 192.168.1.45.5005: Flags [P.], seq 1117861:1141029, ack 3, win 1004, options [nop,nop,TS val 223672147 ecr 1988631472], length 23168
02:11:16.135206 IP 192.168.1.45.5005 > 192.168.1.74.39420: Flags [.], ack 1141029, win 21691, options [nop,nop,TS val 1988631472 ecr 223672147], length 0
02:11:16.135214 IP 192.168.1.74.39420 > 192.168.1.45.5005: Flags [.], seq 1141029:1145373, ack 3, win 1004, options [nop,nop,TS val 223672147 ecr 1988631472], length 4344
02:11:16.135216 IP 192.168.1.45.5005 > 192.168.1.74.39420: Flags [.], ack 1145373, win 21827, options [nop,nop,TS val 1988631472 ecr 223672147], length 0
02:11:16.135430 IP 192.168.1.74.39420 > 192.168.1.45.5005: Flags [P.], seq 1145373:1206189, ack 3, win 1004, options [nop,nop,TS val 223672147 ecr 1988631472], length 60816
02:11:16.135438 IP 192.168.1.45.5005 > 192.168.1.74.39420: Flags [.], ack 1206189, win 23727, options [nop,nop,TS val 1988631473 ecr 223672147], length 0
02:11:16.135463 IP 192.168.1.74.39420 > 192.168.1.45.5005: Flags [.], seq 1206189:1238045, ack 3, win 1004, options [nop,nop,TS val 223672147 ecr 1988631472], length 31856
02:11:16.135470 IP 192.168.1.45.5005 > 192.168.1.74.39420: Flags [.], ack 1238045, win 24723, options [nop,nop,TS val 1988631473 ecr 223672147], length 0
02:11:16.135623 IP 192.168.1.74.39420 > 192.168.1.45.5005: Flags [P.], seq 1238045:1271349, ack 3, win 1004, options [nop,nop,TS val 223672147 ecr 1988631472], length 33304
02:11:16.135628 IP 192.168.1.45.5005 > 192.168.1.74.39420: Flags [.], ack 1271349, win 25763, options [nop,nop,TS val 1988631473 ecr 223672147], length 0
02:11:16.135640 IP 192.168.1.74.39420 > 192.168.1.45.5005: Flags [P.], seq 1271349:1277141, ack 3, win 1004, options [nop,nop,TS val 223672147 ecr 1988631472], length 5792
02:11:16.135640 IP 192.168.1.74.39420 > 192.168.1.45.5005: Flags [P.], seq 1277141:1294517, ack 3, win 1004, options [nop,nop,TS val 223672147 ecr 1988631472], length 17376
02:11:16.135643 IP 192.168.1.45.5005 > 192.168.1.74.39420: Flags [.], ack 1277141, win 25933, options [nop,nop,TS val 1988631473 ecr 223672147], length 0
02:11:16.135660 IP 192.168.1.74.39420 > 192.168.1.45.5005: Flags [.], seq 1294517:1330717, ack 3, win 1004, options [nop,nop,TS val 223672147 ecr 1988631472], length 36200
02:11:16.135792 IP 192.168.1.45.5005 > 192.168.1.74.39420: Flags [.], ack 1330717, win 25933, options [nop,nop,TS val 1988631473 ecr 223672147], length 0
02:11:16.135814 IP 192.168.1.74.39420 > 192.168.1.45.5005: Flags [P.], seq 1330717:1336509, ack 3, win 1004, options [nop,nop,TS val 223672147 ecr 1988631472], length 5792
02:11:16.135814 IP 192.168.1.74.39420 > 192.168.1.45.5005: Flags [P.], seq 1336509:1348093, ack 3, win 1004, options [nop,nop,TS val 223672147 ecr 1988631472], length 11584
02:11:16.135829 IP 192.168.1.45.5005 > 192.168.1.74.39420: Flags [.], ack 1336509, win 26114, options [nop,nop,TS val 1988631473 ecr 223672147], length 0
02:11:16.135837 IP 192.168.1.45.5005 > 192.168.1.74.39420: Flags [.], ack 1348093, win 26162, options [nop,nop,TS val 1988631473 ecr 223672147], length 0
02:11:16.135867 IP 192.168.1.74.39420 > 192.168.1.45.5005: Flags [P.], seq 1348093:1352437, ack 3, win 1004, options [nop,nop,TS val 223672147 ecr 1988631472], length 4344
02:11:16.135867 IP 192.168.1.74.39420 > 192.168.1.45.5005: Flags [P.], seq 1352437:1401669, ack 3, win 1004, options [nop,nop,TS val 223672148 ecr 1988631473], length 49232
02:11:16.135880 IP 192.168.1.74.39420 > 192.168.1.45.5005: Flags [.], seq 1401669:1423389, ack 3, win 1004, options [nop,nop,TS val 223672148 ecr 1988631473], length 21720
02:11:16.135986 IP 192.168.1.45.5005 > 192.168.1.74.39420: Flags [.], ack 1423389, win 26162, options [nop,nop,TS val 1988631473 ecr 223672147], length 0
02:11:16.136040 IP 192.168.1.74.39420 > 192.168.1.45.5005: Flags [P.], seq 1423389:1466829, ack 3, win 1004, options [nop,nop,TS val 223672148 ecr 1988631473], length 43440
02:11:16.136073 IP 192.168.1.74.39420 > 192.168.1.45.5005: Flags [.], seq 1466829:1516061, ack 3, win 1004, options [nop,nop,TS val 223672148 ecr 1988631473], length 49232
02:11:16.136156 IP 192.168.1.45.5005 > 192.168.1.74.39420: Flags [.], ack 1516061, win 26162, options [nop,nop,TS val 1988631473 ecr 223672148], length 0
02:11:16.136169 IP 192.168.1.74.39420 > 192.168.1.45.5005: Flags [P.], seq 1516061:1531989, ack 3, win 1004, options [nop,nop,TS val 223672148 ecr 1988631473], length 15928
02:11:16.136171 IP 192.168.1.45.5005 > 192.168.1.74.39420: Flags [.], ack 1531989, win 26177, options [nop,nop,TS val 1988631473 ecr 223672148], length 0
02:11:16.136207 IP 192.168.1.74.39420 > 192.168.1.45.5005: Flags [.], seq 1531989:1592805, ack 3, win 1004, options [nop,nop,TS val 223672148 ecr 1988631473], length 60816
02:11:16.136264 IP 192.168.1.45.5005 > 192.168.1.74.39420: Flags [.], ack 1592805, win 26177, options [nop,nop,TS val 1988631473 ecr 223672148], length 0
02:11:16.136293 IP 192.168.1.74.39420 > 192.168.1.45.5005: Flags [P.], seq 1592805:1597149, ack 3, win 1004, options [nop,nop,TS val 223672148 ecr 1988631473], length 4344
02:11:16.136293 IP 192.168.1.74.39420 > 192.168.1.45.5005: Flags [.], seq 1597149:1634797, ack 3, win 1004, options [nop,nop,TS val 223672148 ecr 1988631473], length 37648
02:11:16.136303 IP 192.168.1.45.5005 > 192.168.1.74.39420: Flags [.], ack 1597149, win 26297, options [nop,nop,TS val 1988631473 ecr 223672148], length 0
02:11:16.136402 IP 192.168.1.45.5005 > 192.168.1.74.39420: Flags [.], ack 1634797, win 26297, options [nop,nop,TS val 1988631473 ecr 223672148], length 0
02:11:16.136462 IP 192.168.1.74.39420 > 192.168.1.45.5005: Flags [P.], seq 1634797:1662309, ack 3, win 1004, options [nop,nop,TS val 223672148 ecr 1988631473], length 27512
02:11:16.136486 IP 192.168.1.74.39420 > 192.168.1.45.5005: Flags [P.], seq 1662309:1727469, ack 3, win 1004, options [nop,nop,TS val 223672148 ecr 1988631473], length 65160
02:11:16.136535 IP 192.168.1.45.5005 > 192.168.1.74.39420: Flags [.], ack 1727469, win 26297, options [nop,nop,TS val 1988631474 ecr 223672148], length 0
02:11:16.136556 IP 192.168.1.74.39420 > 192.168.1.45.5005: Flags [P.], seq 1727469:1757877, ack 3, win 1004, options [nop,nop,TS val 223672148 ecr 1988631473], length 30408
02:11:16.136571 IP 192.168.1.74.39420 > 192.168.1.45.5005: Flags [P.], seq 1757877:1792629, ack 3, win 1004, options [nop,nop,TS val 223672148 ecr 1988631473], length 34752
02:11:16.136594 IP 192.168.1.74.39420 > 192.168.1.45.5005: Flags [.], seq 1792629:1820141, ack 3, win 1004, options [nop,nop,TS val 223672148 ecr 1988631473], length 27512
02:11:16.136606 IP 192.168.1.74.39420 > 192.168.1.45.5005: Flags [P.], seq 1820141:1825933, ack 3, win 1004, options [nop,nop,TS val 223672148 ecr 1988631473], length 5792
02:11:16.136606 IP 192.168.1.74.39420 > 192.168.1.45.5005: Flags [.], seq 1825933:1833173, ack 3, win 1004, options [nop,nop,TS val 223672149 ecr 1988631473], length 7240
02:11:16.136646 IP 192.168.1.74.39420 > 192.168.1.45.5005: Flags [.], seq 1833173:1854893, ack 3, win 1004, options [nop,nop,TS val 223672149 ecr 1988631473], length 21720
02:11:16.136684 IP 192.168.1.45.5005 > 192.168.1.74.39420: Flags [.], ack 1854893, win 26297, options [nop,nop,TS val 1988631474 ecr 223672148], length 0
02:11:16.136773 IP 192.168.1.74.39420 > 192.168.1.45.5005: Flags [P.], seq 1854893:1857789, ack 3, win 1004, options [nop,nop,TS val 223672149 ecr 1988631473], length 2896
02:11:16.136773 IP 192.168.1.74.39420 > 192.168.1.45.5005: Flags [P.], seq 1857789:1922949, ack 3, win 1004, options [nop,nop,TS val 223672149 ecr 1988631474], length 65160
02:11:16.136782 IP 192.168.1.45.5005 > 192.168.1.74.39420: Flags [.], ack 1857789, win 26312, options [nop,nop,TS val 1988631474 ecr 223672149], length 0
02:11:16.136803 IP 192.168.1.74.39420 > 192.168.1.45.5005: Flags [.], seq 1922949:1947565, ack 3, win 1004, options [nop,nop,TS val 223672149 ecr 1988631474], length 24616
02:11:16.136814 IP 192.168.1.74.39420 > 192.168.1.45.5005: Flags [.], seq 1947565:1964941, ack 3, win 1004, options [nop,nop,TS val 223672149 ecr 1988631474], length 17376
02:11:16.136843 IP 192.168.1.74.39420 > 192.168.1.45.5005: Flags [.], seq 1964941:1983765, ack 3, win 1004, options [nop,nop,TS val 223672149 ecr 1988631474], length 18824
02:11:16.136871 IP 192.168.1.74.39420 > 192.168.1.45.5005: Flags [P.], seq 1983765:1988109, ack 3, win 1004, options [nop,nop,TS val 223672149 ecr 1988631474], length 4344
02:11:16.136871 IP 192.168.1.74.39420 > 192.168.1.45.5005: Flags [.], seq 1988109:1999693, ack 3, win 1004, options [nop,nop,TS val 223672149 ecr 1988631474], length 11584
02:11:16.136898 IP 192.168.1.74.39420 > 192.168.1.45.5005: Flags [.], seq 1999693:2015621, ack 3, win 1004, options [nop,nop,TS val 223672149 ecr 1988631474], length 15928
02:11:16.136920 IP 192.168.1.74.39420 > 192.168.1.45.5005: Flags [.], seq 2015621:2030101, ack 3, win 1004, options [nop,nop,TS val 223672149 ecr 1988631474], length 14480
02:11:16.136945 IP 192.168.1.74.39420 > 192.168.1.45.5005: Flags [.], seq 2030101:2043133, ack 3, win 1004, options [nop,nop,TS val 223672149 ecr 1988631474], length 13032
02:11:16.136966 IP 192.168.1.74.39420 > 192.168.1.45.5005: Flags [P.], seq 2043133:2053269, ack 3, win 1004, options [nop,nop,TS val 223672149 ecr 1988631474], length 10136
02:11:16.136999 IP 192.168.1.45.5005 > 192.168.1.74.39420: Flags [.], ack 2053269, win 26312, options [nop,nop,TS val 1988631474 ecr 223672149], length 0
02:11:16.137140 IP 192.168.1.74.39420 > 192.168.1.45.5005: Flags [.], seq 2053269:2067749, ack 3, win 1004, options [nop,nop,TS val 223672149 ecr 1988631474], length 14480
02:11:16.137166 IP 192.168.1.45.5005 > 192.168.1.74.39420: Flags [.], ack 2067749, win 26312, options [nop,nop,TS val 1988631474 ecr 223672149], length 0
02:11:16.137192 IP 192.168.1.74.39420 > 192.168.1.45.5005: Flags [.], seq 2067749:2101053, ack 3, win 1004, options [nop,nop,TS val 223672149 ecr 1988631474], length 33304
02:11:16.137264 IP 192.168.1.45.5005 > 192.168.1.74.39420: Flags [.], ack 2101053, win 26312, options [nop,nop,TS val 1988631474 ecr 223672149], length 0
02:11:16.137300 IP 192.168.1.74.39420 > 192.168.1.45.5005: Flags [P.], seq 2101053:2118429, ack 3, win 1004, options [nop,nop,TS val 223672149 ecr 1988631474], length 17376
02:11:16.137340 IP 192.168.1.74.39420 > 192.168.1.45.5005: Flags [P.], seq 2118429:2183589, ack 3, win 1004, options [nop,nop,TS val 223672149 ecr 1988631474], length 65160
02:11:16.137354 IP 192.168.1.74.39420 > 192.168.1.45.5005: Flags [.], seq 2183589:2193725, ack 3, win 1004, options [nop,nop,TS val 223672149 ecr 1988631474], length 10136
02:11:16.137404 IP 192.168.1.45.5005 > 192.168.1.74.39420: Flags [.], ack 2193725, win 26312, options [nop,nop,TS val 1988631474 ecr 223672149], length 0
02:11:16.137438 IP 192.168.1.74.39420 > 192.168.1.45.5005: Flags [.], seq 2193725:2247301, ack 3, win 1004, options [nop,nop,TS val 223672149 ecr 1988631474], length 53576
02:11:16.137488 IP 192.168.1.74.39420 > 192.168.1.45.5005: Flags [P.], seq 2247301:2248749, ack 3, win 1004, options [nop,nop,TS val 223672149 ecr 1988631474], length 1448
02:11:16.137489 IP 192.168.1.74.39420 > 192.168.1.45.5005: Flags [.], seq 2248749:2274813, ack 3, win 1004, options [nop,nop,TS val 223672149 ecr 1988631474], length 26064
02:11:16.137533 IP 192.168.1.74.39420 > 192.168.1.45.5005: Flags [.], seq 2274813:2302325, ack 3, win 1004, options [nop,nop,TS val 223672149 ecr 1988631474], length 27512
02:11:16.137557 IP 192.168.1.74.39420 > 192.168.1.45.5005: Flags [P.], seq 2302325:2305221, ack 3, win 1004, options [nop,nop,TS val 223672149 ecr 1988631474], length 2896
02:11:16.137557 IP 192.168.1.74.39420 > 192.168.1.45.5005: Flags [P.], seq 2305221:2313909, ack 3, win 1004, options [nop,nop,TS val 223672149 ecr 1988631474], length 8688
02:11:16.137564 IP 192.168.1.74.39420 > 192.168.1.45.5005: Flags [.], seq 2313909:2319701, ack 3, win 1004, options [nop,nop,TS val 223672149 ecr 1988631474], length 5792
02:11:16.137590 IP 192.168.1.74.39420 > 192.168.1.45.5005: Flags [P.], seq 2319701:2321149, ack 3, win 1004, options [nop,nop,TS val 223672149 ecr 1988631474], length 1448
02:11:16.137590 IP 192.168.1.74.39420 > 192.168.1.45.5005: Flags [.], seq 2321149:2332733, ack 3, win 1004, options [nop,nop,TS val 223672150 ecr 1988631474], length 11584
02:11:16.137631 IP 192.168.1.45.5005 > 192.168.1.74.39420: Flags [.], ack 2332733, win 26312, options [nop,nop,TS val 1988631475 ecr 223672149], length 0
02:11:16.137739 IP 192.168.1.74.39420 > 192.168.1.45.5005: Flags [P.], seq 2332733:2379069, ack 3, win 1004, options [nop,nop,TS val 223672150 ecr 1988631474], length 46336
02:11:16.137769 IP 192.168.1.74.39420 > 192.168.1.45.5005: Flags [.], seq 2379069:2425405, ack 3, win 1004, options [nop,nop,TS val 223672150 ecr 1988631474], length 46336
02:11:16.137788 IP 192.168.1.45.5005 > 192.168.1.74.39420: Flags [.], ack 2425405, win 26312, options [nop,nop,TS val 1988631475 ecr 223672150], length 0
02:11:16.137814 IP 192.168.1.74.39420 > 192.168.1.45.5005: Flags [P.], seq 2425405:2444229, ack 3, win 1004, options [nop,nop,TS val 223672150 ecr 1988631474], length 18824
02:11:16.137864 IP 192.168.1.74.39420 > 192.168.1.45.5005: Flags [.], seq 2444229:2502149, ack 3, win 1004, options [nop,nop,TS val 223672150 ecr 1988631475], length 57920
02:11:16.137902 IP 192.168.1.45.5005 > 192.168.1.74.39420: Flags [.], ack 2502149, win 26312, options [nop,nop,TS val 1988631475 ecr 223672150], length 0
02:11:16.137947 IP 192.168.1.74.39420 > 192.168.1.45.5005: Flags [P.], seq 2502149:2509389, ack 3, win 1004, options [nop,nop,TS val 223672150 ecr 1988631475], length 7240
02:11:16.137947 IP 192.168.1.74.39420 > 192.168.1.45.5005: Flags [.], seq 2509389:2551381, ack 3, win 1004, options [nop,nop,TS val 223672150 ecr 1988631475], length 41992
02:11:16.137985 IP 192.168.1.74.39420 > 192.168.1.45.5005: Flags [P.], seq 2551381:2574549, ack 3, win 1004, options [nop,nop,TS val 223672150 ecr 1988631475], length 23168
02:11:16.138003 IP 192.168.1.74.39420 > 192.168.1.45.5005: Flags [.], seq 2574549:2586133, ack 3, win 1004, options [nop,nop,TS val 223672150 ecr 1988631475], length 11584
02:11:16.138080 IP 192.168.1.45.5005 > 192.168.1.74.39420: Flags [.], ack 2586133, win 26312, options [nop,nop,TS val 1988631475 ecr 223672150], length 0
02:11:16.138094 IP 192.168.1.74.39420 > 192.168.1.45.5005: Flags [P.], seq 2586133:2599165, ack 3, win 1004, options [nop,nop,TS val 223672150 ecr 1988631475], length 13032
02:11:16.138113 IP 192.168.1.74.39420 > 192.168.1.45.5005: Flags [P.], seq 2599165:2639709, ack 3, win 1004, options [nop,nop,TS val 223672150 ecr 1988631475], length 40544
02:11:16.138129 IP 192.168.1.74.39420 > 192.168.1.45.5005: Flags [.], seq 2639709:2661429, ack 3, win 1004, options [nop,nop,TS val 223672150 ecr 1988631475], length 21720
02:11:16.138163 IP 192.168.1.74.39420 > 192.168.1.45.5005: Flags [.], seq 2661429:2681701, ack 3, win 1004, options [nop,nop,TS val 223672150 ecr 1988631475], length 20272
02:11:16.138192 IP 192.168.1.74.39420 > 192.168.1.45.5005: Flags [.], seq 2681701:2697629, ack 3, win 1004, options [nop,nop,TS val 223672150 ecr 1988631475], length 15928
02:11:16.138216 IP 192.168.1.74.39420 > 192.168.1.45.5005: Flags [P.], seq 2697629:2704869, ack 3, win 1004, options [nop,nop,TS val 223672150 ecr 1988631475], length 7240
02:11:16.138216 IP 192.168.1.74.39420 > 192.168.1.45.5005: Flags [.], seq 2704869:2712109, ack 3, win 1004, options [nop,nop,TS val 223672150 ecr 1988631475], length 7240
02:11:16.138242 IP 192.168.1.74.39420 > 192.168.1.45.5005: Flags [.], seq 2712109:2725141, ack 3, win 1004, options [nop,nop,TS val 223672150 ecr 1988631475], length 13032
02:11:16.138264 IP 192.168.1.74.39420 > 192.168.1.45.5005: Flags [.], seq 2725141:2739621, ack 3, win 1004, options [nop,nop,TS val 223672150 ecr 1988631475], length 14480
02:11:16.138290 IP 192.168.1.74.39420 > 192.168.1.45.5005: Flags [.], seq 2739621:2752653, ack 3, win 1004, options [nop,nop,TS val 223672150 ecr 1988631475], length 13032
02:11:16.138313 IP 192.168.1.74.39420 > 192.168.1.45.5005: Flags [.], seq 2752653:2767133, ack 3, win 1004, options [nop,nop,TS val 223672150 ecr 1988631475], length 14480
02:11:16.138346 IP 192.168.1.45.5005 > 192.168.1.74.39420: Flags [.], ack 2767133, win 26312, options [nop,nop,TS val 1988631475 ecr 223672150], length 0
02:11:16.138380 IP 192.168.1.74.39420 > 192.168.1.45.5005: Flags [P.], seq 2767133:2770029, ack 3, win 1004, options [nop,nop,TS val 223672150 ecr 1988631475], length 2896
02:11:16.138380 IP 192.168.1.74.39420 > 192.168.1.45.5005: Flags [R.], seq 2770029, ack 3, win 1004, options [nop,nop,TS val 223672150 ecr 1988631475], length 0
02:11:16.138380 IP 192.168.1.74.39420 > 192.168.1.45.5005: Flags [R], seq 1167904859, win 0, length 0
02:11:16.138382 IP 192.168.1.45.5005 > 192.168.1.74.39420: Flags [.], ack 2770029, win 26312, options [nop,nop,TS val 1988631475 ecr 223672150], length 0
02:11:16.138462 IP 192.168.1.74.39420 > 192.168.1.45.5005: Flags [R], seq 1168085859, win 0, length 0
02:11:16.138462 IP 192.168.1.74.39420 > 192.168.1.45.5005: Flags [R], seq 1168088755, win 0, length 0

309 packets captured
309 packets received by filter
0 packets dropped by kernel
