tcpdump: verbose output suppressed, use -v[v]... for full protocol decode
listening on enp0s8, link-type EN10MB (Ethernet), snapshot length 262144 bytes
01:14:39.508059 IP 192.168.1.74.59556 > 192.168.1.45.5005: Flags [S], seq 2818283014, win 64240, options [mss 1460,sackOK,TS val 736328147 ecr 0,nop,wscale 6], length 0
01:14:39.508084 IP 192.168.1.45.5005 > 192.168.1.74.59556: Flags [S.], seq 91907383, ack 2818283015, win 65160, options [mss 1460,sackOK,TS val 2131830172 ecr 736328147,nop,wscale 6], length 0
01:14:39.508165 IP 192.168.1.74.59556 > 192.168.1.45.5005: Flags [.], ack 1, win 1004, options [nop,nop,TS val 736328147 ecr 2131830172], length 0
01:14:39.508777 IP 192.168.1.74.59556 > 192.168.1.45.5005: Flags [P.], seq 1:5, ack 1, win 1004, options [nop,nop,TS val 736328147 ecr 2131830172], length 4
01:14:39.508790 IP 192.168.1.45.5005 > 192.168.1.74.59556: Flags [.], ack 5, win 1019, options [nop,nop,TS val 2131830172 ecr 736328147], length 0
01:14:39.509008 IP 192.168.1.45.5005 > 192.168.1.74.59556: Flags [P.], seq 1:3, ack 5, win 1019, options [nop,nop,TS val 2131830172 ecr 736328147], length 2
01:14:39.509075 IP 192.168.1.74.59556 > 192.168.1.45.5005: Flags [.], ack 3, win 1004, options [nop,nop,TS val 736328148 ecr 2131830172], length 0
01:14:39.509199 IP 192.168.1.74.59556 > 192.168.1.45.5005: Flags [P.], seq 5:7245, ack 3, win 1004, options [nop,nop,TS val 736328148 ecr 2131830172], length 7240
01:14:39.509199 IP 192.168.1.74.59556 > 192.168.1.45.5005: Flags [.], seq 7245:11589, ack 3, win 1004, options [nop,nop,TS val 736328148 ecr 2131830172], length 4344
01:14:39.509234 IP 192.168.1.74.59556 > 192.168.1.45.5005: Flags [P.], seq 11589:14485, ack 3, win 1004, options [nop,nop,TS val 736328148 ecr 2131830172], length 2896
01:14:39.517185 IP 192.168.1.74.59556 > 192.168.1.45.5005: Flags [.], seq 14485:15933, ack 3, win 1004, options [nop,nop,TS val 736328156 ecr 2131830172], length 1448
01:14:39.551417 IP 192.168.1.45.5005 > 192.168.1.74.59556: Flags [.], ack 15933, win 857, options [nop,nop,TS val 2131830215 ecr 736328148], length 0
01:14:39.552066 IP 192.168.1.74.59556 > 192.168.1.45.5005: Flags [P.], seq 15933:26069, ack 3, win 1004, options [nop,nop,TS val 736328191 ecr 2131830215], length 10136
01:14:39.552093 IP 192.168.1.45.5005 > 192.168.1.74.59556: Flags [.], ack 26069, win 752, options [nop,nop,TS val 2131830216 ecr 736328191], length 0
01:14:39.552217 IP 192.168.1.74.59556 > 192.168.1.45.5005: Flags [P.], seq 26069:36205, ack 3, win 1004, options [nop,nop,TS val 736328191 ecr 2131830215], length 10136
01:14:39.552218 IP 192.168.1.74.59556 > 192.168.1.45.5005: Flags [P.], seq 36205:46341, ack 3, win 1004, options [nop,nop,TS val 736328191 ecr 2131830215], length 10136
01:14:39.552233 IP 192.168.1.45.5005 > 192.168.1.74.59556: Flags [.], ack 36205, win 645, options [nop,nop,TS val 2131830216 ecr 736328191], length 0
01:14:39.552249 IP 192.168.1.45.5005 > 192.168.1.74.59556: Flags [.], ack 46341, win 540, options [nop,nop,TS val 2131830216 ecr 736328191], length 0
01:14:39.552717 IP 192.168.1.74.59556 > 192.168.1.45.5005: Flags [P.], seq 46341:62269, ack 3, win 1004, options [nop,nop,TS val 736328191 ecr 2131830216], length 15928
01:14:39.552765 IP 192.168.1.74.59556 > 192.168.1.45.5005: Flags [P.], seq 62269:66613, ack 3, win 1004, options [nop,nop,TS val 736328191 ecr 2131830216], length 4344
01:14:39.552765 IP 192.168.1.74.59556 > 192.168.1.45.5005: Flags [P.], seq 66613:77485, ack 3, win 1004, options [nop,nop,TS val 736328191 ecr 2131830216], length 10872
01:14:39.552785 IP 192.168.1.74.59556 > 192.168.1.45.5005: Flags [P.], seq 77485:78197, ack 3, win 1004, options [nop,nop,TS val 736328191 ecr 2131830216], length 712
01:14:39.552785 IP 192.168.1.74.59556 > 192.168.1.45.5005: Flags [.], seq 78197:79645, ack 3, win 1004, options [nop,nop,TS val 736328191 ecr 2131830216], length 1448
01:14:39.565556 IP 192.168.1.74.59556 > 192.168.1.45.5005: Flags [.], seq 78197:79645, ack 3, win 1004, options [nop,nop,TS val 736328204 ecr 2131830216], length 1448
01:14:39.595370 IP 192.168.1.45.5005 > 192.168.1.74.59556: Flags [.], ack 79645, win 176, options [nop,nop,TS val 2131830259 ecr 736328191,nop,nop,sack 1 {78197:79645}], length 0
01:14:39.596165 IP 192.168.1.74.59556 > 192.168.1.45.5005: Flags [P.], seq 79645:90909, ack 3, win 1004, options [nop,nop,TS val 736328235 ecr 2131830259], length 11264
01:14:39.617551 IP 192.168.1.74.59556 > 192.168.1.45.5005: Flags [.], seq 89781:90909, ack 3, win 1004, options [nop,nop,TS val 736328256 ecr 2131830259], length 1128
01:14:39.639251 IP 192.168.1.45.5005 > 192.168.1.74.59556: Flags [.], ack 90909, win 0, options [nop,nop,TS val 2131830303 ecr 736328235,nop,nop,sack 1 {89781:90909}], length 0
01:14:39.857395 IP 192.168.1.74.59556 > 192.168.1.45.5005: Flags [.], ack 3, win 1004, options [nop,nop,TS val 736328496 ecr 2131830303], length 0
01:14:39.857423 IP 192.168.1.45.5005 > 192.168.1.74.59556: Flags [.], ack 90909, win 0, options [nop,nop,TS val 2131830521 ecr 736328235], length 0
01:14:40.317374 IP 192.168.1.74.59556 > 192.168.1.45.5005: Flags [.], ack 3, win 1004, options [nop,nop,TS val 736328956 ecr 2131830521], length 0
01:14:41.213590 IP 192.168.1.74.59556 > 192.168.1.45.5005: Flags [.], ack 3, win 1004, options [nop,nop,TS val 736329852 ecr 2131830521], length 0
01:14:41.213619 IP 192.168.1.45.5005 > 192.168.1.74.59556: Flags [.], ack 90909, win 0, options [nop,nop,TS val 2131831877 ecr 736328235], length 0
01:14:42.973559 IP 192.168.1.74.59556 > 192.168.1.45.5005: Flags [.], ack 3, win 1004, options [nop,nop,TS val 736331612 ecr 2131831877], length 0
01:14:42.973586 IP 192.168.1.45.5005 > 192.168.1.74.59556: Flags [.], ack 90909, win 0, options [nop,nop,TS val 2131833637 ecr 736328235], length 0
01:14:46.589436 IP 192.168.1.74.59556 > 192.168.1.45.5005: Flags [.], ack 3, win 1004, options [nop,nop,TS val 736335228 ecr 2131833637], length 0
01:14:46.589470 IP 192.168.1.45.5005 > 192.168.1.74.59556: Flags [.], ack 90909, win 0, options [nop,nop,TS val 2131837253 ecr 736328235], length 0
01:14:53.757472 IP 192.168.1.74.59556 > 192.168.1.45.5005: Flags [.], ack 3, win 1004, options [nop,nop,TS val 736342396 ecr 2131837253], length 0
01:14:53.757500 IP 192.168.1.45.5005 > 192.168.1.74.59556: Flags [.], ack 90909, win 0, options [nop,nop,TS val 2131844421 ecr 736328235], length 0
01:14:54.509380 IP 192.168.1.45.5005 > 192.168.1.74.59556: Flags [.], ack 90909, win 1002, options [nop,nop,TS val 2131845173 ecr 736328235], length 0
01:14:54.510287 IP 192.168.1.74.59556 > 192.168.1.45.5005: Flags [P.], seq 90909:98149, ack 3, win 1004, options [nop,nop,TS val 736343149 ecr 2131845173], length 7240
01:14:54.510287 IP 192.168.1.74.59556 > 192.168.1.45.5005: Flags [P.], seq 98149:105389, ack 3, win 1004, options [nop,nop,TS val 736343149 ecr 2131845173], length 7240
01:14:54.510329 IP 192.168.1.45.5005 > 192.168.1.74.59556: Flags [.], ack 98149, win 1228, options [nop,nop,TS val 2131845174 ecr 736343149], length 0
01:14:54.510354 IP 192.168.1.45.5005 > 192.168.1.74.59556: Flags [.], ack 105389, win 1454, options [nop,nop,TS val 2131845174 ecr 736343149], length 0
01:14:54.510883 IP 192.168.1.74.59556 > 192.168.1.45.5005: Flags [P.], seq 105389:108285, ack 3, win 1004, options [nop,nop,TS val 736343149 ecr 2131845174], length 2896
01:14:54.510883 IP 192.168.1.74.59556 > 192.168.1.45.5005: Flags [P.], seq 108285:110053, ack 3, win 1004, options [nop,nop,TS val 736343149 ecr 2131845174], length 1768
01:14:54.510883 IP 192.168.1.74.59556 > 192.168.1.45.5005: Flags [P.], seq 110053:112949, ack 3, win 1004, options [nop,nop,TS val 736343149 ecr 2131845174], length 2896
01:14:54.510901 IP 192.168.1.45.5005 > 192.168.1.74.59556: Flags [.], ack 108285, win 1545, options [nop,nop,TS val 2131845174 ecr 736343149], length 0
01:14:54.510932 IP 192.168.1.45.5005 > 192.168.1.74.59556: Flags [.], ack 110053, win 1600, options [nop,nop,TS val 2131845174 ecr 736343149], length 0
01:14:54.510955 IP 192.168.1.45.5005 > 192.168.1.74.59556: Flags [.], ack 112949, win 1690, options [nop,nop,TS val 2131845174 ecr 736343149], length 0
01:14:54.511092 IP 192.168.1.74.59556 > 192.168.1.45.5005: Flags [P.], seq 112949:115845, ack 3, win 1004, options [nop,nop,TS val 736343150 ecr 2131845174], length 2896
01:14:54.511092 IP 192.168.1.74.59556 > 192.168.1.45.5005: Flags [P.], seq 115845:120189, ack 3, win 1004, options [nop,nop,TS val 736343150 ecr 2131845174], length 4344
01:14:54.511092 IP 192.168.1.74.59556 > 192.168.1.45.5005: Flags [P.], seq 120189:124533, ack 3, win 1004, options [nop,nop,TS val 736343150 ecr 2131845174], length 4344
01:14:54.511103 IP 192.168.1.45.5005 > 192.168.1.74.59556: Flags [.], ack 115845, win 1781, options [nop,nop,TS val 2131845175 ecr 736343150], length 0
01:14:54.511120 IP 192.168.1.45.5005 > 192.168.1.74.59556: Flags [.], ack 120189, win 1917, options [nop,nop,TS val 2131845175 ecr 736343150], length 0
01:14:54.511132 IP 192.168.1.45.5005 > 192.168.1.74.59556: Flags [.], ack 124533, win 2052, options [nop,nop,TS val 2131845175 ecr 736343150], length 0
01:14:54.511169 IP 192.168.1.74.59556 > 192.168.1.45.5005: Flags [P.], seq 124533:128877, ack 3, win 1004, options [nop,nop,TS val 736343150 ecr 2131845174], length 4344
01:14:54.511169 IP 192.168.1.74.59556 > 192.168.1.45.5005: Flags [P.], seq 128877:133221, ack 3, win 1004, options [nop,nop,TS val 736343150 ecr 2131845174], length 4344
01:14:54.511180 IP 192.168.1.45.5005 > 192.168.1.74.59556: Flags [.], ack 128877, win 2188, options [nop,nop,TS val 2131845175 ecr 736343150], length 0
01:14:54.511197 IP 192.168.1.45.5005 > 192.168.1.74.59556: Flags [.], ack 133221, win 2324, options [nop,nop,TS val 2131845175 ecr 736343150], length 0
01:14:54.511367 IP 192.168.1.74.59556 > 192.168.1.45.5005: Flags [P.], seq 133221:139013, ack 3, win 1004, options [nop,nop,TS val 736343150 ecr 2131845174], length 5792
01:14:54.511367 IP 192.168.1.74.59556 > 192.168.1.45.5005: Flags [P.], seq 139013:141909, ack 3, win 1004, options [nop,nop,TS val 736343150 ecr 2131845174], length 2896
01:14:54.511367 IP 192.168.1.74.59556 > 192.168.1.45.5005: Flags [P.], seq 141909:144805, ack 3, win 1004, options [nop,nop,TS val 736343150 ecr 2131845174], length 2896
01:14:54.511379 IP 192.168.1.45.5005 > 192.168.1.74.59556: Flags [.], ack 139013, win 2505, options [nop,nop,TS val 2131845175 ecr 736343150], length 0
01:14:54.511400 IP 192.168.1.45.5005 > 192.168.1.74.59556: Flags [.], ack 141909, win 2595, options [nop,nop,TS val 2131845175 ecr 736343150], length 0
01:14:54.511417 IP 192.168.1.45.5005 > 192.168.1.74.59556: Flags [.], ack 144805, win 2686, options [nop,nop,TS val 2131845175 ecr 736343150], length 0
01:14:54.511446 IP 192.168.1.74.59556 > 192.168.1.45.5005: Flags [P.], seq 144805:150597, ack 3, win 1004, options [nop,nop,TS val 736343150 ecr 2131845174], length 5792
01:14:54.511453 IP 192.168.1.45.5005 > 192.168.1.74.59556: Flags [.], ack 150597, win 2867, options [nop,nop,TS val 2131845175 ecr 736343150], length 0
01:14:54.511631 IP 192.168.1.74.59556 > 192.168.1.45.5005: Flags [P.], seq 150597:156389, ack 3, win 1004, options [nop,nop,TS val 736343150 ecr 2131845175], length 5792
01:14:54.511631 IP 192.168.1.74.59556 > 192.168.1.45.5005: Flags [.], seq 156389:159285, ack 3, win 1004, options [nop,nop,TS val 736343150 ecr 2131845175], length 2896
01:14:54.511641 IP 192.168.1.45.5005 > 192.168.1.74.59556: Flags [.], ack 156389, win 3048, options [nop,nop,TS val 2131845175 ecr 736343150], length 0
01:14:54.511666 IP 192.168.1.45.5005 > 192.168.1.74.59556: Flags [.], ack 159285, win 3138, options [nop,nop,TS val 2131845175 ecr 736343150], length 0
01:14:54.511791 IP 192.168.1.74.59556 > 192.168.1.45.5005: Flags [P.], seq 159285:165077, ack 3, win 1004, options [nop,nop,TS val 736343150 ecr 2131845175], length 5792
01:14:54.511791 IP 192.168.1.74.59556 > 192.168.1.45.5005: Flags [P.], seq 165077:173765, ack 3, win 1004, options [nop,nop,TS val 736343150 ecr 2131845175], length 8688
01:14:54.511799 IP 192.168.1.45.5005 > 192.168.1.74.59556: Flags [.], ack 165077, win 3319, options [nop,nop,TS val 2131845175 ecr 736343150], length 0
01:14:54.511816 IP 192.168.1.45.5005 > 192.168.1.74.59556: Flags [.], ack 173765, win 3591, options [nop,nop,TS val 2131845175 ecr 736343150], length 0
01:14:54.511887 IP 192.168.1.74.59556 > 192.168.1.45.5005: Flags [P.], seq 173765:182453, ack 3, win 1004, options [nop,nop,TS val 736343150 ecr 2131845175], length 8688
01:14:54.511887 IP 192.168.1.74.59556 > 192.168.1.45.5005: Flags [P.], seq 182453:191141, ack 3, win 1004, options [nop,nop,TS val 736343150 ecr 2131845175], length 8688
01:14:54.511901 IP 192.168.1.45.5005 > 192.168.1.74.59556: Flags [.], ack 182453, win 3862, options [nop,nop,TS val 2131845175 ecr 736343150], length 0
01:14:54.511920 IP 192.168.1.45.5005 > 192.168.1.74.59556: Flags [.], ack 191141, win 4134, options [nop,nop,TS val 2131845175 ecr 736343150], length 0
01:14:54.511940 IP 192.168.1.74.59556 > 192.168.1.45.5005: Flags [P.], seq 191141:202725, ack 3, win 1004, options [nop,nop,TS val 736343150 ecr 2131845175], length 11584
01:14:54.511948 IP 192.168.1.45.5005 > 192.168.1.74.59556: Flags [.], ack 202725, win 4496, options [nop,nop,TS val 2131845175 ecr 736343150], length 0
01:14:54.511998 IP 192.168.1.74.59556 > 192.168.1.45.5005: Flags [P.], seq 202725:205621, ack 3, win 1004, options [nop,nop,TS val 736343150 ecr 2131845175], length 2896
01:14:54.511998 IP 192.168.1.74.59556 > 192.168.1.45.5005: Flags [P.], seq 205621:208517, ack 3, win 1004, options [nop,nop,TS val 736343150 ecr 2131845175], length 2896
01:14:54.511998 IP 192.168.1.74.59556 > 192.168.1.45.5005: Flags [.], seq 208517:209965, ack 3, win 1004, options [nop,nop,TS val 736343151 ecr 2131845175], length 1448
01:14:54.512011 IP 192.168.1.45.5005 > 192.168.1.74.59556: Flags [.], ack 205621, win 4586, options [nop,nop,TS val 2131845175 ecr 736343150], length 0
01:14:54.512031 IP 192.168.1.45.5005 > 192.168.1.74.59556: Flags [.], ack 208517, win 4677, options [nop,nop,TS val 2131845175 ecr 736343150], length 0
01:14:54.512053 IP 192.168.1.45.5005 > 192.168.1.74.59556: Flags [.], ack 209965, win 4722, options [nop,nop,TS val 2131845175 ecr 736343151], length 0
01:14:54.512193 IP 192.168.1.74.59556 > 192.168.1.45.5005: Flags [P.], seq 209965:214309, ack 3, win 1004, options [nop,nop,TS val 736343151 ecr 2131845175], length 4344
01:14:54.512193 IP 192.168.1.74.59556 > 192.168.1.45.5005: Flags [P.], seq 214309:225893, ack 3, win 1004, options [nop,nop,TS val 736343151 ecr 2131845175], length 11584
01:14:54.512204 IP 192.168.1.45.5005 > 192.168.1.74.59556: Flags [.], ack 214309, win 4858, options [nop,nop,TS val 2131845176 ecr 736343151], length 0
01:14:54.512220 IP 192.168.1.45.5005 > 192.168.1.74.59556: Flags [.], ack 225893, win 5220, options [nop,nop,TS val 2131845176 ecr 736343151], length 0
01:14:54.512275 IP 192.168.1.74.59556 > 192.168.1.45.5005: Flags [P.], seq 225893:237477, ack 3, win 1004, options [nop,nop,TS val 736343151 ecr 2131845175], length 11584
01:14:54.512286 IP 192.168.1.45.5005 > 192.168.1.74.59556: Flags [.], ack 237477, win 5582, options [nop,nop,TS val 2131845176 ecr 736343151], length 0
01:14:54.512319 IP 192.168.1.74.59556 > 192.168.1.45.5005: Flags [P.], seq 237477:243269, ack 3, win 1004, options [nop,nop,TS val 736343151 ecr 2131845175], length 5792
01:14:54.512319 IP 192.168.1.74.59556 > 192.168.1.45.5005: Flags [P.], seq 243269:254853, ack 3, win 1004, options [nop,nop,TS val 736343151 ecr 2131845175], length 11584
01:14:54.512328 IP 192.168.1.45.5005 > 192.168.1.74.59556: Flags [.], ack 243269, win 5763, options [nop,nop,TS val 2131845176 ecr 736343151], length 0
01:14:54.512349 IP 192.168.1.45.5005 > 192.168.1.74.59556: Flags [.], ack 254853, win 6125, options [nop,nop,TS val 2131845176 ecr 736343151], length 0
01:14:54.512401 IP 192.168.1.74.59556 > 192.168.1.45.5005: Flags [P.], seq 254853:269333, ack 3, win 1004, options [nop,nop,TS val 736343151 ecr 2131845175], length 14480
01:14:54.512408 IP 192.168.1.45.5005 > 192.168.1.74.59556: Flags [.], ack 269333, win 6577, options [nop,nop,TS val 2131845176 ecr 736343151], length 0
01:14:54.512445 IP 192.168.1.74.59556 > 192.168.1.45.5005: Flags [P.], seq 269333:272229, ack 3, win 1004, options [nop,nop,TS val 736343151 ecr 2131845175], length 2896
01:14:54.512445 IP 192.168.1.74.59556 > 192.168.1.45.5005: Flags [.], seq 272229:273677, ack 3, win 1004, options [nop,nop,TS val 736343151 ecr 2131845175], length 1448
01:14:54.512450 IP 192.168.1.45.5005 > 192.168.1.74.59556: Flags [.], ack 272229, win 6668, options [nop,nop,TS val 2131845176 ecr 736343151], length 0
01:14:54.512466 IP 192.168.1.45.5005 > 192.168.1.74.59556: Flags [.], ack 273677, win 6713, options [nop,nop,TS val 2131845176 ecr 736343151], length 0
01:14:54.512611 IP 192.168.1.74.59556 > 192.168.1.45.5005: Flags [P.], seq 273677:289605, ack 3, win 1004, options [nop,nop,TS val 736343151 ecr 2131845175], length 15928
01:14:54.512624 IP 192.168.1.45.5005 > 192.168.1.74.59556: Flags [.], ack 289605, win 7211, options [nop,nop,TS val 2131845176 ecr 736343151], length 0
01:14:54.512676 IP 192.168.1.74.59556 > 192.168.1.45.5005: Flags [P.], seq 289605:301189, ack 3, win 1004, options [nop,nop,TS val 736343151 ecr 2131845175], length 11584
01:14:54.512686 IP 192.168.1.45.5005 > 192.168.1.74.59556: Flags [.], ack 301189, win 7573, options [nop,nop,TS val 2131845176 ecr 736343151], length 0
01:14:54.512747 IP 192.168.1.74.59556 > 192.168.1.45.5005: Flags [P.], seq 301189:306981, ack 3, win 1004, options [nop,nop,TS val 736343151 ecr 2131845175], length 5792
01:14:54.512747 IP 192.168.1.74.59556 > 192.168.1.45.5005: Flags [.], seq 306981:314221, ack 3, win 1004, options [nop,nop,TS val 736343151 ecr 2131845175], length 7240
01:14:54.512756 IP 192.168.1.45.5005 > 192.168.1.74.59556: Flags [.], ack 306981, win 7754, options [nop,nop,TS val 2131845176 ecr 736343151], length 0
01:14:54.512774 IP 192.168.1.45.5005 > 192.168.1.74.59556: Flags [.], ack 314221, win 7980, options [nop,nop,TS val 2131845176 ecr 736343151], length 0
01:14:54.514161 IP 192.168.1.74.59556 > 192.168.1.45.5005: Flags [P.], seq 314221:330149, ack 3, win 1004, options [nop,nop,TS val 736343151 ecr 2131845175], length 15928
01:14:54.514178 IP 192.168.1.45.5005 > 192.168.1.74.59556: Flags [.], ack 330149, win 8478, options [nop,nop,TS val 2131845178 ecr 736343151], length 0
01:14:54.514239 IP 192.168.1.74.59556 > 192.168.1.45.5005: Flags [P.], seq 330149:333045, ack 3, win 1004, options [nop,nop,TS val 736343151 ecr 2131845175], length 2896
01:14:54.514239 IP 192.168.1.74.59556 > 192.168.1.45.5005: Flags [P.], seq 333045:335941, ack 3, win 1004, options [nop,nop,TS val 736343151 ecr 2131845175], length 2896
01:14:54.514239 IP 192.168.1.74.59556 > 192.168.1.45.5005: Flags [P.], seq 335941:364901, ack 3, win 1004, options [nop,nop,TS val 736343151 ecr 2131845176], length 28960
01:14:54.514259 IP 192.168.1.45.5005 > 192.168.1.74.59556: Flags [.], ack 333045, win 8568, options [nop,nop,TS val 2131845178 ecr 736343151], length 0
01:14:54.514270 IP 192.168.1.45.5005 > 192.168.1.74.59556: Flags [.], ack 335941, win 8659, options [nop,nop,TS val 2131845178 ecr 736343151], length 0
01:14:54.514280 IP 192.168.1.45.5005 > 192.168.1.74.59556: Flags [.], ack 364901, win 9564, options [nop,nop,TS val 2131845178 ecr 736343151], length 0
01:14:54.514319 IP 192.168.1.74.59556 > 192.168.1.45.5005: Flags [P.], seq 364901:396757, ack 3, win 1004, options [nop,nop,TS val 736343151 ecr 2131845176], length 31856
01:14:54.514330 IP 192.168.1.45.5005 > 192.168.1.74.59556: Flags [.], ack 396757, win 10559, options [nop,nop,TS val 2131845178 ecr 736343151], length 0
01:14:54.514363 IP 192.168.1.74.59556 > 192.168.1.45.5005: Flags [.], seq 396757:406893, ack 3, win 1004, options [nop,nop,TS val 736343151 ecr 2131845176], length 10136
01:14:54.514369 IP 192.168.1.45.5005 > 192.168.1.74.59556: Flags [.], ack 406893, win 10876, options [nop,nop,TS val 2131845178 ecr 736343151], length 0
01:14:54.514395 IP 192.168.1.74.59556 > 192.168.1.45.5005: Flags [P.], seq 406893:428613, ack 3, win 1004, options [nop,nop,TS val 736343151 ecr 2131845176], length 21720
01:14:54.514403 IP 192.168.1.45.5005 > 192.168.1.74.59556: Flags [.], ack 428613, win 11555, options [nop,nop,TS val 2131845178 ecr 736343151], length 0
01:14:54.514448 IP 192.168.1.74.59556 > 192.168.1.45.5005: Flags [P.], seq 428613:460469, ack 3, win 1004, options [nop,nop,TS val 736343151 ecr 2131845176], length 31856
01:14:54.514458 IP 192.168.1.45.5005 > 192.168.1.74.59556: Flags [.], ack 460469, win 11630, options [nop,nop,TS val 2131845178 ecr 736343151], length 0
01:14:54.514489 IP 192.168.1.74.59556 > 192.168.1.45.5005: Flags [P.], seq 460469:492325, ack 3, win 1004, options [nop,nop,TS val 736343152 ecr 2131845176], length 31856
01:14:54.514500 IP 192.168.1.45.5005 > 192.168.1.74.59556: Flags [.], ack 492325, win 11296, options [nop,nop,TS val 2131845178 ecr 736343152], length 0
01:14:54.514984 IP 192.168.1.74.59556 > 192.168.1.45.5005: Flags [.], seq 492325:506805, ack 3, win 1004, options [nop,nop,TS val 736343153 ecr 2131845178], length 14480
01:14:54.515240 IP 192.168.1.45.5005 > 192.168.1.74.59556: Flags [.], ack 506805, win 12082, options [nop,nop,TS val 2131845179 ecr 736343153], length 0
01:14:54.515296 IP 192.168.1.74.59556 > 192.168.1.45.5005: Flags [P.], seq 506805:524181, ack 3, win 1004, options [nop,nop,TS val 736343153 ecr 2131845178], length 17376
01:14:54.515349 IP 192.168.1.74.59556 > 192.168.1.45.5005: Flags [P.], seq 524181:556037, ack 3, win 1004, options [nop,nop,TS val 736343154 ecr 2131845178], length 31856
01:14:54.515401 IP 192.168.1.74.59556 > 192.168.1.45.5005: Flags [.], seq 556037:586445, ack 3, win 1004, options [nop,nop,TS val 736343154 ecr 2131845178], length 30408
01:14:54.515503 IP 192.168.1.74.59556 > 192.168.1.45.5005: Flags [P.], seq 586445:587893, ack 3, win 1004, options [nop,nop,TS val 736343154 ecr 2131845178], length 1448
01:14:54.515503 IP 192.168.1.74.59556 > 192.168.1.45.5005: Flags [.], seq 587893:603821, ack 3, win 1004, options [nop,nop,TS val 736343154 ecr 2131845178], length 15928
01:14:54.515596 IP 192.168.1.74.59556 > 192.168.1.45.5005: Flags [P.], seq 603821:619749, ack 3, win 1004, options [nop,nop,TS val 736343154 ecr 2131845178], length 15928
01:14:54.515619 IP 192.168.1.74.59556 > 192.168.1.45.5005: Flags [.], seq 619749:622645, ack 3, win 1004, options [nop,nop,TS val 736343154 ecr 2131845178], length 2896
01:14:54.515706 IP 192.168.1.74.59556 > 192.168.1.45.5005: Flags [.], seq 622645:637125, ack 3, win 1004, options [nop,nop,TS val 736343154 ecr 2131845178], length 14480
01:14:54.515795 IP 192.168.1.74.59556 > 192.168.1.45.5005: Flags [.], seq 637125:651605, ack 3, win 1004, options [nop,nop,TS val 736343154 ecr 2131845178], length 14480
01:14:54.515888 IP 192.168.1.74.59556 > 192.168.1.45.5005: Flags [.], seq 651605:664637, ack 3, win 1004, options [nop,nop,TS val 736343154 ecr 2131845178], length 13032
01:14:54.515979 IP 192.168.1.74.59556 > 192.168.1.45.5005: Flags [.], seq 664637:679117, ack 3, win 1004, options [nop,nop,TS val 736343154 ecr 2131845178], length 14480
01:14:54.516060 IP 192.168.1.74.59556 > 192.168.1.45.5005: Flags [P.], seq 679117:684909, ack 3, win 1004, options [nop,nop,TS val 736343154 ecr 2131845178], length 5792
01:14:54.516060 IP 192.168.1.74.59556 > 192.168.1.45.5005: Flags [.], seq 684909:693597, ack 3, win 1004, options [nop,nop,TS val 736343154 ecr 2131845178], length 8688
01:14:54.516089 IP 192.168.1.45.5005 > 192.168.1.74.59556: Flags [.], ack 524181, win 12429, options [nop,nop,TS val 2131845180 ecr 736343153], length 0
01:14:54.516103 IP 192.168.1.45.5005 > 192.168.1.74.59556: Flags [.], ack 556037, win 12095, options [nop,nop,TS val 2131845180 ecr 736343154], length 0
01:14:54.516112 IP 192.168.1.45.5005 > 192.168.1.74.59556: Flags [.], ack 586445, win 11776, options [nop,nop,TS val 2131845180 ecr 736343154], length 0
01:14:54.516122 IP 192.168.1.45.5005 > 192.168.1.74.59556: Flags [.], ack 603821, win 11594, options [nop,nop,TS val 2131845180 ecr 736343154], length 0
01:14:54.516132 IP 192.168.1.45.5005 > 192.168.1.74.59556: Flags [.], ack 622645, win 11397, options [nop,nop,TS val 2131845180 ecr 736343154], length 0
01:14:54.516143 IP 192.168.1.45.5005 > 192.168.1.74.59556: Flags [.], ack 637125, win 11245, options [nop,nop,TS val 2131845180 ecr 736343154], length 0
01:14:54.516205 IP 192.168.1.74.59556 > 192.168.1.45.5005: Flags [P.], seq 693597:696493, ack 3, win 1004, options [nop,nop,TS val 736343154 ecr 2131845178], length 2896
01:14:54.516227 IP 192.168.1.45.5005 > 192.168.1.74.59556: Flags [.], ack 651605, win 11061, options [nop,nop,TS val 2131845180 ecr 736343154], length 0
01:14:54.516239 IP 192.168.1.45.5005 > 192.168.1.74.59556: Flags [.], ack 664637, win 10924, options [nop,nop,TS val 2131845180 ecr 736343154], length 0
01:14:54.516253 IP 192.168.1.45.5005 > 192.168.1.74.59556: Flags [.], ack 684909, win 10712, options [nop,nop,TS val 2131845180 ecr 736343154], length 0
01:14:54.516319 IP 192.168.1.45.5005 > 192.168.1.74.59556: Flags [.], ack 693597, win 10620, options [nop,nop,TS val 2131845180 ecr 736343154], length 0
01:14:54.516330 IP 192.168.1.45.5005 > 192.168.1.74.59556: Flags [.], ack 696493, win 10590, options [nop,nop,TS val 2131845180 ecr 736343154], length 0
01:14:54.516482 IP 192.168.1.74.59556 > 192.168.1.45.5005: Flags [.], seq 696493:697941, ack 3, win 1004, options [nop,nop,TS val 736343155 ecr 2131845180], length 1448
01:14:54.516610 IP 192.168.1.74.59556 > 192.168.1.45.5005: Flags [.], seq 697941:719661, ack 3, win 1004, options [nop,nop,TS val 736343155 ecr 2131845180], length 21720
01:14:54.516704 IP 192.168.1.74.59556 > 192.168.1.45.5005: Flags [P.], seq 719661:729797, ack 3, win 1004, options [nop,nop,TS val 736343155 ecr 2131845180], length 10136
01:14:54.516704 IP 192.168.1.74.59556 > 192.168.1.45.5005: Flags [.], seq 729797:735589, ack 3, win 1004, options [nop,nop,TS val 736343155 ecr 2131845180], length 5792
01:14:54.516785 IP 192.168.1.74.59556 > 192.168.1.45.5005: Flags [.], seq 735589:748621, ack 3, win 1004, options [nop,nop,TS val 736343155 ecr 2131845180], length 13032
01:14:54.516875 IP 192.168.1.74.59556 > 192.168.1.45.5005: Flags [P.], seq 748621:750069, ack 3, win 1004, options [nop,nop,TS val 736343155 ecr 2131845180], length 1448
01:14:54.516875 IP 192.168.1.74.59556 > 192.168.1.45.5005: Flags [.], seq 750069:763101, ack 3, win 1004, options [nop,nop,TS val 736343155 ecr 2131845180], length 13032
01:14:54.516982 IP 192.168.1.74.59556 > 192.168.1.45.5005: Flags [.], seq 763101:780477, ack 3, win 1004, options [nop,nop,TS val 736343155 ecr 2131845180], length 17376
01:14:54.517063 IP 192.168.1.74.59556 > 192.168.1.45.5005: Flags [.], seq 780477:794957, ack 3, win 1004, options [nop,nop,TS val 736343155 ecr 2131845180], length 14480
01:14:54.517154 IP 192.168.1.74.59556 > 192.168.1.45.5005: Flags [.], seq 794957:809437, ack 3, win 1004, options [nop,nop,TS val 736343155 ecr 2131845180], length 14480
01:14:54.517242 IP 192.168.1.74.59556 > 192.168.1.45.5005: Flags [P.], seq 809437:815229, ack 3, win 1004, options [nop,nop,TS val 736343155 ecr 2131845180], length 5792
01:14:54.517243 IP 192.168.1.74.59556 > 192.168.1.45.5005: Flags [.], seq 815229:823917, ack 3, win 1004, options [nop,nop,TS val 736343155 ecr 2131845180], length 8688
01:14:54.517331 IP 192.168.1.74.59556 > 192.168.1.45.5005: Flags [.], seq 823917:838397, ack 3, win 1004, options [nop,nop,TS val 736343155 ecr 2131845180], length 14480
01:14:54.517425 IP 192.168.1.45.5005 > 192.168.1.74.59556: Flags [.], ack 719661, win 13153, options [nop,nop,TS val 2131845181 ecr 736343155], length 0
01:14:54.517486 IP 192.168.1.74.59556 > 192.168.1.45.5005: Flags [.], seq 838397:864461, ack 3, win 1004, options [nop,nop,TS val 736343155 ecr 2131845180], length 26064
01:14:54.517573 IP 192.168.1.74.59556 > 192.168.1.45.5005: Flags [.], seq 864461:877493, ack 3, win 1004, options [nop,nop,TS val 736343155 ecr 2131845180], length 13032
01:14:54.517661 IP 192.168.1.74.59556 > 192.168.1.45.5005: Flags [P.], seq 877493:880389, ack 3, win 1004, options [nop,nop,TS val 736343155 ecr 2131845180], length 2896
01:14:54.517661 IP 192.168.1.74.59556 > 192.168.1.45.5005: Flags [.], seq 880389:891973, ack 3, win 1004, options [nop,nop,TS val 736343156 ecr 2131845180], length 11584
01:14:54.517744 IP 192.168.1.74.59556 > 192.168.1.45.5005: Flags [.], seq 891973:906453, ack 3, win 1004, options [nop,nop,TS val 736343156 ecr 2131845180], length 14480
01:14:54.517773 IP 192.168.1.45.5005 > 192.168.1.74.59556: Flags [.], ack 735589, win 13651, options [nop,nop,TS val 2131845181 ecr 736343155], length 0
01:14:54.517786 IP 192.168.1.45.5005 > 192.168.1.74.59556: Flags [.], ack 750069, win 14103, options [nop,nop,TS val 2131845181 ecr 736343155], length 0
01:14:54.517801 IP 192.168.1.45.5005 > 192.168.1.74.59556: Flags [.], ack 763101, win 14510, options [nop,nop,TS val 2131845181 ecr 736343155], length 0
01:14:54.517869 IP 192.168.1.74.59556 > 192.168.1.45.5005: Flags [P.], seq 906453:910797, ack 3, win 1004, options [nop,nop,TS val 736343156 ecr 2131845180], length 4344
01:14:54.517892 IP 192.168.1.45.5005 > 192.168.1.74.59556: Flags [.], ack 780477, win 15053, options [nop,nop,TS val 2131845181 ecr 736343155], length 0
01:14:54.517903 IP 192.168.1.45.5005 > 192.168.1.74.59556: Flags [.], ack 794957, win 15506, options [nop,nop,TS val 2131845181 ecr 736343155], length 0
01:14:54.517916 IP 192.168.1.45.5005 > 192.168.1.74.59556: Flags [.], ack 815229, win 16139, options [nop,nop,TS val 2131845181 ecr 736343155], length 0
01:14:54.517930 IP 192.168.1.45.5005 > 192.168.1.74.59556: Flags [.], ack 838397, win 16863, options [nop,nop,TS val 2131845181 ecr 736343155], length 0
01:14:54.517943 IP 192.168.1.45.5005 > 192.168.1.74.59556: Flags [.], ack 864461, win 17678, options [nop,nop,TS val 2131845181 ecr 736343155], length 0
01:14:54.517958 IP 192.168.1.45.5005 > 192.168.1.74.59556: Flags [.], ack 880389, win 18176, options [nop,nop,TS val 2131845181 ecr 736343155], length 0
01:14:54.517973 IP 192.168.1.45.5005 > 192.168.1.74.59556: Flags [.], ack 906453, win 18990, options [nop,nop,TS val 2131845181 ecr 736343156], length 0
01:14:54.517987 IP 192.168.1.45.5005 > 192.168.1.74.59556: Flags [.], ack 910797, win 19126, options [nop,nop,TS val 2131845181 ecr 736343156], length 0
01:14:54.518107 IP 192.168.1.74.59556 > 192.168.1.45.5005: Flags [.], seq 910797:918037, ack 3, win 1004, options [nop,nop,TS val 736343157 ecr 2131845181], length 7240
01:14:54.518215 IP 192.168.1.74.59556 > 192.168.1.45.5005: Flags [.], seq 918037:935413, ack 3, win 1004, options [nop,nop,TS val 736343157 ecr 2131845181], length 17376
01:14:54.518376 IP 192.168.1.74.59556 > 192.168.1.45.5005: Flags [P.], seq 935413:945549, ack 3, win 1004, options [nop,nop,TS val 736343157 ecr 2131845181], length 10136
01:14:54.518376 IP 192.168.1.74.59556 > 192.168.1.45.5005: Flags [.], seq 945549:962925, ack 3, win 1004, options [nop,nop,TS val 736343157 ecr 2131845181], length 17376
01:14:54.518480 IP 192.168.1.74.59556 > 192.168.1.45.5005: Flags [.], seq 962925:980301, ack 3, win 1004, options [nop,nop,TS val 736343157 ecr 2131845181], length 17376
01:14:54.518572 IP 192.168.1.74.59556 > 192.168.1.45.5005: Flags [.], seq 980301:994781, ack 3, win 1004, options [nop,nop,TS val 736343157 ecr 2131845181], length 14480
01:14:54.518654 IP 192.168.1.74.59556 > 192.168.1.45.5005: Flags [.], seq 994781:1009261, ack 3, win 1004, options [nop,nop,TS val 736343157 ecr 2131845181], length 14480
01:14:54.518744 IP 192.168.1.74.59556 > 192.168.1.45.5005: Flags [P.], seq 1009261:1010709, ack 3, win 1004, options [nop,nop,TS val 736343157 ecr 2131845181], length 1448
01:14:54.518744 IP 192.168.1.74.59556 > 192.168.1.45.5005: Flags [.], seq 1010709:1023741, ack 3, win 1004, options [nop,nop,TS val 736343157 ecr 2131845181], length 13032
01:14:54.518828 IP 192.168.1.74.59556 > 192.168.1.45.5005: Flags [.], seq 1023741:1038221, ack 3, win 1004, options [nop,nop,TS val 736343157 ecr 2131845181], length 14480
01:14:54.518926 IP 192.168.1.74.59556 > 192.168.1.45.5005: Flags [.], seq 1038221:1049805, ack 3, win 1004, options [nop,nop,TS val 736343157 ecr 2131845181], length 11584
01:14:54.519007 IP 192.168.1.74.59556 > 192.168.1.45.5005: Flags [.], seq 1049805:1065733, ack 3, win 1004, options [nop,nop,TS val 736343157 ecr 2131845181], length 15928
01:14:54.519169 IP 192.168.1.45.5005 > 192.168.1.74.59556: Flags [.], ack 935413, win 19895, options [nop,nop,TS val 2131845183 ecr 736343157], length 0
01:14:54.519243 IP 192.168.1.74.59556 > 192.168.1.45.5005: Flags [P.], seq 1065733:1075869, ack 3, win 1004, options [nop,nop,TS val 736343157 ecr 2131845181], length 10136
01:14:54.519243 IP 192.168.1.74.59556 > 192.168.1.45.5005: Flags [.], seq 1075869:1107725, ack 3, win 1004, options [nop,nop,TS val 736343157 ecr 2131845181], length 31856
01:14:54.519391 IP 192.168.1.74.59556 > 192.168.1.45.5005: Flags [.], seq 1107725:1135237, ack 3, win 1004, options [nop,nop,TS val 736343157 ecr 2131845181], length 27512
01:14:54.519418 IP 192.168.1.45.5005 > 192.168.1.74.59556: Flags [.], ack 945549, win 20212, options [nop,nop,TS val 2131845183 ecr 736343157], length 0
01:14:54.519430 IP 192.168.1.45.5005 > 192.168.1.74.59556: Flags [.], ack 962925, win 20755, options [nop,nop,TS val 2131845183 ecr 736343157], length 0
01:14:54.519439 IP 192.168.1.45.5005 > 192.168.1.74.59556: Flags [.], ack 980301, win 21298, options [nop,nop,TS val 2131845183 ecr 736343157], length 0
01:14:54.519448 IP 192.168.1.45.5005 > 192.168.1.74.59556: Flags [.], ack 994781, win 21750, options [nop,nop,TS val 2131845183 ecr 736343157], length 0
01:14:54.519457 IP 192.168.1.45.5005 > 192.168.1.74.59556: Flags [.], ack 1010709, win 22248, options [nop,nop,TS val 2131845183 ecr 736343157], length 0
01:14:54.519466 IP 192.168.1.45.5005 > 192.168.1.74.59556: Flags [.], ack 1023741, win 22655, options [nop,nop,TS val 2131845183 ecr 736343157], length 0
01:14:54.519475 IP 192.168.1.45.5005 > 192.168.1.74.59556: Flags [.], ack 1049805, win 22535, options [nop,nop,TS val 2131845183 ecr 736343157], length 0
01:14:54.519485 IP 192.168.1.45.5005 > 192.168.1.74.59556: Flags [.], ack 1065733, win 22368, options [nop,nop,TS val 2131845183 ecr 736343157], length 0
01:14:54.519494 IP 192.168.1.45.5005 > 192.168.1.74.59556: Flags [.], ack 1075869, win 22263, options [nop,nop,TS val 2131845183 ecr 736343157], length 0
01:14:54.519505 IP 192.168.1.45.5005 > 192.168.1.74.59556: Flags [.], ack 1107725, win 21929, options [nop,nop,TS val 2131845183 ecr 736343157], length 0
01:14:54.519612 IP 192.168.1.74.59556 > 192.168.1.45.5005: Flags [P.], seq 1135237:1136685, ack 3, win 1004, options [nop,nop,TS val 736343157 ecr 2131845181], length 1448
01:14:54.519697 IP 192.168.1.74.59556 > 192.168.1.45.5005: Flags [P.], seq 1136685:1141029, ack 3, win 1004, options [nop,nop,TS val 736343158 ecr 2131845183], length 4344
01:14:54.519898 IP 192.168.1.74.59556 > 192.168.1.45.5005: Flags [.], seq 1141029:1151165, ack 3, win 1004, options [nop,nop,TS val 736343158 ecr 2131845183], length 10136
01:14:54.519999 IP 192.168.1.74.59556 > 192.168.1.45.5005: Flags [.], seq 1151165:1168541, ack 3, win 1004, options [nop,nop,TS val 736343158 ecr 2131845183], length 17376
01:14:54.520080 IP 192.168.1.74.59556 > 192.168.1.45.5005: Flags [.], seq 1168541:1183021, ack 3, win 1004, options [nop,nop,TS val 736343158 ecr 2131845183], length 14480
01:14:54.520163 IP 192.168.1.74.59556 > 192.168.1.45.5005: Flags [.], seq 1183021:1196053, ack 3, win 1004, options [nop,nop,TS val 736343158 ecr 2131845183], length 13032
01:14:54.520250 IP 192.168.1.74.59556 > 192.168.1.45.5005: Flags [P.], seq 1196053:1206189, ack 3, win 1004, options [nop,nop,TS val 736343158 ecr 2131845183], length 10136
01:14:54.520250 IP 192.168.1.74.59556 > 192.168.1.45.5005: Flags [.], seq 1206189:1210533, ack 3, win 1004, options [nop,nop,TS val 736343158 ecr 2131845183], length 4344
01:14:54.520333 IP 192.168.1.74.59556 > 192.168.1.45.5005: Flags [.], seq 1210533:1223565, ack 3, win 1004, options [nop,nop,TS val 736343158 ecr 2131845183], length 13032
01:14:54.520416 IP 192.168.1.74.59556 > 192.168.1.45.5005: Flags [.], seq 1223565:1238045, ack 3, win 1004, options [nop,nop,TS val 736343158 ecr 2131845183], length 14480
01:14:54.520497 IP 192.168.1.74.59556 > 192.168.1.45.5005: Flags [.], seq 1238045:1251077, ack 3, win 1004, options [nop,nop,TS val 736343158 ecr 2131845183], length 13032
01:14:54.520584 IP 192.168.1.74.59556 > 192.168.1.45.5005: Flags [.], seq 1251077:1265557, ack 3, win 1004, options [nop,nop,TS val 736343158 ecr 2131845183], length 14480
01:14:54.520668 IP 192.168.1.74.59556 > 192.168.1.45.5005: Flags [P.], seq 1265557:1271349, ack 3, win 1004, options [nop,nop,TS val 736343158 ecr 2131845183], length 5792
01:14:54.520668 IP 192.168.1.74.59556 > 192.168.1.45.5005: Flags [.], seq 1271349:1280037, ack 3, win 1004, options [nop,nop,TS val 736343159 ecr 2131845183], length 8688
01:14:54.520771 IP 192.168.1.45.5005 > 192.168.1.74.59556: Flags [.], ack 1135237, win 22655, options [nop,nop,TS val 2131845184 ecr 736343157], length 0
01:14:54.520787 IP 192.168.1.45.5005 > 192.168.1.74.59556: Flags [.], ack 1136685, win 22701, options [nop,nop,TS val 2131845184 ecr 736343157], length 0
01:14:54.520859 IP 192.168.1.74.59556 > 192.168.1.45.5005: Flags [.], seq 1280037:1308997, ack 3, win 1004, options [nop,nop,TS val 736343159 ecr 2131845183], length 28960
01:14:54.520953 IP 192.168.1.74.59556 > 192.168.1.45.5005: Flags [.], seq 1308997:1323477, ack 3, win 1004, options [nop,nop,TS val 736343159 ecr 2131845183], length 14480
01:14:54.521027 IP 192.168.1.74.59556 > 192.168.1.45.5005: Flags [P.], seq 1323477:1336509, ack 3, win 1004, options [nop,nop,TS val 736343159 ecr 2131845183], length 13032
01:14:54.521057 IP 192.168.1.45.5005 > 192.168.1.74.59556: Flags [.], ack 1151165, win 23153, options [nop,nop,TS val 2131845184 ecr 736343158], length 0
01:14:54.521070 IP 192.168.1.45.5005 > 192.168.1.74.59556: Flags [.], ack 1168541, win 23696, options [nop,nop,TS val 2131845185 ecr 736343158], length 0
01:14:54.521079 IP 192.168.1.45.5005 > 192.168.1.74.59556: Flags [.], ack 1183021, win 23730, options [nop,nop,TS val 2131845185 ecr 736343158], length 0
01:14:54.521248 IP 192.168.1.74.59556 > 192.168.1.45.5005: Flags [.], seq 1336509:1337957, ack 3, win 1004, options [nop,nop,TS val 736343160 ecr 2131845184], length 1448
01:14:54.521360 IP 192.168.1.74.59556 > 192.168.1.45.5005: Flags [.], seq 1337957:1355333, ack 3, win 1004, options [nop,nop,TS val 736343160 ecr 2131845184], length 17376
01:14:54.521439 IP 192.168.1.74.59556 > 192.168.1.45.5005: Flags [P.], seq 1355333:1371261, ack 3, win 1004, options [nop,nop,TS val 736343160 ecr 2131845184], length 15928
01:14:54.521460 IP 192.168.1.74.59556 > 192.168.1.45.5005: Flags [.], seq 1371261:1372709, ack 3, win 1004, options [nop,nop,TS val 736343160 ecr 2131845185], length 1448
01:14:54.521543 IP 192.168.1.74.59556 > 192.168.1.45.5005: Flags [.], seq 1372709:1387189, ack 3, win 1004, options [nop,nop,TS val 736343160 ecr 2131845185], length 14480
01:14:54.521627 IP 192.168.1.74.59556 > 192.168.1.45.5005: Flags [.], seq 1387189:1400221, ack 3, win 1004, options [nop,nop,TS val 736343160 ecr 2131845185], length 13032
01:14:54.521653 IP 192.168.1.45.5005 > 192.168.1.74.59556: Flags [.], ack 1336509, win 23730, options [nop,nop,TS val 2131845185 ecr 736343158], length 0
01:14:54.521666 IP 192.168.1.45.5005 > 192.168.1.74.59556: Flags [.], ack 1355333, win 24318, options [nop,nop,TS val 2131845185 ecr 736343160], length 0
01:14:54.521676 IP 192.168.1.45.5005 > 192.168.1.74.59556: Flags [.], ack 1371261, win 24816, options [nop,nop,TS val 2131845185 ecr 736343160], length 0
01:14:54.521685 IP 192.168.1.45.5005 > 192.168.1.74.59556: Flags [.], ack 1387189, win 25145, options [nop,nop,TS val 2131845185 ecr 736343160], length 0
01:14:54.521714 IP 192.168.1.45.5005 > 192.168.1.74.59556: Flags [.], ack 1400221, win 25145, options [nop,nop,TS val 2131845185 ecr 736343160], length 0
01:14:54.521828 IP 192.168.1.74.59556 > 192.168.1.45.5005: Flags [P.], seq 1400221:1401669, ack 3, win 1004, options [nop,nop,TS val 736343160 ecr 2131845185], length 1448
01:14:54.521833 IP 192.168.1.45.5005 > 192.168.1.74.59556: Flags [.], ack 1401669, win 25190, options [nop,nop,TS val 2131845185 ecr 736343160], length 0
01:14:54.522189 IP 192.168.1.74.59556 > 192.168.1.45.5005: Flags [.], seq 1401669:1414701, ack 3, win 1004, options [nop,nop,TS val 736343161 ecr 2131845185], length 13032
01:14:54.522204 IP 192.168.1.45.5005 > 192.168.1.74.59556: Flags [.], ack 1414701, win 25597, options [nop,nop,TS val 2131845186 ecr 736343161], length 0
01:14:54.522366 IP 192.168.1.74.59556 > 192.168.1.45.5005: Flags [.], seq 1414701:1445109, ack 3, win 1004, options [nop,nop,TS val 736343161 ecr 2131845185], length 30408
01:14:54.522379 IP 192.168.1.45.5005 > 192.168.1.74.59556: Flags [.], ack 1445109, win 25888, options [nop,nop,TS val 2131845186 ecr 736343161], length 0
01:14:54.522496 IP 192.168.1.74.59556 > 192.168.1.45.5005: Flags [P.], seq 1445109:1466829, ack 3, win 1004, options [nop,nop,TS val 736343161 ecr 2131845185], length 21720
01:14:54.522536 IP 192.168.1.74.59556 > 192.168.1.45.5005: Flags [.], seq 1466829:1472621, ack 3, win 1004, options [nop,nop,TS val 736343161 ecr 2131845185], length 5792
01:14:54.522623 IP 192.168.1.74.59556 > 192.168.1.45.5005: Flags [.], seq 1472621:1487101, ack 3, win 1004, options [nop,nop,TS val 736343161 ecr 2131845185], length 14480
01:14:54.522705 IP 192.168.1.74.59556 > 192.168.1.45.5005: Flags [.], seq 1487101:1501581, ack 3, win 1004, options [nop,nop,TS val 736343161 ecr 2131845185], length 14480
01:14:54.522790 IP 192.168.1.74.59556 > 192.168.1.45.5005: Flags [.], seq 1501581:1516061, ack 3, win 1004, options [nop,nop,TS val 736343161 ecr 2131845185], length 14480
01:14:54.522892 IP 192.168.1.74.59556 > 192.168.1.45.5005: Flags [.], seq 1516061:1529093, ack 3, win 1004, options [nop,nop,TS val 736343161 ecr 2131845185], length 13032
01:14:54.522973 IP 192.168.1.74.59556 > 192.168.1.45.5005: Flags [P.], seq 1529093:1531989, ack 3, win 1004, options [nop,nop,TS val 736343161 ecr 2131845185], length 2896
01:14:54.522973 IP 192.168.1.74.59556 > 192.168.1.45.5005: Flags [.], seq 1531989:1545021, ack 3, win 1004, options [nop,nop,TS val 736343161 ecr 2131845185], length 13032
01:14:54.523069 IP 192.168.1.74.59556 > 192.168.1.45.5005: Flags [.], seq 1545021:1563845, ack 3, win 1004, options [nop,nop,TS val 736343161 ecr 2131845185], length 18824
01:14:54.523161 IP 192.168.1.74.59556 > 192.168.1.45.5005: Flags [P.], seq 1563845:1582669, ack 3, win 1004, options [nop,nop,TS val 736343161 ecr 2131845185], length 18824
01:14:54.523200 IP 192.168.1.74.59556 > 192.168.1.45.5005: Flags [.], seq 1582669:1591357, ack 3, win 1004, options [nop,nop,TS val 736343161 ecr 2131845185], length 8688
01:14:54.523275 IP 192.168.1.74.59556 > 192.168.1.45.5005: Flags [P.], seq 1591357:1597149, ack 3, win 1004, options [nop,nop,TS val 736343161 ecr 2131845185], length 5792
01:14:54.523275 IP 192.168.1.74.59556 > 192.168.1.45.5005: Flags [.], seq 1597149:1605837, ack 3, win 1004, options [nop,nop,TS val 736343161 ecr 2131845185], length 8688
01:14:54.523353 IP 192.168.1.74.59556 > 192.168.1.45.5005: Flags [.], seq 1605837:1618869, ack 3, win 1004, options [nop,nop,TS val 736343161 ecr 2131845185], length 13032
01:14:54.523419 IP 192.168.1.74.59556 > 192.168.1.45.5005: Flags [.], seq 1618869:1633349, ack 3, win 1004, options [nop,nop,TS val 736343161 ecr 2131845185], length 14480
01:14:54.523489 IP 192.168.1.74.59556 > 192.168.1.45.5005: Flags [P.], seq 1633349:1636245, ack 3, win 1004, options [nop,nop,TS val 736343161 ecr 2131845185], length 2896
01:14:54.523489 IP 192.168.1.74.59556 > 192.168.1.45.5005: Flags [.], seq 1636245:1644933, ack 3, win 1004, options [nop,nop,TS val 736343161 ecr 2131845185], length 8688
01:14:54.523558 IP 192.168.1.74.59556 > 192.168.1.45.5005: Flags [P.], seq 1644933:1652173, ack 3, win 1004, options [nop,nop,TS val 736343161 ecr 2131845185], length 7240
01:14:54.523558 IP 192.168.1.74.59556 > 192.168.1.45.5005: Flags [.], seq 1652173:1659413, ack 3, win 1004, options [nop,nop,TS val 736343161 ecr 2131845186], length 7240
01:14:54.523614 IP 192.168.1.74.59556 > 192.168.1.45.5005: Flags [P.], seq 1659413:1662309, ack 3, win 1004, options [nop,nop,TS val 736343161 ecr 2131845186], length 2896
01:14:54.523614 IP 192.168.1.74.59556 > 192.168.1.45.5005: Flags [P.], seq 1662309:1665205, ack 3, win 1004, options [nop,nop,TS val 736343161 ecr 2131845186], length 2896
01:14:54.523720 IP 192.168.1.45.5005 > 192.168.1.74.59556: Flags [.], ack 1665205, win 25888, options [nop,nop,TS val 2131845187 ecr 736343161], length 0
01:14:54.524319 IP 192.168.1.74.59556 > 192.168.1.45.5005: Flags [.], seq 1665205:1692717, ack 3, win 1004, options [nop,nop,TS val 736343163 ecr 2131845187], length 27512
01:14:54.524342 IP 192.168.1.45.5005 > 192.168.1.74.59556: Flags [.], ack 1692717, win 26055, options [nop,nop,TS val 2131845188 ecr 736343163], length 0
01:14:54.524482 IP 192.168.1.74.59556 > 192.168.1.45.5005: Flags [P.], seq 1692717:1727469, ack 3, win 1004, options [nop,nop,TS val 736343163 ecr 2131845187], length 34752
01:14:54.524505 IP 192.168.1.74.59556 > 192.168.1.45.5005: Flags [.], seq 1727469:1730365, ack 3, win 1004, options [nop,nop,TS val 736343163 ecr 2131845187], length 2896
01:14:54.524590 IP 192.168.1.74.59556 > 192.168.1.45.5005: Flags [.], seq 1730365:1744845, ack 3, win 1004, options [nop,nop,TS val 736343163 ecr 2131845187], length 14480
01:14:54.524677 IP 192.168.1.74.59556 > 192.168.1.45.5005: Flags [.], seq 1744845:1762221, ack 3, win 1004, options [nop,nop,TS val 736343163 ecr 2131845187], length 17376
01:14:54.524745 IP 192.168.1.74.59556 > 192.168.1.45.5005: Flags [.], seq 1762221:1778149, ack 3, win 1004, options [nop,nop,TS val 736343163 ecr 2131845187], length 15928
01:14:54.524805 IP 192.168.1.74.59556 > 192.168.1.45.5005: Flags [P.], seq 1778149:1792629, ack 3, win 1004, options [nop,nop,TS val 736343163 ecr 2131845187], length 14480
01:14:54.524824 IP 192.168.1.74.59556 > 192.168.1.45.5005: Flags [.], seq 1792629:1794077, ack 3, win 1004, options [nop,nop,TS val 736343163 ecr 2131845187], length 1448
01:14:54.524916 IP 192.168.1.74.59556 > 192.168.1.45.5005: Flags [.], seq 1794077:1808557, ack 3, win 1004, options [nop,nop,TS val 736343163 ecr 2131845187], length 14480
01:14:54.524988 IP 192.168.1.74.59556 > 192.168.1.45.5005: Flags [.], seq 1808557:1823037, ack 3, win 1004, options [nop,nop,TS val 736343163 ecr 2131845187], length 14480
01:14:54.525070 IP 192.168.1.74.59556 > 192.168.1.45.5005: Flags [.], seq 1823037:1837517, ack 3, win 1004, options [nop,nop,TS val 736343163 ecr 2131845187], length 14480
01:14:54.525159 IP 192.168.1.74.59556 > 192.168.1.45.5005: Flags [P.], seq 1837517:1857789, ack 3, win 1004, options [nop,nop,TS val 736343163 ecr 2131845187], length 20272
01:14:54.525200 IP 192.168.1.74.59556 > 192.168.1.45.5005: Flags [.], seq 1857789:1866477, ack 3, win 1004, options [nop,nop,TS val 736343163 ecr 2131845187], length 8688
01:14:54.525270 IP 192.168.1.74.59556 > 192.168.1.45.5005: Flags [.], seq 1866477:1880957, ack 3, win 1004, options [nop,nop,TS val 736343163 ecr 2131845187], length 14480
01:14:54.525359 IP 192.168.1.74.59556 > 192.168.1.45.5005: Flags [.], seq 1880957:1898333, ack 3, win 1004, options [nop,nop,TS val 736343163 ecr 2131845187], length 17376
01:14:54.525433 IP 192.168.1.74.59556 > 192.168.1.45.5005: Flags [.], seq 1898333:1911365, ack 3, win 1004, options [nop,nop,TS val 736343163 ecr 2131845187], length 13032
01:14:54.525503 IP 192.168.1.74.59556 > 192.168.1.45.5005: Flags [P.], seq 1911365:1922949, ack 3, win 1004, options [nop,nop,TS val 736343163 ecr 2131845187], length 11584
01:14:54.525527 IP 192.168.1.74.59556 > 192.168.1.45.5005: Flags [.], seq 1922949:1927293, ack 3, win 1004, options [nop,nop,TS val 736343163 ecr 2131845187], length 4344
01:14:54.525627 IP 192.168.1.74.59556 > 192.168.1.45.5005: Flags [P.], seq 1927293:1928741, ack 3, win 1004, options [nop,nop,TS val 736343163 ecr 2131845187], length 1448
01:14:54.525627 IP 192.168.1.74.59556 > 192.168.1.45.5005: Flags [.], seq 1928741:1941773, ack 3, win 1004, options [nop,nop,TS val 736343163 ecr 2131845188], length 13032
01:14:54.525704 IP 192.168.1.74.59556 > 192.168.1.45.5005: Flags [P.], seq 1941773:1957701, ack 3, win 1004, options [nop,nop,TS val 736343163 ecr 2131845188], length 15928
01:14:54.525721 IP 192.168.1.74.59556 > 192.168.1.45.5005: Flags [R.], seq 1957701, ack 3, win 1004, options [nop,nop,TS val 736343164 ecr 2131845188], length 0

298 packets captured
298 packets received by filter
0 packets dropped by kernel
