tcpdump: verbose output suppressed, use -v[v]... for full protocol decode
listening on enp0s8, link-type EN10MB (Ethernet), snapshot length 262144 bytes
01:02:44.134022 IP 192.168.1.74.54910 > 192.168.1.45.5005: Flags [S], seq 1599038756, win 64240, options [mss 1460,sackOK,TS val 735612766 ecr 0,nop,wscale 6], length 0
01:02:44.134046 IP 192.168.1.45.5005 > 192.168.1.74.54910: Flags [S.], seq 284183185, ack 1599038757, win 65160, options [mss 1460,sackOK,TS val 2131114797 ecr 735612766,nop,wscale 6], length 0
01:02:44.134188 IP 192.168.1.74.54910 > 192.168.1.45.5005: Flags [.], ack 1, win 1004, options [nop,nop,TS val 735612766 ecr 2131114797], length 0
01:02:44.134704 IP 192.168.1.74.54910 > 192.168.1.45.5005: Flags [P.], seq 1:5, ack 1, win 1004, options [nop,nop,TS val 735612767 ecr 2131114797], length 4
01:02:44.134716 IP 192.168.1.45.5005 > 192.168.1.74.54910: Flags [.], ack 5, win 1019, options [nop,nop,TS val 2131114798 ecr 735612767], length 0
01:02:44.134974 IP 192.168.1.45.5005 > 192.168.1.74.54910: Flags [P.], seq 1:3, ack 5, win 1019, options [nop,nop,TS val 2131114798 ecr 735612767], length 2
01:02:44.135176 IP 192.168.1.74.54910 > 192.168.1.45.5005: Flags [.], ack 3, win 1004, options [nop,nop,TS val 735612767 ecr 2131114798], length 0
01:02:44.135245 IP 192.168.1.74.54910 > 192.168.1.45.5005: Flags [P.], seq 5:7245, ack 3, win 1004, options [nop,nop,TS val 735612767 ecr 2131114798], length 7240
01:02:44.135245 IP 192.168.1.74.54910 > 192.168.1.45.5005: Flags [.], seq 7245:8693, ack 3, win 1004, options [nop,nop,TS val 735612767 ecr 2131114798], length 1448
01:02:44.135274 IP 192.168.1.74.54910 > 192.168.1.45.5005: Flags [P.], seq 8693:14485, ack 3, win 1004, options [nop,nop,TS val 735612767 ecr 2131114798], length 5792
01:02:44.139448 IP 192.168.1.74.54910 > 192.168.1.45.5005: Flags [.], seq 14485:15933, ack 3, win 1004, options [nop,nop,TS val 735612772 ecr 2131114798], length 1448
01:02:44.179231 IP 192.168.1.45.5005 > 192.168.1.74.54910: Flags [.], ack 15933, win 857, options [nop,nop,TS val 2131114843 ecr 735612767], length 0
01:02:44.180021 IP 192.168.1.74.54910 > 192.168.1.45.5005: Flags [P.], seq 15933:26069, ack 3, win 1004, options [nop,nop,TS val 735612812 ecr 2131114843], length 10136
01:02:44.180022 IP 192.168.1.74.54910 > 192.168.1.45.5005: Flags [P.], seq 26069:36205, ack 3, win 1004, options [nop,nop,TS val 735612812 ecr 2131114843], length 10136
01:02:44.180057 IP 192.168.1.45.5005 > 192.168.1.74.54910: Flags [.], ack 26069, win 752, options [nop,nop,TS val 2131114843 ecr 735612812], length 0
01:02:44.180081 IP 192.168.1.45.5005 > 192.168.1.74.54910: Flags [.], ack 36205, win 645, options [nop,nop,TS val 2131114844 ecr 735612812], length 0
01:02:44.180120 IP 192.168.1.74.54910 > 192.168.1.45.5005: Flags [P.], seq 36205:46341, ack 3, win 1004, options [nop,nop,TS val 735612812 ecr 2131114843], length 10136
01:02:44.180126 IP 192.168.1.45.5005 > 192.168.1.74.54910: Flags [.], ack 46341, win 540, options [nop,nop,TS val 2131114844 ecr 735612812], length 0
01:02:44.180494 IP 192.168.1.74.54910 > 192.168.1.45.5005: Flags [.], seq 46341:53581, ack 3, win 1004, options [nop,nop,TS val 735612813 ecr 2131114843], length 7240
01:02:44.180571 IP 192.168.1.74.54910 > 192.168.1.45.5005: Flags [P.], seq 53581:60821, ack 3, win 1004, options [nop,nop,TS val 735612813 ecr 2131114843], length 7240
01:02:44.180571 IP 192.168.1.74.54910 > 192.168.1.45.5005: Flags [P.], seq 60821:66613, ack 3, win 1004, options [nop,nop,TS val 735612813 ecr 2131114844], length 5792
01:02:44.180599 IP 192.168.1.74.54910 > 192.168.1.45.5005: Flags [.], seq 66613:70957, ack 3, win 1004, options [nop,nop,TS val 735612813 ecr 2131114844], length 4344
01:02:44.180673 IP 192.168.1.74.54910 > 192.168.1.45.5005: Flags [P.], seq 70957:77485, ack 3, win 1004, options [nop,nop,TS val 735612813 ecr 2131114844], length 6528
01:02:44.180673 IP 192.168.1.74.54910 > 192.168.1.45.5005: Flags [P.], seq 77485:78197, ack 3, win 1004, options [nop,nop,TS val 735612813 ecr 2131114844], length 712
01:02:44.180673 IP 192.168.1.74.54910 > 192.168.1.45.5005: Flags [.], seq 78197:79645, ack 3, win 1004, options [nop,nop,TS val 735612813 ecr 2131114844], length 1448
01:02:44.195878 IP 192.168.1.74.54910 > 192.168.1.45.5005: Flags [.], seq 78197:79645, ack 3, win 1004, options [nop,nop,TS val 735612828 ecr 2131114844], length 1448
01:02:44.223241 IP 192.168.1.45.5005 > 192.168.1.74.54910: Flags [.], ack 79645, win 176, options [nop,nop,TS val 2131114887 ecr 735612813,nop,nop,sack 1 {78197:79645}], length 0
01:02:44.224078 IP 192.168.1.74.54910 > 192.168.1.45.5005: Flags [P.], seq 79645:90909, ack 3, win 1004, options [nop,nop,TS val 735612856 ecr 2131114887], length 11264
01:02:44.247933 IP 192.168.1.74.54910 > 192.168.1.45.5005: Flags [.], seq 89781:90909, ack 3, win 1004, options [nop,nop,TS val 735612880 ecr 2131114887], length 1128
01:02:44.267271 IP 192.168.1.45.5005 > 192.168.1.74.54910: Flags [.], ack 90909, win 0, options [nop,nop,TS val 2131114931 ecr 735612856,nop,nop,sack 1 {89781:90909}], length 0
01:02:44.487693 IP 192.168.1.74.54910 > 192.168.1.45.5005: Flags [.], ack 3, win 1004, options [nop,nop,TS val 735613120 ecr 2131114931], length 0
01:02:44.487722 IP 192.168.1.45.5005 > 192.168.1.74.54910: Flags [.], ack 90909, win 0, options [nop,nop,TS val 2131115151 ecr 735612856], length 0
01:02:44.931551 IP 192.168.1.74.54910 > 192.168.1.45.5005: Flags [.], ack 3, win 1004, options [nop,nop,TS val 735613564 ecr 2131115151], length 0
01:02:45.827466 IP 192.168.1.74.54910 > 192.168.1.45.5005: Flags [.], ack 3, win 1004, options [nop,nop,TS val 735614460 ecr 2131115151], length 0
01:02:45.827494 IP 192.168.1.45.5005 > 192.168.1.74.54910: Flags [.], ack 90909, win 0, options [nop,nop,TS val 2131116491 ecr 735612856], length 0
01:02:47.586930 IP 192.168.1.74.54910 > 192.168.1.45.5005: Flags [.], ack 3, win 1004, options [nop,nop,TS val 735616220 ecr 2131116491], length 0
01:02:47.586963 IP 192.168.1.45.5005 > 192.168.1.74.54910: Flags [.], ack 90909, win 0, options [nop,nop,TS val 2131118250 ecr 735612856], length 0
01:02:51.074087 IP 192.168.1.74.54910 > 192.168.1.45.5005: Flags [.], ack 3, win 1004, options [nop,nop,TS val 735619708 ecr 2131118250], length 0
01:02:51.074115 IP 192.168.1.45.5005 > 192.168.1.74.54910: Flags [.], ack 90909, win 0, options [nop,nop,TS val 2131121738 ecr 735612856], length 0
01:02:58.240512 IP 192.168.1.74.54910 > 192.168.1.45.5005: Flags [.], ack 3, win 1004, options [nop,nop,TS val 735626876 ecr 2131121738], length 0
01:02:58.240539 IP 192.168.1.45.5005 > 192.168.1.74.54910: Flags [.], ack 90909, win 0, options [nop,nop,TS val 2131128904 ecr 735612856], length 0
01:02:59.135518 IP 192.168.1.45.5005 > 192.168.1.74.54910: Flags [.], ack 90909, win 1002, options [nop,nop,TS val 2131129799 ecr 735612856], length 0
01:02:59.136408 IP 192.168.1.74.54910 > 192.168.1.45.5005: Flags [P.], seq 90909:98149, ack 3, win 1004, options [nop,nop,TS val 735627772 ecr 2131129799], length 7240
01:02:59.136408 IP 192.168.1.74.54910 > 192.168.1.45.5005: Flags [.], seq 98149:103941, ack 3, win 1004, options [nop,nop,TS val 735627772 ecr 2131129799], length 5792
01:02:59.136452 IP 192.168.1.45.5005 > 192.168.1.74.54910: Flags [.], ack 98149, win 1228, options [nop,nop,TS val 2131129800 ecr 735627772], length 0
01:02:59.136478 IP 192.168.1.45.5005 > 192.168.1.74.54910: Flags [.], ack 103941, win 1409, options [nop,nop,TS val 2131129800 ecr 735627772], length 0
01:02:59.136672 IP 192.168.1.74.54910 > 192.168.1.45.5005: Flags [P.], seq 103941:105389, ack 3, win 1004, options [nop,nop,TS val 735627772 ecr 2131129799], length 1448
01:02:59.136681 IP 192.168.1.45.5005 > 192.168.1.74.54910: Flags [.], ack 105389, win 1454, options [nop,nop,TS val 2131129800 ecr 735627772], length 0
01:02:59.137209 IP 192.168.1.74.54910 > 192.168.1.45.5005: Flags [P.], seq 105389:108285, ack 3, win 1004, options [nop,nop,TS val 735627773 ecr 2131129800], length 2896
01:02:59.137209 IP 192.168.1.74.54910 > 192.168.1.45.5005: Flags [P.], seq 108285:110053, ack 3, win 1004, options [nop,nop,TS val 735627773 ecr 2131129800], length 1768
01:02:59.137209 IP 192.168.1.74.54910 > 192.168.1.45.5005: Flags [P.], seq 110053:112949, ack 3, win 1004, options [nop,nop,TS val 735627773 ecr 2131129800], length 2896
01:02:59.137210 IP 192.168.1.74.54910 > 192.168.1.45.5005: Flags [.], seq 112949:114397, ack 3, win 1004, options [nop,nop,TS val 735627773 ecr 2131129800], length 1448
01:02:59.137233 IP 192.168.1.45.5005 > 192.168.1.74.54910: Flags [.], ack 108285, win 1545, options [nop,nop,TS val 2131129801 ecr 735627773], length 0
01:02:59.137270 IP 192.168.1.45.5005 > 192.168.1.74.54910: Flags [.], ack 110053, win 1600, options [nop,nop,TS val 2131129801 ecr 735627773], length 0
01:02:59.137283 IP 192.168.1.45.5005 > 192.168.1.74.54910: Flags [.], ack 112949, win 1690, options [nop,nop,TS val 2131129801 ecr 735627773], length 0
01:02:59.137296 IP 192.168.1.45.5005 > 192.168.1.74.54910: Flags [.], ack 114397, win 1736, options [nop,nop,TS val 2131129801 ecr 735627773], length 0
01:02:59.137413 IP 192.168.1.74.54910 > 192.168.1.45.5005: Flags [P.], seq 114397:115845, ack 3, win 1004, options [nop,nop,TS val 735627773 ecr 2131129800], length 1448
01:02:59.137413 IP 192.168.1.74.54910 > 192.168.1.45.5005: Flags [P.], seq 115845:121637, ack 3, win 1004, options [nop,nop,TS val 735627773 ecr 2131129800], length 5792
01:02:59.137413 IP 192.168.1.74.54910 > 192.168.1.45.5005: Flags [P.], seq 121637:127429, ack 3, win 1004, options [nop,nop,TS val 735627773 ecr 2131129800], length 5792
01:02:59.137423 IP 192.168.1.45.5005 > 192.168.1.74.54910: Flags [.], ack 115845, win 1781, options [nop,nop,TS val 2131129801 ecr 735627773], length 0
01:02:59.137442 IP 192.168.1.45.5005 > 192.168.1.74.54910: Flags [.], ack 121637, win 1962, options [nop,nop,TS val 2131129801 ecr 735627773], length 0
01:02:59.137454 IP 192.168.1.45.5005 > 192.168.1.74.54910: Flags [.], ack 127429, win 2143, options [nop,nop,TS val 2131129801 ecr 735627773], length 0
01:02:59.137584 IP 192.168.1.74.54910 > 192.168.1.45.5005: Flags [P.], seq 127429:133221, ack 3, win 1004, options [nop,nop,TS val 735627773 ecr 2131129800], length 5792
01:02:59.137591 IP 192.168.1.45.5005 > 192.168.1.74.54910: Flags [.], ack 133221, win 2324, options [nop,nop,TS val 2131129801 ecr 735627773], length 0
01:02:59.137694 IP 192.168.1.74.54910 > 192.168.1.45.5005: Flags [P.], seq 133221:139013, ack 3, win 1004, options [nop,nop,TS val 735627774 ecr 2131129801], length 5792
01:02:59.137694 IP 192.168.1.74.54910 > 192.168.1.45.5005: Flags [P.], seq 139013:141909, ack 3, win 1004, options [nop,nop,TS val 735627774 ecr 2131129801], length 2896
01:02:59.137694 IP 192.168.1.74.54910 > 192.168.1.45.5005: Flags [P.], seq 141909:144805, ack 3, win 1004, options [nop,nop,TS val 735627774 ecr 2131129801], length 2896
01:02:59.137703 IP 192.168.1.45.5005 > 192.168.1.74.54910: Flags [.], ack 139013, win 2505, options [nop,nop,TS val 2131129801 ecr 735627774], length 0
01:02:59.137718 IP 192.168.1.45.5005 > 192.168.1.74.54910: Flags [.], ack 141909, win 2595, options [nop,nop,TS val 2131129801 ecr 735627774], length 0
01:02:59.137729 IP 192.168.1.45.5005 > 192.168.1.74.54910: Flags [.], ack 144805, win 2686, options [nop,nop,TS val 2131129801 ecr 735627774], length 0
01:02:59.137905 IP 192.168.1.74.54910 > 192.168.1.45.5005: Flags [P.], seq 144805:150597, ack 3, win 1004, options [nop,nop,TS val 735627774 ecr 2131129801], length 5792
01:02:59.137905 IP 192.168.1.74.54910 > 192.168.1.45.5005: Flags [.], seq 150597:153493, ack 3, win 1004, options [nop,nop,TS val 735627774 ecr 2131129801], length 2896
01:02:59.138005 IP 192.168.1.74.54910 > 192.168.1.45.5005: Flags [P.], seq 153493:156389, ack 3, win 1004, options [nop,nop,TS val 735627774 ecr 2131129801], length 2896
01:02:59.138005 IP 192.168.1.74.54910 > 192.168.1.45.5005: Flags [.], seq 156389:166525, ack 3, win 1004, options [nop,nop,TS val 735627774 ecr 2131129801], length 10136
01:02:59.138102 IP 192.168.1.74.54910 > 192.168.1.45.5005: Flags [P.], seq 166525:167973, ack 3, win 1004, options [nop,nop,TS val 735627774 ecr 2131129801], length 1448
01:02:59.138102 IP 192.168.1.74.54910 > 192.168.1.45.5005: Flags [P.], seq 167973:173765, ack 3, win 1004, options [nop,nop,TS val 735627774 ecr 2131129801], length 5792
01:02:59.138102 IP 192.168.1.74.54910 > 192.168.1.45.5005: Flags [.], seq 173765:181005, ack 3, win 1004, options [nop,nop,TS val 735627774 ecr 2131129801], length 7240
01:02:59.138192 IP 192.168.1.74.54910 > 192.168.1.45.5005: Flags [P.], seq 181005:191141, ack 3, win 1004, options [nop,nop,TS val 735627774 ecr 2131129801], length 10136
01:02:59.138192 IP 192.168.1.74.54910 > 192.168.1.45.5005: Flags [.], seq 191141:194037, ack 3, win 1004, options [nop,nop,TS val 735627774 ecr 2131129801], length 2896
01:02:59.138270 IP 192.168.1.74.54910 > 192.168.1.45.5005: Flags [P.], seq 194037:202725, ack 3, win 1004, options [nop,nop,TS val 735627774 ecr 2131129801], length 8688
01:02:59.138270 IP 192.168.1.74.54910 > 192.168.1.45.5005: Flags [P.], seq 202725:205621, ack 3, win 1004, options [nop,nop,TS val 735627774 ecr 2131129801], length 2896
01:02:59.138296 IP 192.168.1.74.54910 > 192.168.1.45.5005: Flags [P.], seq 205621:208517, ack 3, win 1004, options [nop,nop,TS val 735627774 ecr 2131129801], length 2896
01:02:59.138296 IP 192.168.1.74.54910 > 192.168.1.45.5005: Flags [.], seq 208517:209965, ack 3, win 1004, options [nop,nop,TS val 735627774 ecr 2131129801], length 1448
01:02:59.138332 IP 192.168.1.45.5005 > 192.168.1.74.54910: Flags [.], ack 167973, win 3410, options [nop,nop,TS val 2131129802 ecr 735627774], length 0
01:02:59.138347 IP 192.168.1.45.5005 > 192.168.1.74.54910: Flags [.], ack 194037, win 4224, options [nop,nop,TS val 2131129802 ecr 735627774], length 0
01:02:59.138358 IP 192.168.1.45.5005 > 192.168.1.74.54910: Flags [.], ack 209965, win 4722, options [nop,nop,TS val 2131129802 ecr 735627774], length 0
01:02:59.138425 IP 192.168.1.74.54910 > 192.168.1.45.5005: Flags [P.], seq 209965:214309, ack 3, win 1004, options [nop,nop,TS val 735627774 ecr 2131129801], length 4344
01:02:59.138467 IP 192.168.1.45.5005 > 192.168.1.74.54910: Flags [.], ack 214309, win 4858, options [nop,nop,TS val 2131129802 ecr 735627774], length 0
01:02:59.138795 IP 192.168.1.74.54910 > 192.168.1.45.5005: Flags [.], seq 214309:224445, ack 3, win 1004, options [nop,nop,TS val 735627775 ecr 2131129802], length 10136
01:02:59.138804 IP 192.168.1.45.5005 > 192.168.1.74.54910: Flags [.], ack 224445, win 5175, options [nop,nop,TS val 2131129802 ecr 735627775], length 0
01:02:59.138917 IP 192.168.1.74.54910 > 192.168.1.45.5005: Flags [P.], seq 224445:237477, ack 3, win 1004, options [nop,nop,TS val 735627775 ecr 2131129802], length 13032
01:02:59.138924 IP 192.168.1.45.5005 > 192.168.1.74.54910: Flags [.], ack 237477, win 5582, options [nop,nop,TS val 2131129802 ecr 735627775], length 0
01:02:59.138975 IP 192.168.1.74.54910 > 192.168.1.45.5005: Flags [.], seq 237477:250509, ack 3, win 1004, options [nop,nop,TS val 735627775 ecr 2131129802], length 13032
01:02:59.138981 IP 192.168.1.45.5005 > 192.168.1.74.54910: Flags [.], ack 250509, win 5989, options [nop,nop,TS val 2131129802 ecr 735627775], length 0
01:02:59.139085 IP 192.168.1.74.54910 > 192.168.1.45.5005: Flags [P.], seq 250509:260645, ack 3, win 1004, options [nop,nop,TS val 735627775 ecr 2131129802], length 10136
01:02:59.139085 IP 192.168.1.74.54910 > 192.168.1.45.5005: Flags [P.], seq 260645:269333, ack 3, win 1004, options [nop,nop,TS val 735627775 ecr 2131129802], length 8688
01:02:59.139093 IP 192.168.1.45.5005 > 192.168.1.74.54910: Flags [.], ack 260645, win 6306, options [nop,nop,TS val 2131129803 ecr 735627775], length 0
01:02:59.139112 IP 192.168.1.45.5005 > 192.168.1.74.54910: Flags [.], ack 269333, win 6577, options [nop,nop,TS val 2131129803 ecr 735627775], length 0
01:02:59.139165 IP 192.168.1.74.54910 > 192.168.1.45.5005: Flags [.], seq 269333:278021, ack 3, win 1004, options [nop,nop,TS val 735627775 ecr 2131129802], length 8688
01:02:59.139170 IP 192.168.1.45.5005 > 192.168.1.74.54910: Flags [.], ack 278021, win 6849, options [nop,nop,TS val 2131129803 ecr 735627775], length 0
01:02:59.139293 IP 192.168.1.74.54910 > 192.168.1.45.5005: Flags [P.], seq 278021:301189, ack 3, win 1004, options [nop,nop,TS val 735627775 ecr 2131129802], length 23168
01:02:59.139304 IP 192.168.1.45.5005 > 192.168.1.74.54910: Flags [.], ack 301189, win 7573, options [nop,nop,TS val 2131129803 ecr 735627775], length 0
01:02:59.139355 IP 192.168.1.74.54910 > 192.168.1.45.5005: Flags [.], seq 301189:309877, ack 3, win 1004, options [nop,nop,TS val 735627775 ecr 2131129802], length 8688
01:02:59.139362 IP 192.168.1.45.5005 > 192.168.1.74.54910: Flags [.], ack 309877, win 7844, options [nop,nop,TS val 2131129803 ecr 735627775], length 0
01:02:59.139451 IP 192.168.1.74.54910 > 192.168.1.45.5005: Flags [P.], seq 309877:312773, ack 3, win 1004, options [nop,nop,TS val 735627775 ecr 2131129802], length 2896
01:02:59.139451 IP 192.168.1.74.54910 > 192.168.1.45.5005: Flags [.], seq 312773:325805, ack 3, win 1004, options [nop,nop,TS val 735627775 ecr 2131129802], length 13032
01:02:59.139460 IP 192.168.1.45.5005 > 192.168.1.74.54910: Flags [.], ack 312773, win 7935, options [nop,nop,TS val 2131129803 ecr 735627775], length 0
01:02:59.139476 IP 192.168.1.45.5005 > 192.168.1.74.54910: Flags [.], ack 325805, win 8342, options [nop,nop,TS val 2131129803 ecr 735627775], length 0
01:02:59.139586 IP 192.168.1.74.54910 > 192.168.1.45.5005: Flags [P.], seq 325805:333045, ack 3, win 1004, options [nop,nop,TS val 735627775 ecr 2131129802], length 7240
01:02:59.139586 IP 192.168.1.74.54910 > 192.168.1.45.5005: Flags [.], seq 333045:341733, ack 3, win 1004, options [nop,nop,TS val 735627775 ecr 2131129802], length 8688
01:02:59.139594 IP 192.168.1.45.5005 > 192.168.1.74.54910: Flags [.], ack 333045, win 8568, options [nop,nop,TS val 2131129803 ecr 735627775], length 0
01:02:59.139608 IP 192.168.1.45.5005 > 192.168.1.74.54910: Flags [.], ack 341733, win 8840, options [nop,nop,TS val 2131129803 ecr 735627775], length 0
01:02:59.139710 IP 192.168.1.74.54910 > 192.168.1.45.5005: Flags [P.], seq 341733:344629, ack 3, win 1004, options [nop,nop,TS val 735627775 ecr 2131129802], length 2896
01:02:59.139711 IP 192.168.1.74.54910 > 192.168.1.45.5005: Flags [P.], seq 344629:353317, ack 3, win 1004, options [nop,nop,TS val 735627775 ecr 2131129802], length 8688
01:02:59.139726 IP 192.168.1.45.5005 > 192.168.1.74.54910: Flags [.], ack 344629, win 8930, options [nop,nop,TS val 2131129803 ecr 735627775], length 0
01:02:59.139739 IP 192.168.1.45.5005 > 192.168.1.74.54910: Flags [.], ack 353317, win 9202, options [nop,nop,TS val 2131129803 ecr 735627775], length 0
01:02:59.139757 IP 192.168.1.74.54910 > 192.168.1.45.5005: Flags [P.], seq 353317:364901, ack 3, win 1004, options [nop,nop,TS val 735627775 ecr 2131129802], length 11584
01:02:59.139763 IP 192.168.1.45.5005 > 192.168.1.74.54910: Flags [.], ack 364901, win 9564, options [nop,nop,TS val 2131129803 ecr 735627775], length 0
01:02:59.139810 IP 192.168.1.74.54910 > 192.168.1.45.5005: Flags [P.], seq 364901:373589, ack 3, win 1004, options [nop,nop,TS val 735627775 ecr 2131129802], length 8688
01:02:59.139816 IP 192.168.1.45.5005 > 192.168.1.74.54910: Flags [.], ack 373589, win 9835, options [nop,nop,TS val 2131129803 ecr 735627775], length 0
01:02:59.139910 IP 192.168.1.74.54910 > 192.168.1.45.5005: Flags [.], seq 373589:389517, ack 3, win 1004, options [nop,nop,TS val 735627775 ecr 2131129802], length 15928
01:02:59.139917 IP 192.168.1.45.5005 > 192.168.1.74.54910: Flags [.], ack 389517, win 10333, options [nop,nop,TS val 2131129803 ecr 735627775], length 0
01:02:59.140021 IP 192.168.1.74.54910 > 192.168.1.45.5005: Flags [P.], seq 389517:396757, ack 3, win 1004, options [nop,nop,TS val 735627775 ecr 2131129802], length 7240
01:02:59.140021 IP 192.168.1.74.54910 > 192.168.1.45.5005: Flags [P.], seq 396757:399653, ack 3, win 1004, options [nop,nop,TS val 735627775 ecr 2131129802], length 2896
01:02:59.140022 IP 192.168.1.74.54910 > 192.168.1.45.5005: Flags [.], seq 399653:406893, ack 3, win 1004, options [nop,nop,TS val 735627775 ecr 2131129802], length 7240
01:02:59.140030 IP 192.168.1.45.5005 > 192.168.1.74.54910: Flags [.], ack 396757, win 10559, options [nop,nop,TS val 2131129803 ecr 735627775], length 0
01:02:59.140048 IP 192.168.1.45.5005 > 192.168.1.74.54910: Flags [.], ack 399653, win 10650, options [nop,nop,TS val 2131129803 ecr 735627775], length 0
01:02:59.140069 IP 192.168.1.45.5005 > 192.168.1.74.54910: Flags [.], ack 406893, win 10876, options [nop,nop,TS val 2131129804 ecr 735627775], length 0
01:02:59.140199 IP 192.168.1.74.54910 > 192.168.1.45.5005: Flags [P.], seq 406893:425717, ack 3, win 1004, options [nop,nop,TS val 735627775 ecr 2131129802], length 18824
01:02:59.140209 IP 192.168.1.45.5005 > 192.168.1.74.54910: Flags [.], ack 425717, win 11464, options [nop,nop,TS val 2131129804 ecr 735627775], length 0
01:02:59.140259 IP 192.168.1.74.54910 > 192.168.1.45.5005: Flags [P.], seq 425717:428613, ack 3, win 1004, options [nop,nop,TS val 735627775 ecr 2131129803], length 2896
01:02:59.140260 IP 192.168.1.74.54910 > 192.168.1.45.5005: Flags [.], seq 428613:435853, ack 3, win 1004, options [nop,nop,TS val 735627775 ecr 2131129803], length 7240
01:02:59.140267 IP 192.168.1.45.5005 > 192.168.1.74.54910: Flags [.], ack 428613, win 11555, options [nop,nop,TS val 2131129804 ecr 735627775], length 0
01:02:59.140282 IP 192.168.1.45.5005 > 192.168.1.74.54910: Flags [.], ack 435853, win 11781, options [nop,nop,TS val 2131129804 ecr 735627775], length 0
01:02:59.140392 IP 192.168.1.74.54910 > 192.168.1.45.5005: Flags [.], seq 435853:451781, ack 3, win 1004, options [nop,nop,TS val 735627775 ecr 2131129803], length 15928
01:02:59.140400 IP 192.168.1.45.5005 > 192.168.1.74.54910: Flags [.], ack 451781, win 11832, options [nop,nop,TS val 2131129804 ecr 735627775], length 0
01:02:59.140495 IP 192.168.1.74.54910 > 192.168.1.45.5005: Flags [P.], seq 451781:460469, ack 3, win 1004, options [nop,nop,TS val 735627775 ecr 2131129803], length 8688
01:02:59.140495 IP 192.168.1.74.54910 > 192.168.1.45.5005: Flags [.], seq 460469:466261, ack 3, win 1004, options [nop,nop,TS val 735627776 ecr 2131129803], length 5792
01:02:59.140503 IP 192.168.1.45.5005 > 192.168.1.74.54910: Flags [.], ack 460469, win 11740, options [nop,nop,TS val 2131129804 ecr 735627775], length 0
01:02:59.140517 IP 192.168.1.45.5005 > 192.168.1.74.54910: Flags [.], ack 466261, win 11680, options [nop,nop,TS val 2131129804 ecr 735627776], length 0
01:02:59.140627 IP 192.168.1.74.54910 > 192.168.1.45.5005: Flags [.], seq 466261:485085, ack 3, win 1004, options [nop,nop,TS val 735627776 ecr 2131129803], length 18824
01:02:59.140635 IP 192.168.1.45.5005 > 192.168.1.74.54910: Flags [.], ack 485085, win 11483, options [nop,nop,TS val 2131129804 ecr 735627776], length 0
01:02:59.140735 IP 192.168.1.74.54910 > 192.168.1.45.5005: Flags [P.], seq 485085:492325, ack 3, win 1004, options [nop,nop,TS val 735627776 ecr 2131129803], length 7240
01:02:59.140735 IP 192.168.1.74.54910 > 192.168.1.45.5005: Flags [.], seq 492325:501013, ack 3, win 1004, options [nop,nop,TS val 735627776 ecr 2131129803], length 8688
01:02:59.140744 IP 192.168.1.45.5005 > 192.168.1.74.54910: Flags [.], ack 492325, win 11408, options [nop,nop,TS val 2131129804 ecr 735627776], length 0
01:02:59.140761 IP 192.168.1.45.5005 > 192.168.1.74.54910: Flags [.], ack 501013, win 11316, options [nop,nop,TS val 2131129804 ecr 735627776], length 0
01:02:59.140866 IP 192.168.1.74.54910 > 192.168.1.45.5005: Flags [.], seq 501013:521285, ack 3, win 1004, options [nop,nop,TS val 735627776 ecr 2131129803], length 20272
01:02:59.140875 IP 192.168.1.45.5005 > 192.168.1.74.54910: Flags [.], ack 521285, win 11104, options [nop,nop,TS val 2131129804 ecr 735627776], length 0
01:02:59.140977 IP 192.168.1.74.54910 > 192.168.1.45.5005: Flags [P.], seq 521285:524181, ack 3, win 1004, options [nop,nop,TS val 735627776 ecr 2131129803], length 2896
01:02:59.140977 IP 192.168.1.74.54910 > 192.168.1.45.5005: Flags [.], seq 524181:538661, ack 3, win 1004, options [nop,nop,TS val 735627776 ecr 2131129803], length 14480
01:02:59.140986 IP 192.168.1.45.5005 > 192.168.1.74.54910: Flags [.], ack 524181, win 11074, options [nop,nop,TS val 2131129804 ecr 735627776], length 0
01:02:59.141003 IP 192.168.1.45.5005 > 192.168.1.74.54910: Flags [.], ack 538661, win 10922, options [nop,nop,TS val 2131129804 ecr 735627776], length 0
01:02:59.141101 IP 192.168.1.74.54910 > 192.168.1.45.5005: Flags [P.], seq 538661:556037, ack 3, win 1004, options [nop,nop,TS val 735627776 ecr 2131129803], length 17376
01:02:59.141108 IP 192.168.1.45.5005 > 192.168.1.74.54910: Flags [.], ack 556037, win 10740, options [nop,nop,TS val 2131129805 ecr 735627776], length 0
01:02:59.141155 IP 192.168.1.74.54910 > 192.168.1.45.5005: Flags [.], seq 556037:566173, ack 3, win 1004, options [nop,nop,TS val 735627776 ecr 2131129804], length 10136
01:02:59.141161 IP 192.168.1.45.5005 > 192.168.1.74.54910: Flags [.], ack 566173, win 10633, options [nop,nop,TS val 2131129805 ecr 735627776], length 0
01:02:59.141256 IP 192.168.1.74.54910 > 192.168.1.45.5005: Flags [.], seq 566173:580653, ack 3, win 1004, options [nop,nop,TS val 735627776 ecr 2131129804], length 14480
01:02:59.141263 IP 192.168.1.45.5005 > 192.168.1.74.54910: Flags [.], ack 580653, win 10483, options [nop,nop,TS val 2131129805 ecr 735627776], length 0
01:02:59.141358 IP 192.168.1.74.54910 > 192.168.1.45.5005: Flags [P.], seq 580653:587893, ack 3, win 1004, options [nop,nop,TS val 735627776 ecr 2131129804], length 7240
01:02:59.141358 IP 192.168.1.74.54910 > 192.168.1.45.5005: Flags [.], seq 587893:596581, ack 3, win 1004, options [nop,nop,TS val 735627776 ecr 2131129804], length 8688
01:02:59.141367 IP 192.168.1.45.5005 > 192.168.1.74.54910: Flags [.], ack 587893, win 10406, options [nop,nop,TS val 2131129805 ecr 735627776], length 0
01:02:59.141384 IP 192.168.1.45.5005 > 192.168.1.74.54910: Flags [.], ack 596581, win 10316, options [nop,nop,TS val 2131129805 ecr 735627776], length 0
01:02:59.141699 IP 192.168.1.74.54910 > 192.168.1.45.5005: Flags [P.], seq 596581:619749, ack 3, win 1004, options [nop,nop,TS val 735627776 ecr 2131129804], length 23168
01:02:59.141712 IP 192.168.1.45.5005 > 192.168.1.74.54910: Flags [.], ack 619749, win 10074, options [nop,nop,TS val 2131129805 ecr 735627776], length 0
01:02:59.141863 IP 192.168.1.74.54910 > 192.168.1.45.5005: Flags [P.], seq 619749:684909, ack 3, win 1004, options [nop,nop,TS val 735627777 ecr 2131129804], length 65160
01:02:59.141883 IP 192.168.1.45.5005 > 192.168.1.74.54910: Flags [.], ack 684909, win 9393, options [nop,nop,TS val 2131129805 ecr 735627777], length 0
01:02:59.141914 IP 192.168.1.74.54910 > 192.168.1.45.5005: Flags [.], seq 684909:689253, ack 3, win 1004, options [nop,nop,TS val 735627777 ecr 2131129805], length 4344
01:02:59.141918 IP 192.168.1.45.5005 > 192.168.1.74.54910: Flags [.], ack 689253, win 9346, options [nop,nop,TS val 2131129805 ecr 735627777], length 0
01:02:59.141949 IP 192.168.1.74.54910 > 192.168.1.45.5005: Flags [.], seq 689253:697941, ack 3, win 1004, options [nop,nop,TS val 735627777 ecr 2131129805], length 8688
01:02:59.142048 IP 192.168.1.74.54910 > 192.168.1.45.5005: Flags [.], seq 697941:713869, ack 3, win 1004, options [nop,nop,TS val 735627777 ecr 2131129805], length 15928
01:02:59.142144 IP 192.168.1.74.54910 > 192.168.1.45.5005: Flags [.], seq 713869:728349, ack 3, win 1004, options [nop,nop,TS val 735627777 ecr 2131129805], length 14480
01:02:59.142229 IP 192.168.1.74.54910 > 192.168.1.45.5005: Flags [.], seq 728349:742829, ack 3, win 1004, options [nop,nop,TS val 735627777 ecr 2131129805], length 14480
01:02:59.142317 IP 192.168.1.74.54910 > 192.168.1.45.5005: Flags [P.], seq 742829:750069, ack 3, win 1004, options [nop,nop,TS val 735627777 ecr 2131129805], length 7240
01:02:59.142318 IP 192.168.1.74.54910 > 192.168.1.45.5005: Flags [.], seq 750069:757309, ack 3, win 1004, options [nop,nop,TS val 735627778 ecr 2131129805], length 7240
01:02:59.142402 IP 192.168.1.74.54910 > 192.168.1.45.5005: Flags [.], seq 757309:770341, ack 3, win 1004, options [nop,nop,TS val 735627778 ecr 2131129805], length 13032
01:02:59.142486 IP 192.168.1.74.54910 > 192.168.1.45.5005: Flags [.], seq 770341:783373, ack 3, win 1004, options [nop,nop,TS val 735627778 ecr 2131129805], length 13032
01:02:59.142572 IP 192.168.1.74.54910 > 192.168.1.45.5005: Flags [.], seq 783373:796405, ack 3, win 1004, options [nop,nop,TS val 735627778 ecr 2131129805], length 13032
01:02:59.142661 IP 192.168.1.74.54910 > 192.168.1.45.5005: Flags [.], seq 796405:807989, ack 3, win 1004, options [nop,nop,TS val 735627778 ecr 2131129805], length 11584
01:02:59.142746 IP 192.168.1.74.54910 > 192.168.1.45.5005: Flags [P.], seq 807989:815229, ack 3, win 1004, options [nop,nop,TS val 735627778 ecr 2131129805], length 7240
01:02:59.142746 IP 192.168.1.74.54910 > 192.168.1.45.5005: Flags [.], seq 815229:822469, ack 3, win 1004, options [nop,nop,TS val 735627778 ecr 2131129805], length 7240
01:02:59.142832 IP 192.168.1.74.54910 > 192.168.1.45.5005: Flags [.], seq 822469:836949, ack 3, win 1004, options [nop,nop,TS val 735627778 ecr 2131129805], length 14480
01:02:59.142916 IP 192.168.1.74.54910 > 192.168.1.45.5005: Flags [.], seq 836949:851429, ack 3, win 1004, options [nop,nop,TS val 735627778 ecr 2131129805], length 14480
01:02:59.143005 IP 192.168.1.74.54910 > 192.168.1.45.5005: Flags [.], seq 851429:865909, ack 3, win 1004, options [nop,nop,TS val 735627778 ecr 2131129805], length 14480
01:02:59.143087 IP 192.168.1.74.54910 > 192.168.1.45.5005: Flags [P.], seq 865909:880389, ack 3, win 1004, options [nop,nop,TS val 735627778 ecr 2131129805], length 14480
01:02:59.143293 IP 192.168.1.45.5005 > 192.168.1.74.54910: Flags [.], ack 880389, win 11832, options [nop,nop,TS val 2131129807 ecr 735627777], length 0
01:02:59.143545 IP 192.168.1.74.54910 > 192.168.1.45.5005: Flags [.], seq 880389:887629, ack 3, win 1004, options [nop,nop,TS val 735627779 ecr 2131129807], length 7240
01:02:59.143548 IP 192.168.1.45.5005 > 192.168.1.74.54910: Flags [.], ack 887629, win 12059, options [nop,nop,TS val 2131129807 ecr 735627779], length 0
01:02:59.143581 IP 192.168.1.74.54910 > 192.168.1.45.5005: Flags [.], seq 887629:906453, ack 3, win 1004, options [nop,nop,TS val 735627779 ecr 2131129807], length 18824
01:02:59.143584 IP 192.168.1.45.5005 > 192.168.1.74.54910: Flags [.], ack 906453, win 12647, options [nop,nop,TS val 2131129807 ecr 735627779], length 0
01:02:59.143611 IP 192.168.1.74.54910 > 192.168.1.45.5005: Flags [.], seq 906453:923829, ack 3, win 1004, options [nop,nop,TS val 735627779 ecr 2131129807], length 17376
01:02:59.143613 IP 192.168.1.45.5005 > 192.168.1.74.54910: Flags [.], ack 923829, win 13190, options [nop,nop,TS val 2131129807 ecr 735627779], length 0
01:02:59.143663 IP 192.168.1.74.54910 > 192.168.1.45.5005: Flags [.], seq 923829:939757, ack 3, win 1004, options [nop,nop,TS val 735627779 ecr 2131129807], length 15928
01:02:59.143666 IP 192.168.1.45.5005 > 192.168.1.74.54910: Flags [.], ack 939757, win 13688, options [nop,nop,TS val 2131129807 ecr 735627779], length 0
01:02:59.143694 IP 192.168.1.74.54910 > 192.168.1.45.5005: Flags [P.], seq 939757:945549, ack 3, win 1004, options [nop,nop,TS val 735627779 ecr 2131129807], length 5792
01:02:59.143694 IP 192.168.1.74.54910 > 192.168.1.45.5005: Flags [.], seq 945549:957133, ack 3, win 1004, options [nop,nop,TS val 735627779 ecr 2131129807], length 11584
01:02:59.143735 IP 192.168.1.74.54910 > 192.168.1.45.5005: Flags [.], seq 957133:973061, ack 3, win 1004, options [nop,nop,TS val 735627779 ecr 2131129807], length 15928
01:02:59.143759 IP 192.168.1.74.54910 > 192.168.1.45.5005: Flags [.], seq 973061:987541, ack 3, win 1004, options [nop,nop,TS val 735627779 ecr 2131129807], length 14480
01:02:59.143784 IP 192.168.1.74.54910 > 192.168.1.45.5005: Flags [.], seq 987541:1000573, ack 3, win 1004, options [nop,nop,TS val 735627779 ecr 2131129807], length 13032
01:02:59.143806 IP 192.168.1.74.54910 > 192.168.1.45.5005: Flags [P.], seq 1000573:1010709, ack 3, win 1004, options [nop,nop,TS val 735627779 ecr 2131129807], length 10136
01:02:59.143806 IP 192.168.1.74.54910 > 192.168.1.45.5005: Flags [.], seq 1010709:1012157, ack 3, win 1004, options [nop,nop,TS val 735627779 ecr 2131129807], length 1448
01:02:59.143831 IP 192.168.1.74.54910 > 192.168.1.45.5005: Flags [.], seq 1012157:1022293, ack 3, win 1004, options [nop,nop,TS val 735627779 ecr 2131129807], length 10136
01:02:59.143897 IP 192.168.1.45.5005 > 192.168.1.74.54910: Flags [.], ack 1022293, win 13688, options [nop,nop,TS val 2131129807 ecr 735627779], length 0
01:02:59.143947 IP 192.168.1.74.54910 > 192.168.1.45.5005: Flags [P.], seq 1022293:1075869, ack 3, win 1004, options [nop,nop,TS val 735627779 ecr 2131129807], length 53576
01:02:59.143953 IP 192.168.1.45.5005 > 192.168.1.74.54910: Flags [.], ack 1075869, win 13753, options [nop,nop,TS val 2131129807 ecr 735627779], length 0
01:02:59.143966 IP 192.168.1.74.54910 > 192.168.1.45.5005: Flags [P.], seq 1075869:1086005, ack 3, win 1004, options [nop,nop,TS val 735627780 ecr 2131129807], length 10136
01:02:59.143966 IP 192.168.1.74.54910 > 192.168.1.45.5005: Flags [P.], seq 1086005:1094693, ack 3, win 1004, options [nop,nop,TS val 735627780 ecr 2131129807], length 8688
01:02:59.143975 IP 192.168.1.74.54910 > 192.168.1.45.5005: Flags [.], seq 1094693:1104829, ack 3, win 1004, options [nop,nop,TS val 735627780 ecr 2131129807], length 10136
01:02:59.144021 IP 192.168.1.74.54910 > 192.168.1.45.5005: Flags [P.], seq 1104829:1113517, ack 3, win 1004, options [nop,nop,TS val 735627780 ecr 2131129807], length 8688
01:02:59.144021 IP 192.168.1.74.54910 > 192.168.1.45.5005: Flags [.], seq 1113517:1122205, ack 3, win 1004, options [nop,nop,TS val 735627780 ecr 2131129807], length 8688
01:02:59.144050 IP 192.168.1.74.54910 > 192.168.1.45.5005: Flags [P.], seq 1122205:1132341, ack 3, win 1004, options [nop,nop,TS val 735627780 ecr 2131129807], length 10136
01:02:59.144050 IP 192.168.1.74.54910 > 192.168.1.45.5005: Flags [P.], seq 1132341:1141029, ack 3, win 1004, options [nop,nop,TS val 735627780 ecr 2131129807], length 8688
01:02:59.144057 IP 192.168.1.74.54910 > 192.168.1.45.5005: Flags [.], seq 1141029:1142477, ack 3, win 1004, options [nop,nop,TS val 735627780 ecr 2131129807], length 1448
01:02:59.144129 IP 192.168.1.74.54910 > 192.168.1.45.5005: Flags [P.], seq 1142477:1148269, ack 3, win 1004, options [nop,nop,TS val 735627780 ecr 2131129807], length 5792
01:02:59.144129 IP 192.168.1.74.54910 > 192.168.1.45.5005: Flags [.], seq 1148269:1184469, ack 3, win 1004, options [nop,nop,TS val 735627780 ecr 2131129807], length 36200
01:02:59.144162 IP 192.168.1.74.54910 > 192.168.1.45.5005: Flags [.], seq 1184469:1201845, ack 3, win 1004, options [nop,nop,TS val 735627780 ecr 2131129807], length 17376
01:02:59.144186 IP 192.168.1.74.54910 > 192.168.1.45.5005: Flags [P.], seq 1201845:1206189, ack 3, win 1004, options [nop,nop,TS val 735627780 ecr 2131129807], length 4344
01:02:59.144186 IP 192.168.1.74.54910 > 192.168.1.45.5005: Flags [.], seq 1206189:1216325, ack 3, win 1004, options [nop,nop,TS val 735627780 ecr 2131129807], length 10136
01:02:59.144213 IP 192.168.1.74.54910 > 192.168.1.45.5005: Flags [.], seq 1216325:1232253, ack 3, win 1004, options [nop,nop,TS val 735627780 ecr 2131129807], length 15928
01:02:59.144237 IP 192.168.1.74.54910 > 192.168.1.45.5005: Flags [.], seq 1232253:1245285, ack 3, win 1004, options [nop,nop,TS val 735627780 ecr 2131129807], length 13032
01:02:59.144263 IP 192.168.1.74.54910 > 192.168.1.45.5005: Flags [.], seq 1245285:1259765, ack 3, win 1004, options [nop,nop,TS val 735627780 ecr 2131129807], length 14480
01:02:59.144283 IP 192.168.1.74.54910 > 192.168.1.45.5005: Flags [P.], seq 1259765:1271349, ack 3, win 1004, options [nop,nop,TS val 735627780 ecr 2131129807], length 11584
01:02:59.144430 IP 192.168.1.45.5005 > 192.168.1.74.54910: Flags [.], ack 1271349, win 13753, options [nop,nop,TS val 2131129808 ecr 735627780], length 0
01:02:59.144557 IP 192.168.1.74.54910 > 192.168.1.45.5005: Flags [.], seq 1271349:1278589, ack 3, win 1004, options [nop,nop,TS val 735627781 ecr 2131129808], length 7240
01:02:59.144560 IP 192.168.1.45.5005 > 192.168.1.74.54910: Flags [.], ack 1278589, win 13980, options [nop,nop,TS val 2131129808 ecr 735627781], length 0
01:02:59.144599 IP 192.168.1.74.54910 > 192.168.1.45.5005: Flags [.], seq 1278589:1304653, ack 3, win 1004, options [nop,nop,TS val 735627781 ecr 2131129808], length 26064
01:02:59.144603 IP 192.168.1.45.5005 > 192.168.1.74.54910: Flags [.], ack 1304653, win 14794, options [nop,nop,TS val 2131129808 ecr 735627781], length 0
01:02:59.144641 IP 192.168.1.74.54910 > 192.168.1.45.5005: Flags [.], seq 1304653:1326373, ack 3, win 1004, options [nop,nop,TS val 735627781 ecr 2131129808], length 21720
01:02:59.144645 IP 192.168.1.45.5005 > 192.168.1.74.54910: Flags [.], ack 1326373, win 15473, options [nop,nop,TS val 2131129808 ecr 735627781], length 0
01:02:59.144688 IP 192.168.1.74.54910 > 192.168.1.45.5005: Flags [P.], seq 1326373:1336509, ack 3, win 1004, options [nop,nop,TS val 735627781 ecr 2131129808], length 10136
01:02:59.144688 IP 192.168.1.74.54910 > 192.168.1.45.5005: Flags [.], seq 1336509:1342301, ack 3, win 1004, options [nop,nop,TS val 735627781 ecr 2131129808], length 5792
01:02:59.144691 IP 192.168.1.45.5005 > 192.168.1.74.54910: Flags [.], ack 1336509, win 15790, options [nop,nop,TS val 2131129808 ecr 735627781], length 0
01:02:59.144695 IP 192.168.1.45.5005 > 192.168.1.74.54910: Flags [.], ack 1342301, win 15971, options [nop,nop,TS val 2131129808 ecr 735627781], length 0
01:02:59.144738 IP 192.168.1.74.54910 > 192.168.1.45.5005: Flags [.], seq 1342301:1371261, ack 3, win 1004, options [nop,nop,TS val 735627781 ecr 2131129808], length 28960
01:02:59.144742 IP 192.168.1.45.5005 > 192.168.1.74.54910: Flags [.], ack 1371261, win 16876, options [nop,nop,TS val 2131129808 ecr 735627781], length 0
01:02:59.144845 IP 192.168.1.74.54910 > 192.168.1.45.5005: Flags [.], seq 1371261:1397325, ack 3, win 1004, options [nop,nop,TS val 735627781 ecr 2131129808], length 26064
01:02:59.144855 IP 192.168.1.45.5005 > 192.168.1.74.54910: Flags [.], ack 1397325, win 17690, options [nop,nop,TS val 2131129808 ecr 735627781], length 0
01:02:59.144969 IP 192.168.1.74.54910 > 192.168.1.45.5005: Flags [P.], seq 1397325:1401669, ack 3, win 1004, options [nop,nop,TS val 735627781 ecr 2131129808], length 4344
01:02:59.144969 IP 192.168.1.74.54910 > 192.168.1.45.5005: Flags [.], seq 1401669:1417597, ack 3, win 1004, options [nop,nop,TS val 735627781 ecr 2131129808], length 15928
01:02:59.144979 IP 192.168.1.45.5005 > 192.168.1.74.54910: Flags [.], ack 1401669, win 17826, options [nop,nop,TS val 2131129808 ecr 735627781], length 0
01:02:59.144995 IP 192.168.1.45.5005 > 192.168.1.74.54910: Flags [.], ack 1417597, win 18324, options [nop,nop,TS val 2131129808 ecr 735627781], length 0
01:02:59.145145 IP 192.168.1.74.54910 > 192.168.1.45.5005: Flags [.], seq 1417597:1445109, ack 3, win 1004, options [nop,nop,TS val 735627781 ecr 2131129808], length 27512
01:02:59.145155 IP 192.168.1.45.5005 > 192.168.1.74.54910: Flags [.], ack 1445109, win 19183, options [nop,nop,TS val 2131129809 ecr 735627781], length 0
01:02:59.145264 IP 192.168.1.74.54910 > 192.168.1.45.5005: Flags [.], seq 1445109:1465381, ack 3, win 1004, options [nop,nop,TS val 735627781 ecr 2131129808], length 20272
01:02:59.145272 IP 192.168.1.45.5005 > 192.168.1.74.54910: Flags [.], ack 1465381, win 19817, options [nop,nop,TS val 2131129809 ecr 735627781], length 0
01:02:59.145379 IP 192.168.1.74.54910 > 192.168.1.45.5005: Flags [P.], seq 1465381:1466829, ack 3, win 1004, options [nop,nop,TS val 735627781 ecr 2131129808], length 1448
01:02:59.145379 IP 192.168.1.74.54910 > 192.168.1.45.5005: Flags [.], seq 1466829:1485653, ack 3, win 1004, options [nop,nop,TS val 735627781 ecr 2131129808], length 18824
01:02:59.145389 IP 192.168.1.45.5005 > 192.168.1.74.54910: Flags [.], ack 1466829, win 19862, options [nop,nop,TS val 2131129809 ecr 735627781], length 0
01:02:59.145405 IP 192.168.1.45.5005 > 192.168.1.74.54910: Flags [.], ack 1485653, win 20450, options [nop,nop,TS val 2131129809 ecr 735627781], length 0
01:02:59.145504 IP 192.168.1.74.54910 > 192.168.1.45.5005: Flags [P.], seq 1485653:1497237, ack 3, win 1004, options [nop,nop,TS val 735627781 ecr 2131129808], length 11584
01:02:59.145511 IP 192.168.1.45.5005 > 192.168.1.74.54910: Flags [.], ack 1497237, win 20812, options [nop,nop,TS val 2131129809 ecr 735627781], length 0
01:02:59.145570 IP 192.168.1.74.54910 > 192.168.1.45.5005: Flags [.], seq 1497237:1517509, ack 3, win 1004, options [nop,nop,TS val 735627781 ecr 2131129808], length 20272
01:02:59.145578 IP 192.168.1.45.5005 > 192.168.1.74.54910: Flags [.], ack 1517509, win 21446, options [nop,nop,TS val 2131129809 ecr 735627781], length 0
01:02:59.145680 IP 192.168.1.74.54910 > 192.168.1.45.5005: Flags [P.], seq 1517509:1531989, ack 3, win 1004, options [nop,nop,TS val 735627781 ecr 2131129808], length 14480
01:02:59.145688 IP 192.168.1.45.5005 > 192.168.1.74.54910: Flags [.], ack 1531989, win 21898, options [nop,nop,TS val 2131129809 ecr 735627781], length 0
01:02:59.145746 IP 192.168.1.74.54910 > 192.168.1.45.5005: Flags [.], seq 1531989:1546469, ack 3, win 1004, options [nop,nop,TS val 735627781 ecr 2131129808], length 14480
01:02:59.145753 IP 192.168.1.45.5005 > 192.168.1.74.54910: Flags [.], ack 1546469, win 22351, options [nop,nop,TS val 2131129809 ecr 735627781], length 0
01:02:59.145868 IP 192.168.1.74.54910 > 192.168.1.45.5005: Flags [P.], seq 1546469:1555157, ack 3, win 1004, options [nop,nop,TS val 735627781 ecr 2131129808], length 8688
01:02:59.145868 IP 192.168.1.74.54910 > 192.168.1.45.5005: Flags [.], seq 1555157:1566741, ack 3, win 1004, options [nop,nop,TS val 735627781 ecr 2131129808], length 11584
01:02:59.145877 IP 192.168.1.45.5005 > 192.168.1.74.54910: Flags [.], ack 1555157, win 22622, options [nop,nop,TS val 2131129809 ecr 735627781], length 0
01:02:59.145895 IP 192.168.1.45.5005 > 192.168.1.74.54910: Flags [.], ack 1566741, win 22984, options [nop,nop,TS val 2131129809 ecr 735627781], length 0
01:02:59.146050 IP 192.168.1.74.54910 > 192.168.1.45.5005: Flags [P.], seq 1566741:1571085, ack 3, win 1004, options [nop,nop,TS val 735627781 ecr 2131129808], length 4344
01:02:59.146050 IP 192.168.1.74.54910 > 192.168.1.45.5005: Flags [.], seq 1571085:1592805, ack 3, win 1004, options [nop,nop,TS val 735627781 ecr 2131129808], length 21720
01:02:59.146060 IP 192.168.1.45.5005 > 192.168.1.74.54910: Flags [.], ack 1571085, win 23120, options [nop,nop,TS val 2131129809 ecr 735627781], length 0
01:02:59.146179 IP 192.168.1.74.54910 > 192.168.1.45.5005: Flags [P.], seq 1592805:1597149, ack 3, win 1004, options [nop,nop,TS val 735627781 ecr 2131129808], length 4344
01:02:59.146179 IP 192.168.1.74.54910 > 192.168.1.45.5005: Flags [.], seq 1597149:1614525, ack 3, win 1004, options [nop,nop,TS val 735627781 ecr 2131129809], length 17376
01:02:59.146278 IP 192.168.1.74.54910 > 192.168.1.45.5005: Flags [.], seq 1614525:1630453, ack 3, win 1004, options [nop,nop,TS val 735627781 ecr 2131129809], length 15928
01:02:59.146364 IP 192.168.1.74.54910 > 192.168.1.45.5005: Flags [.], seq 1630453:1644933, ack 3, win 1004, options [nop,nop,TS val 735627781 ecr 2131129809], length 14480
01:02:59.146440 IP 192.168.1.74.54910 > 192.168.1.45.5005: Flags [.], seq 1644933:1657965, ack 3, win 1004, options [nop,nop,TS val 735627781 ecr 2131129809], length 13032
01:02:59.146506 IP 192.168.1.74.54910 > 192.168.1.45.5005: Flags [P.], seq 1657965:1662309, ack 3, win 1004, options [nop,nop,TS val 735627781 ecr 2131129809], length 4344
01:02:59.146507 IP 192.168.1.74.54910 > 192.168.1.45.5005: Flags [.], seq 1662309:1672445, ack 3, win 1004, options [nop,nop,TS val 735627782 ecr 2131129809], length 10136
01:02:59.146580 IP 192.168.1.74.54910 > 192.168.1.45.5005: Flags [.], seq 1672445:1685477, ack 3, win 1004, options [nop,nop,TS val 735627782 ecr 2131129809], length 13032
01:02:59.146658 IP 192.168.1.74.54910 > 192.168.1.45.5005: Flags [.], seq 1685477:1701405, ack 3, win 1004, options [nop,nop,TS val 735627782 ecr 2131129809], length 15928
01:02:59.146731 IP 192.168.1.74.54910 > 192.168.1.45.5005: Flags [.], seq 1701405:1714437, ack 3, win 1004, options [nop,nop,TS val 735627782 ecr 2131129809], length 13032
01:02:59.146792 IP 192.168.1.74.54910 > 192.168.1.45.5005: Flags [P.], seq 1714437:1727469, ack 3, win 1004, options [nop,nop,TS val 735627782 ecr 2131129809], length 13032
01:02:59.146812 IP 192.168.1.74.54910 > 192.168.1.45.5005: Flags [.], seq 1727469:1730365, ack 3, win 1004, options [nop,nop,TS val 735627782 ecr 2131129809], length 2896
01:02:59.146896 IP 192.168.1.74.54910 > 192.168.1.45.5005: Flags [.], seq 1730365:1746293, ack 3, win 1004, options [nop,nop,TS val 735627782 ecr 2131129809], length 15928
01:02:59.146966 IP 192.168.1.74.54910 > 192.168.1.45.5005: Flags [.], seq 1746293:1759325, ack 3, win 1004, options [nop,nop,TS val 735627782 ecr 2131129809], length 13032
01:02:59.147049 IP 192.168.1.74.54910 > 192.168.1.45.5005: Flags [.], seq 1759325:1776701, ack 3, win 1004, options [nop,nop,TS val 735627782 ecr 2131129809], length 17376
01:02:59.147580 IP 192.168.1.45.5005 > 192.168.1.74.54910: Flags [.], ack 1776701, win 23120, options [nop,nop,TS val 2131129811 ecr 735627781], length 0
01:02:59.147698 IP 192.168.1.74.54910 > 192.168.1.45.5005: Flags [P.], seq 1776701:1792629, ack 3, win 1004, options [nop,nop,TS val 735627782 ecr 2131129809], length 15928
01:02:59.147709 IP 192.168.1.45.5005 > 192.168.1.74.54910: Flags [.], ack 1792629, win 23618, options [nop,nop,TS val 2131129811 ecr 735627782], length 0
01:02:59.148024 IP 192.168.1.74.54910 > 192.168.1.45.5005: Flags [.], seq 1792629:1802765, ack 3, win 1004, options [nop,nop,TS val 735627784 ecr 2131129811], length 10136
01:02:59.148034 IP 192.168.1.45.5005 > 192.168.1.74.54910: Flags [.], ack 1802765, win 23935, options [nop,nop,TS val 2131129811 ecr 735627784], length 0
01:02:59.148122 IP 192.168.1.74.54910 > 192.168.1.45.5005: Flags [.], seq 1802765:1820141, ack 3, win 1004, options [nop,nop,TS val 735627784 ecr 2131129811], length 17376
01:02:59.148131 IP 192.168.1.45.5005 > 192.168.1.74.54910: Flags [.], ack 1820141, win 24478, options [nop,nop,TS val 2131129812 ecr 735627784], length 0
01:02:59.148250 IP 192.168.1.74.54910 > 192.168.1.45.5005: Flags [.], seq 1820141:1846205, ack 3, win 1004, options [nop,nop,TS val 735627784 ecr 2131129811], length 26064
01:02:59.148260 IP 192.168.1.45.5005 > 192.168.1.74.54910: Flags [.], ack 1846205, win 25292, options [nop,nop,TS val 2131129812 ecr 735627784], length 0
01:02:59.148329 IP 192.168.1.74.54910 > 192.168.1.45.5005: Flags [P.], seq 1846205:1857789, ack 3, win 1004, options [nop,nop,TS val 735627784 ecr 2131129811], length 11584
01:02:59.148335 IP 192.168.1.45.5005 > 192.168.1.74.54910: Flags [.], ack 1857789, win 25654, options [nop,nop,TS val 2131129812 ecr 735627784], length 0
01:02:59.148373 IP 192.168.1.74.54910 > 192.168.1.45.5005: Flags [.], seq 1857789:1867925, ack 3, win 1004, options [nop,nop,TS val 735627784 ecr 2131129811], length 10136
01:02:59.148467 IP 192.168.1.74.54910 > 192.168.1.45.5005: Flags [.], seq 1867925:1886749, ack 3, win 1004, options [nop,nop,TS val 735627784 ecr 2131129811], length 18824
01:02:59.148539 IP 192.168.1.74.54910 > 192.168.1.45.5005: Flags [.], seq 1886749:1901229, ack 3, win 1004, options [nop,nop,TS val 735627784 ecr 2131129811], length 14480
01:02:59.148625 IP 192.168.1.74.54910 > 192.168.1.45.5005: Flags [.], seq 1901229:1914261, ack 3, win 1004, options [nop,nop,TS val 735627784 ecr 2131129811], length 13032
01:02:59.148704 IP 192.168.1.74.54910 > 192.168.1.45.5005: Flags [P.], seq 1914261:1922949, ack 3, win 1004, options [nop,nop,TS val 735627784 ecr 2131129811], length 8688
01:02:59.148704 IP 192.168.1.74.54910 > 192.168.1.45.5005: Flags [.], seq 1922949:1928741, ack 3, win 1004, options [nop,nop,TS val 735627784 ecr 2131129811], length 5792
01:02:59.148793 IP 192.168.1.74.54910 > 192.168.1.45.5005: Flags [.], seq 1928741:1944669, ack 3, win 1004, options [nop,nop,TS val 735627784 ecr 2131129811], length 15928
01:02:59.148867 IP 192.168.1.74.54910 > 192.168.1.45.5005: Flags [.], seq 1944669:1959149, ack 3, win 1004, options [nop,nop,TS val 735627784 ecr 2131129811], length 14480
01:02:59.148935 IP 192.168.1.74.54910 > 192.168.1.45.5005: Flags [.], seq 1959149:1970733, ack 3, win 1004, options [nop,nop,TS val 735627784 ecr 2131129811], length 11584
01:02:59.149005 IP 192.168.1.74.54910 > 192.168.1.45.5005: Flags [.], seq 1970733:1980869, ack 3, win 1004, options [nop,nop,TS val 735627784 ecr 2131129811], length 10136
01:02:59.149073 IP 192.168.1.74.54910 > 192.168.1.45.5005: Flags [P.], seq 1980869:1988109, ack 3, win 1004, options [nop,nop,TS val 735627784 ecr 2131129811], length 7240
01:02:59.149073 IP 192.168.1.74.54910 > 192.168.1.45.5005: Flags [.], seq 1988109:1995349, ack 3, win 1004, options [nop,nop,TS val 735627784 ecr 2131129811], length 7240
01:02:59.149143 IP 192.168.1.74.54910 > 192.168.1.45.5005: Flags [.], seq 1995349:2006933, ack 3, win 1004, options [nop,nop,TS val 735627784 ecr 2131129811], length 11584
01:02:59.149212 IP 192.168.1.74.54910 > 192.168.1.45.5005: Flags [.], seq 2006933:2019965, ack 3, win 1004, options [nop,nop,TS val 735627784 ecr 2131129811], length 13032
01:02:59.149287 IP 192.168.1.74.54910 > 192.168.1.45.5005: Flags [.], seq 2019965:2034445, ack 3, win 1004, options [nop,nop,TS val 735627784 ecr 2131129811], length 14480
01:02:59.149364 IP 192.168.1.74.54910 > 192.168.1.45.5005: Flags [P.], seq 2034445:2044581, ack 3, win 1004, options [nop,nop,TS val 735627784 ecr 2131129811], length 10136
01:02:59.149365 IP 192.168.1.74.54910 > 192.168.1.45.5005: Flags [.], seq 2044581:2048925, ack 3, win 1004, options [nop,nop,TS val 735627784 ecr 2131129811], length 4344
01:02:59.149435 IP 192.168.1.74.54910 > 192.168.1.45.5005: Flags [P.], seq 2048925:2053269, ack 3, win 1004, options [nop,nop,TS val 735627784 ecr 2131129811], length 4344
01:02:59.149435 IP 192.168.1.74.54910 > 192.168.1.45.5005: Flags [.], seq 2053269:2054717, ack 3, win 1004, options [nop,nop,TS val 735627784 ecr 2131129811], length 1448
01:02:59.149435 IP 192.168.1.74.54910 > 192.168.1.45.5005: Flags [.], seq 2054717:2063405, ack 3, win 1004, options [nop,nop,TS val 735627784 ecr 2131129812], length 8688
01:02:59.149772 IP 192.168.1.45.5005 > 192.168.1.74.54910: Flags [.], ack 2063405, win 25654, options [nop,nop,TS val 2131129813 ecr 735627784], length 0
01:02:59.149833 IP 192.168.1.74.54910 > 192.168.1.45.5005: Flags [P.], seq 2063405:2073541, ack 3, win 1004, options [nop,nop,TS val 735627784 ecr 2131129812], length 10136
01:02:59.149833 IP 192.168.1.74.54910 > 192.168.1.45.5005: Flags [R.], seq 2073541, ack 3, win 1004, options [nop,nop,TS val 735627785 ecr 2131129812], length 0
01:02:59.149843 IP 192.168.1.45.5005 > 192.168.1.74.54910: Flags [.], ack 2073541, win 25971, options [nop,nop,TS val 2131129813 ecr 735627784], length 0
01:02:59.149979 IP 192.168.1.74.54910 > 192.168.1.45.5005: Flags [R], seq 1601102161, win 0, length 0
01:02:59.150732 IP 192.168.1.74.54910 > 192.168.1.45.5005: Flags [R], seq 1601112297, win 0, length 0

315 packets captured
315 packets received by filter
0 packets dropped by kernel
