tcpdump: verbose output suppressed, use -v[v]... for full protocol decode
listening on enp0s8, link-type EN10MB (Ethernet), snapshot length 262144 bytes
02:12:50.486083 IP 192.168.1.74.40512 > 192.168.1.45.5005: Flags [S], seq 3173425215, win 64240, options [mss 1460,sackOK,TS val 223766500 ecr 0,nop,wscale 6], length 0
02:12:50.486106 IP 192.168.1.45.5005 > 192.168.1.74.40512: Flags [S.], seq 1532344875, ack 3173425216, win 65160, options [mss 1460,sackOK,TS val 1988725823 ecr 223766500,nop,wscale 6], length 0
02:12:50.486196 IP 192.168.1.74.40512 > 192.168.1.45.5005: Flags [.], ack 1, win 1004, options [nop,nop,TS val 223766500 ecr 1988725823], length 0
02:12:50.486242 IP 192.168.1.74.40512 > 192.168.1.45.5005: Flags [P.], seq 1:5, ack 1, win 1004, options [nop,nop,TS val 223766500 ecr 1988725823], length 4
02:12:50.486247 IP 192.168.1.45.5005 > 192.168.1.74.40512: Flags [.], ack 5, win 1019, options [nop,nop,TS val 1988725823 ecr 223766500], length 0
02:12:50.486328 IP 192.168.1.45.5005 > 192.168.1.74.40512: Flags [P.], seq 1:3, ack 5, win 1019, options [nop,nop,TS val 1988725823 ecr 223766500], length 2
02:12:50.486388 IP 192.168.1.74.40512 > 192.168.1.45.5005: Flags [.], ack 3, win 1004, options [nop,nop,TS val 223766501 ecr 1988725823], length 0
02:12:50.486429 IP 192.168.1.74.40512 > 192.168.1.45.5005: Flags [P.], seq 5:7245, ack 3, win 1004, options [nop,nop,TS val 223766501 ecr 1988725823], length 7240
02:12:50.486429 IP 192.168.1.74.40512 > 192.168.1.45.5005: Flags [P.], seq 7245:9227, ack 3, win 1004, options [nop,nop,TS val 223766501 ecr 1988725823], length 1982
02:12:50.486623 IP 192.168.1.74.40512 > 192.168.1.45.5005: Flags [R.], seq 9227, ack 3, win 1004, options [nop,nop,TS val 223766501 ecr 1988725823], length 0
02:12:50.486631 IP 192.168.1.45.5005 > 192.168.1.74.40512: Flags [.], ack 7245, win 906, options [nop,nop,TS val 1988725824 ecr 223766501], length 0
02:12:50.486705 IP 192.168.1.74.40512 > 192.168.1.45.5005: Flags [R], seq 3173432460, win 0, length 0

12 packets captured
12 packets received by filter
0 packets dropped by kernel
