tcpdump: verbose output suppressed, use -v[v]... for full protocol decode
listening on enp0s8, link-type EN10MB (Ethernet), snapshot length 262144 bytes
01:04:33.154530 IP 192.168.1.74.41030 > 192.168.1.45.5005: Flags [S], seq 554183858, win 64240, options [mss 1460,sackOK,TS val 735721798 ecr 0,nop,wscale 6], length 0
01:04:33.154557 IP 192.168.1.45.5005 > 192.168.1.74.41030: Flags [S.], seq 58282922, ack 554183859, win 65160, options [mss 1460,sackOK,TS val 2131223818 ecr 735721798,nop,wscale 6], length 0
01:04:33.154680 IP 192.168.1.74.41030 > 192.168.1.45.5005: Flags [.], ack 1, win 1004, options [nop,nop,TS val 735721798 ecr 2131223818], length 0
01:04:33.154734 IP 192.168.1.74.41030 > 192.168.1.45.5005: Flags [P.], seq 1:5, ack 1, win 1004, options [nop,nop,TS val 735721798 ecr 2131223818], length 4
01:04:33.154742 IP 192.168.1.45.5005 > 192.168.1.74.41030: Flags [.], ack 5, win 1019, options [nop,nop,TS val 2131223818 ecr 735721798], length 0
01:04:33.154831 IP 192.168.1.45.5005 > 192.168.1.74.41030: Flags [P.], seq 1:3, ack 5, win 1019, options [nop,nop,TS val 2131223818 ecr 735721798], length 2
01:04:33.154944 IP 192.168.1.74.41030 > 192.168.1.45.5005: Flags [.], ack 3, win 1004, options [nop,nop,TS val 735721798 ecr 2131223818], length 0
01:04:33.155012 IP 192.168.1.74.41030 > 192.168.1.45.5005: Flags [P.], seq 5:7245, ack 3, win 1004, options [nop,nop,TS val 735721799 ecr 2131223818], length 7240
01:04:33.155012 IP 192.168.1.74.41030 > 192.168.1.45.5005: Flags [P.], seq 7245:9227, ack 3, win 1004, options [nop,nop,TS val 735721799 ecr 2131223818], length 1982
01:04:33.155149 IP 192.168.1.74.41030 > 192.168.1.45.5005: Flags [R.], seq 9227, ack 3, win 1004, options [nop,nop,TS val 735721799 ecr 2131223818], length 0
01:04:33.155154 IP 192.168.1.45.5005 > 192.168.1.74.41030: Flags [.], ack 7245, win 906, options [nop,nop,TS val 2131223819 ecr 735721799], length 0
01:04:33.155266 IP 192.168.1.74.41030 > 192.168.1.45.5005: Flags [R], seq 554191103, win 0, length 0

12 packets captured
12 packets received by filter
0 packets dropped by kernel
