tcpdump: verbose output suppressed, use -v[v]... for full protocol decode
listening on enp0s8, link-type EN10MB (Ethernet), snapshot length 262144 bytes
00:26:24.575518 IP 192.168.1.74.36738 > 192.168.1.45.5005: Flags [S], seq 2304906210, win 64240, options [mss 1460,sackOK,TS val 3248023756 ecr 0,nop,wscale 6], length 0
00:26:24.575542 IP 192.168.1.45.5005 > 192.168.1.74.36738: Flags [S.], seq 211010381, ack 2304906211, win 65160, options [mss 1460,sackOK,TS val 2040716401 ecr 3248023756,nop,wscale 6], length 0
00:26:24.575859 IP 192.168.1.74.36738 > 192.168.1.45.5005: Flags [.], ack 1, win 1004, options [nop,nop,TS val 3248023756 ecr 2040716401], length 0
00:26:24.576280 IP 192.168.1.74.36738 > 192.168.1.45.5005: Flags [P.], seq 1:5, ack 1, win 1004, options [nop,nop,TS val 3248023757 ecr 2040716401], length 4
00:26:24.576294 IP 192.168.1.45.5005 > 192.168.1.74.36738: Flags [.], ack 5, win 1019, options [nop,nop,TS val 2040716401 ecr 3248023757], length 0
00:26:24.576538 IP 192.168.1.45.5005 > 192.168.1.74.36738: Flags [P.], seq 1:3, ack 5, win 1019, options [nop,nop,TS val 2040716402 ecr 3248023757], length 2
00:26:24.576802 IP 192.168.1.74.36738 > 192.168.1.45.5005: Flags [.], ack 3, win 1004, options [nop,nop,TS val 3248023757 ecr 2040716402], length 0
00:26:24.576802 IP 192.168.1.74.36738 > 192.168.1.45.5005: Flags [P.], seq 5:7245, ack 3, win 1004, options [nop,nop,TS val 3248023757 ecr 2040716402], length 7240
00:26:24.576802 IP 192.168.1.74.36738 > 192.168.1.45.5005: Flags [.], seq 7245:10141, ack 3, win 1004, options [nop,nop,TS val 3248023757 ecr 2040716402], length 2896
00:26:24.576842 IP 192.168.1.74.36738 > 192.168.1.45.5005: Flags [P.], seq 10141:14485, ack 3, win 1004, options [nop,nop,TS val 3248023757 ecr 2040716402], length 4344
00:26:24.582361 IP 192.168.1.74.36738 > 192.168.1.45.5005: Flags [.], seq 14485:15933, ack 3, win 1004, options [nop,nop,TS val 3248023763 ecr 2040716402], length 1448
00:26:24.619717 IP 192.168.1.45.5005 > 192.168.1.74.36738: Flags [.], ack 15933, win 857, options [nop,nop,TS val 2040716445 ecr 3248023757], length 0
00:26:24.620635 IP 192.168.1.74.36738 > 192.168.1.45.5005: Flags [P.], seq 15933:26069, ack 3, win 1004, options [nop,nop,TS val 3248023801 ecr 2040716445], length 10136
00:26:24.620635 IP 192.168.1.74.36738 > 192.168.1.45.5005: Flags [P.], seq 26069:36205, ack 3, win 1004, options [nop,nop,TS val 3248023801 ecr 2040716445], length 10136
00:26:24.620669 IP 192.168.1.45.5005 > 192.168.1.74.36738: Flags [.], ack 26069, win 752, options [nop,nop,TS val 2040716446 ecr 3248023801], length 0
00:26:24.620690 IP 192.168.1.45.5005 > 192.168.1.74.36738: Flags [.], ack 36205, win 645, options [nop,nop,TS val 2040716446 ecr 3248023801], length 0
00:26:24.620722 IP 192.168.1.74.36738 > 192.168.1.45.5005: Flags [P.], seq 36205:46341, ack 3, win 1004, options [nop,nop,TS val 3248023801 ecr 2040716445], length 10136
00:26:24.620728 IP 192.168.1.45.5005 > 192.168.1.74.36738: Flags [.], ack 46341, win 540, options [nop,nop,TS val 2040716446 ecr 3248023801], length 0
00:26:24.621217 IP 192.168.1.74.36738 > 192.168.1.45.5005: Flags [.], seq 46341:55029, ack 3, win 1004, options [nop,nop,TS val 3248023802 ecr 2040716446], length 8688
00:26:24.621284 IP 192.168.1.74.36738 > 192.168.1.45.5005: Flags [P.], seq 55029:60821, ack 3, win 1004, options [nop,nop,TS val 3248023802 ecr 2040716446], length 5792
00:26:24.621284 IP 192.168.1.74.36738 > 192.168.1.45.5005: Flags [P.], seq 60821:66613, ack 3, win 1004, options [nop,nop,TS val 3248023802 ecr 2040716446], length 5792
00:26:24.621318 IP 192.168.1.74.36738 > 192.168.1.45.5005: Flags [.], seq 66613:70957, ack 3, win 1004, options [nop,nop,TS val 3248023802 ecr 2040716446], length 4344
00:26:24.621385 IP 192.168.1.74.36738 > 192.168.1.45.5005: Flags [P.], seq 70957:77485, ack 3, win 1004, options [nop,nop,TS val 3248023802 ecr 2040716446], length 6528
00:26:24.621385 IP 192.168.1.74.36738 > 192.168.1.45.5005: Flags [P.], seq 77485:78197, ack 3, win 1004, options [nop,nop,TS val 3248023802 ecr 2040716446], length 712
00:26:24.621385 IP 192.168.1.74.36738 > 192.168.1.45.5005: Flags [.], seq 78197:79645, ack 3, win 1004, options [nop,nop,TS val 3248023802 ecr 2040716446], length 1448
00:26:24.634596 IP 192.168.1.74.36738 > 192.168.1.45.5005: Flags [.], seq 78197:79645, ack 3, win 1004, options [nop,nop,TS val 3248023815 ecr 2040716446], length 1448
00:26:24.663757 IP 192.168.1.45.5005 > 192.168.1.74.36738: Flags [.], ack 79645, win 176, options [nop,nop,TS val 2040716489 ecr 3248023802,nop,nop,sack 1 {78197:79645}], length 0
00:26:24.664726 IP 192.168.1.74.36738 > 192.168.1.45.5005: Flags [P.], seq 79645:90909, ack 3, win 1004, options [nop,nop,TS val 3248023845 ecr 2040716489], length 11264
00:26:24.686589 IP 192.168.1.74.36738 > 192.168.1.45.5005: Flags [.], seq 89781:90909, ack 3, win 1004, options [nop,nop,TS val 3248023867 ecr 2040716489], length 1128
00:26:24.707753 IP 192.168.1.45.5005 > 192.168.1.74.36738: Flags [.], ack 90909, win 0, options [nop,nop,TS val 2040716533 ecr 3248023845,nop,nop,sack 1 {89781:90909}], length 0
00:26:24.926559 IP 192.168.1.74.36738 > 192.168.1.45.5005: Flags [.], ack 3, win 1004, options [nop,nop,TS val 3248024107 ecr 2040716533], length 0
00:26:24.926587 IP 192.168.1.45.5005 > 192.168.1.74.36738: Flags [.], ack 90909, win 0, options [nop,nop,TS val 2040716752 ecr 3248023845], length 0
00:26:25.366497 IP 192.168.1.74.36738 > 192.168.1.45.5005: Flags [.], ack 3, win 1004, options [nop,nop,TS val 3248024547 ecr 2040716752], length 0
00:26:26.262290 IP 192.168.1.74.36738 > 192.168.1.45.5005: Flags [.], ack 3, win 1004, options [nop,nop,TS val 3248025443 ecr 2040716752], length 0
00:26:26.262318 IP 192.168.1.45.5005 > 192.168.1.74.36738: Flags [.], ack 90909, win 0, options [nop,nop,TS val 2040718087 ecr 3248023845], length 0
00:26:28.022526 IP 192.168.1.74.36738 > 192.168.1.45.5005: Flags [.], ack 3, win 1004, options [nop,nop,TS val 3248027203 ecr 2040718087], length 0
00:26:28.022554 IP 192.168.1.45.5005 > 192.168.1.74.36738: Flags [.], ack 90909, win 0, options [nop,nop,TS val 2040719848 ecr 3248023845], length 0
00:26:31.734548 IP 192.168.1.74.36738 > 192.168.1.45.5005: Flags [.], ack 3, win 1004, options [nop,nop,TS val 3248030915 ecr 2040719848], length 0
00:26:31.734576 IP 192.168.1.45.5005 > 192.168.1.74.36738: Flags [.], ack 90909, win 0, options [nop,nop,TS val 2040723560 ecr 3248023845], length 0
00:26:38.902321 IP 192.168.1.74.36738 > 192.168.1.45.5005: Flags [.], ack 3, win 1004, options [nop,nop,TS val 3248038083 ecr 2040723560], length 0
00:26:38.902353 IP 192.168.1.45.5005 > 192.168.1.74.36738: Flags [.], ack 90909, win 0, options [nop,nop,TS val 2040730727 ecr 3248023845], length 0
00:26:39.576861 IP 192.168.1.45.5005 > 192.168.1.74.36738: Flags [.], ack 90909, win 1002, options [nop,nop,TS val 2040731402 ecr 3248023845], length 0
00:26:39.577590 IP 192.168.1.74.36738 > 192.168.1.45.5005: Flags [P.], seq 90909:98149, ack 3, win 1004, options [nop,nop,TS val 3248038758 ecr 2040731402], length 7240
00:26:39.577591 IP 192.168.1.74.36738 > 192.168.1.45.5005: Flags [.], seq 98149:102493, ack 3, win 1004, options [nop,nop,TS val 3248038758 ecr 2040731402], length 4344
00:26:39.577631 IP 192.168.1.45.5005 > 192.168.1.74.36738: Flags [.], ack 98149, win 1228, options [nop,nop,TS val 2040731403 ecr 3248038758], length 0
00:26:39.577652 IP 192.168.1.45.5005 > 192.168.1.74.36738: Flags [.], ack 102493, win 1364, options [nop,nop,TS val 2040731403 ecr 3248038758], length 0
00:26:39.577756 IP 192.168.1.74.36738 > 192.168.1.45.5005: Flags [P.], seq 102493:105389, ack 3, win 1004, options [nop,nop,TS val 3248038758 ecr 2040731402], length 2896
00:26:39.577782 IP 192.168.1.45.5005 > 192.168.1.74.36738: Flags [.], ack 105389, win 1454, options [nop,nop,TS val 2040731403 ecr 3248038758], length 0
00:26:39.578084 IP 192.168.1.74.36738 > 192.168.1.45.5005: Flags [P.], seq 105389:108285, ack 3, win 1004, options [nop,nop,TS val 3248038759 ecr 2040731403], length 2896
00:26:39.578084 IP 192.168.1.74.36738 > 192.168.1.45.5005: Flags [P.], seq 108285:110053, ack 3, win 1004, options [nop,nop,TS val 3248038759 ecr 2040731403], length 1768
00:26:39.578084 IP 192.168.1.74.36738 > 192.168.1.45.5005: Flags [P.], seq 110053:112949, ack 3, win 1004, options [nop,nop,TS val 3248038759 ecr 2040731403], length 2896
00:26:39.578098 IP 192.168.1.45.5005 > 192.168.1.74.36738: Flags [.], ack 108285, win 1545, options [nop,nop,TS val 2040731403 ecr 3248038759], length 0
00:26:39.578121 IP 192.168.1.45.5005 > 192.168.1.74.36738: Flags [.], ack 110053, win 1600, options [nop,nop,TS val 2040731403 ecr 3248038759], length 0
00:26:39.578136 IP 192.168.1.45.5005 > 192.168.1.74.36738: Flags [.], ack 112949, win 1690, options [nop,nop,TS val 2040731403 ecr 3248038759], length 0
00:26:39.578292 IP 192.168.1.74.36738 > 192.168.1.45.5005: Flags [P.], seq 112949:115845, ack 3, win 1004, options [nop,nop,TS val 3248038759 ecr 2040731403], length 2896
00:26:39.578293 IP 192.168.1.74.36738 > 192.168.1.45.5005: Flags [.], seq 115845:120189, ack 3, win 1004, options [nop,nop,TS val 3248038759 ecr 2040731403], length 4344
00:26:39.578305 IP 192.168.1.45.5005 > 192.168.1.74.36738: Flags [.], ack 115845, win 1781, options [nop,nop,TS val 2040731403 ecr 3248038759], length 0
00:26:39.578326 IP 192.168.1.45.5005 > 192.168.1.74.36738: Flags [.], ack 120189, win 1917, options [nop,nop,TS val 2040731403 ecr 3248038759], length 0
00:26:39.578460 IP 192.168.1.74.36738 > 192.168.1.45.5005: Flags [P.], seq 120189:121637, ack 3, win 1004, options [nop,nop,TS val 3248038759 ecr 2040731403], length 1448
00:26:39.578460 IP 192.168.1.74.36738 > 192.168.1.45.5005: Flags [P.], seq 121637:127429, ack 3, win 1004, options [nop,nop,TS val 3248038759 ecr 2040731403], length 5792
00:26:39.578460 IP 192.168.1.74.36738 > 192.168.1.45.5005: Flags [P.], seq 127429:133221, ack 3, win 1004, options [nop,nop,TS val 3248038759 ecr 2040731403], length 5792
00:26:39.578473 IP 192.168.1.45.5005 > 192.168.1.74.36738: Flags [.], ack 121637, win 1962, options [nop,nop,TS val 2040731404 ecr 3248038759], length 0
00:26:39.578513 IP 192.168.1.45.5005 > 192.168.1.74.36738: Flags [.], ack 127429, win 2143, options [nop,nop,TS val 2040731404 ecr 3248038759], length 0
00:26:39.578530 IP 192.168.1.45.5005 > 192.168.1.74.36738: Flags [.], ack 133221, win 2324, options [nop,nop,TS val 2040731404 ecr 3248038759], length 0
00:26:39.578557 IP 192.168.1.74.36738 > 192.168.1.45.5005: Flags [P.], seq 133221:139013, ack 3, win 1004, options [nop,nop,TS val 3248038759 ecr 2040731403], length 5792
00:26:39.578557 IP 192.168.1.74.36738 > 192.168.1.45.5005: Flags [P.], seq 139013:141909, ack 3, win 1004, options [nop,nop,TS val 3248038759 ecr 2040731403], length 2896
00:26:39.578557 IP 192.168.1.74.36738 > 192.168.1.45.5005: Flags [P.], seq 141909:144805, ack 3, win 1004, options [nop,nop,TS val 3248038759 ecr 2040731403], length 2896
00:26:39.578566 IP 192.168.1.45.5005 > 192.168.1.74.36738: Flags [.], ack 139013, win 2505, options [nop,nop,TS val 2040731404 ecr 3248038759], length 0
00:26:39.578583 IP 192.168.1.45.5005 > 192.168.1.74.36738: Flags [.], ack 141909, win 2595, options [nop,nop,TS val 2040731404 ecr 3248038759], length 0
00:26:39.578603 IP 192.168.1.45.5005 > 192.168.1.74.36738: Flags [.], ack 144805, win 2686, options [nop,nop,TS val 2040731404 ecr 3248038759], length 0
00:26:39.578635 IP 192.168.1.74.36738 > 192.168.1.45.5005: Flags [P.], seq 144805:150597, ack 3, win 1004, options [nop,nop,TS val 3248038759 ecr 2040731403], length 5792
00:26:39.578643 IP 192.168.1.45.5005 > 192.168.1.74.36738: Flags [.], ack 150597, win 2867, options [nop,nop,TS val 2040731404 ecr 3248038759], length 0
00:26:39.578784 IP 192.168.1.74.36738 > 192.168.1.45.5005: Flags [P.], seq 150597:156389, ack 3, win 1004, options [nop,nop,TS val 3248038759 ecr 2040731403], length 5792
00:26:39.578784 IP 192.168.1.74.36738 > 192.168.1.45.5005: Flags [.], seq 156389:163629, ack 3, win 1004, options [nop,nop,TS val 3248038759 ecr 2040731403], length 7240
00:26:39.578796 IP 192.168.1.45.5005 > 192.168.1.74.36738: Flags [.], ack 156389, win 3048, options [nop,nop,TS val 2040731404 ecr 3248038759], length 0
00:26:39.578821 IP 192.168.1.45.5005 > 192.168.1.74.36738: Flags [.], ack 163629, win 3274, options [nop,nop,TS val 2040731404 ecr 3248038759], length 0
00:26:39.578923 IP 192.168.1.74.36738 > 192.168.1.45.5005: Flags [P.], seq 163629:165077, ack 3, win 1004, options [nop,nop,TS val 3248038759 ecr 2040731403], length 1448
00:26:39.578923 IP 192.168.1.74.36738 > 192.168.1.45.5005: Flags [P.], seq 165077:167973, ack 3, win 1004, options [nop,nop,TS val 3248038759 ecr 2040731404], length 2896
00:26:39.578923 IP 192.168.1.74.36738 > 192.168.1.45.5005: Flags [P.], seq 167973:173765, ack 3, win 1004, options [nop,nop,TS val 3248038759 ecr 2040731404], length 5792
00:26:39.578923 IP 192.168.1.74.36738 > 192.168.1.45.5005: Flags [P.], seq 173765:179557, ack 3, win 1004, options [nop,nop,TS val 3248038759 ecr 2040731404], length 5792
00:26:39.578938 IP 192.168.1.45.5005 > 192.168.1.74.36738: Flags [.], ack 165077, win 3319, options [nop,nop,TS val 2040731404 ecr 3248038759], length 0
00:26:39.578957 IP 192.168.1.45.5005 > 192.168.1.74.36738: Flags [.], ack 167973, win 3410, options [nop,nop,TS val 2040731404 ecr 3248038759], length 0
00:26:39.578976 IP 192.168.1.45.5005 > 192.168.1.74.36738: Flags [.], ack 173765, win 3591, options [nop,nop,TS val 2040731404 ecr 3248038759], length 0
00:26:39.578993 IP 192.168.1.45.5005 > 192.168.1.74.36738: Flags [.], ack 179557, win 3772, options [nop,nop,TS val 2040731404 ecr 3248038759], length 0
00:26:39.579036 IP 192.168.1.74.36738 > 192.168.1.45.5005: Flags [P.], seq 179557:191141, ack 3, win 1004, options [nop,nop,TS val 3248038759 ecr 2040731404], length 11584
00:26:39.579043 IP 192.168.1.45.5005 > 192.168.1.74.36738: Flags [.], ack 191141, win 4134, options [nop,nop,TS val 2040731404 ecr 3248038759], length 0
00:26:39.579067 IP 192.168.1.74.36738 > 192.168.1.45.5005: Flags [P.], seq 191141:202725, ack 3, win 1004, options [nop,nop,TS val 3248038759 ecr 2040731404], length 11584
00:26:39.579073 IP 192.168.1.45.5005 > 192.168.1.74.36738: Flags [.], ack 202725, win 4496, options [nop,nop,TS val 2040731404 ecr 3248038759], length 0
00:26:39.579117 IP 192.168.1.74.36738 > 192.168.1.45.5005: Flags [P.], seq 202725:205621, ack 3, win 1004, options [nop,nop,TS val 3248038759 ecr 2040731404], length 2896
00:26:39.579117 IP 192.168.1.74.36738 > 192.168.1.45.5005: Flags [P.], seq 205621:208517, ack 3, win 1004, options [nop,nop,TS val 3248038759 ecr 2040731404], length 2896
00:26:39.579117 IP 192.168.1.74.36738 > 192.168.1.45.5005: Flags [P.], seq 208517:214309, ack 3, win 1004, options [nop,nop,TS val 3248038759 ecr 2040731404], length 5792
00:26:39.579128 IP 192.168.1.45.5005 > 192.168.1.74.36738: Flags [.], ack 205621, win 4586, options [nop,nop,TS val 2040731404 ecr 3248038759], length 0
00:26:39.579149 IP 192.168.1.45.5005 > 192.168.1.74.36738: Flags [.], ack 208517, win 4677, options [nop,nop,TS val 2040731404 ecr 3248038759], length 0
00:26:39.579168 IP 192.168.1.45.5005 > 192.168.1.74.36738: Flags [.], ack 214309, win 4858, options [nop,nop,TS val 2040731404 ecr 3248038759], length 0
00:26:39.579192 IP 192.168.1.74.36738 > 192.168.1.45.5005: Flags [P.], seq 214309:225893, ack 3, win 1004, options [nop,nop,TS val 3248038760 ecr 2040731404], length 11584
00:26:39.579202 IP 192.168.1.45.5005 > 192.168.1.74.36738: Flags [.], ack 225893, win 5220, options [nop,nop,TS val 2040731404 ecr 3248038760], length 0
00:26:39.579250 IP 192.168.1.74.36738 > 192.168.1.45.5005: Flags [P.], seq 225893:237477, ack 3, win 1004, options [nop,nop,TS val 3248038760 ecr 2040731404], length 11584
00:26:39.579257 IP 192.168.1.45.5005 > 192.168.1.74.36738: Flags [.], ack 237477, win 5582, options [nop,nop,TS val 2040731404 ecr 3248038760], length 0
00:26:39.579307 IP 192.168.1.74.36738 > 192.168.1.45.5005: Flags [.], seq 237477:246165, ack 3, win 1004, options [nop,nop,TS val 3248038760 ecr 2040731404], length 8688
00:26:39.579316 IP 192.168.1.45.5005 > 192.168.1.74.36738: Flags [.], ack 246165, win 5853, options [nop,nop,TS val 2040731404 ecr 3248038760], length 0
00:26:39.579446 IP 192.168.1.74.36738 > 192.168.1.45.5005: Flags [P.], seq 246165:251957, ack 3, win 1004, options [nop,nop,TS val 3248038760 ecr 2040731404], length 5792
00:26:39.579446 IP 192.168.1.74.36738 > 192.168.1.45.5005: Flags [P.], seq 251957:254853, ack 3, win 1004, options [nop,nop,TS val 3248038760 ecr 2040731404], length 2896
00:26:39.579446 IP 192.168.1.74.36738 > 192.168.1.45.5005: Flags [P.], seq 254853:260645, ack 3, win 1004, options [nop,nop,TS val 3248038760 ecr 2040731404], length 5792
00:26:39.579456 IP 192.168.1.45.5005 > 192.168.1.74.36738: Flags [.], ack 251957, win 6034, options [nop,nop,TS val 2040731405 ecr 3248038760], length 0
00:26:39.579471 IP 192.168.1.45.5005 > 192.168.1.74.36738: Flags [.], ack 254853, win 6125, options [nop,nop,TS val 2040731405 ecr 3248038760], length 0
00:26:39.579486 IP 192.168.1.45.5005 > 192.168.1.74.36738: Flags [.], ack 260645, win 6306, options [nop,nop,TS val 2040731405 ecr 3248038760], length 0
00:26:39.579543 IP 192.168.1.74.36738 > 192.168.1.45.5005: Flags [P.], seq 260645:269333, ack 3, win 1004, options [nop,nop,TS val 3248038760 ecr 2040731404], length 8688
00:26:39.579543 IP 192.168.1.74.36738 > 192.168.1.45.5005: Flags [P.], seq 269333:272229, ack 3, win 1004, options [nop,nop,TS val 3248038760 ecr 2040731404], length 2896
00:26:39.579550 IP 192.168.1.45.5005 > 192.168.1.74.36738: Flags [.], ack 269333, win 6577, options [nop,nop,TS val 2040731405 ecr 3248038760], length 0
00:26:39.579565 IP 192.168.1.45.5005 > 192.168.1.74.36738: Flags [.], ack 272229, win 6668, options [nop,nop,TS val 2040731405 ecr 3248038760], length 0
00:26:39.579580 IP 192.168.1.74.36738 > 192.168.1.45.5005: Flags [P.], seq 272229:283813, ack 3, win 1004, options [nop,nop,TS val 3248038760 ecr 2040731404], length 11584
00:26:39.579586 IP 192.168.1.45.5005 > 192.168.1.74.36738: Flags [.], ack 283813, win 7030, options [nop,nop,TS val 2040731405 ecr 3248038760], length 0
00:26:39.579659 IP 192.168.1.74.36738 > 192.168.1.45.5005: Flags [.], seq 283813:299741, ack 3, win 1004, options [nop,nop,TS val 3248038760 ecr 2040731404], length 15928
00:26:39.579669 IP 192.168.1.45.5005 > 192.168.1.74.36738: Flags [.], ack 299741, win 7528, options [nop,nop,TS val 2040731405 ecr 3248038760], length 0
00:26:39.579872 IP 192.168.1.74.36738 > 192.168.1.45.5005: Flags [P.], seq 299741:301189, ack 3, win 1004, options [nop,nop,TS val 3248038760 ecr 2040731404], length 1448
00:26:39.579872 IP 192.168.1.74.36738 > 192.168.1.45.5005: Flags [P.], seq 301189:306981, ack 3, win 1004, options [nop,nop,TS val 3248038760 ecr 2040731404], length 5792
00:26:39.579873 IP 192.168.1.74.36738 > 192.168.1.45.5005: Flags [P.], seq 306981:330149, ack 3, win 1004, options [nop,nop,TS val 3248038760 ecr 2040731404], length 23168
00:26:39.579895 IP 192.168.1.45.5005 > 192.168.1.74.36738: Flags [.], ack 301189, win 7573, options [nop,nop,TS val 2040731405 ecr 3248038760], length 0
00:26:39.579916 IP 192.168.1.45.5005 > 192.168.1.74.36738: Flags [.], ack 306981, win 7754, options [nop,nop,TS val 2040731405 ecr 3248038760], length 0
00:26:39.579926 IP 192.168.1.45.5005 > 192.168.1.74.36738: Flags [.], ack 330149, win 8478, options [nop,nop,TS val 2040731405 ecr 3248038760], length 0
00:26:39.579987 IP 192.168.1.74.36738 > 192.168.1.45.5005: Flags [P.], seq 330149:333045, ack 3, win 1004, options [nop,nop,TS val 3248038760 ecr 2040731404], length 2896
00:26:39.579987 IP 192.168.1.74.36738 > 192.168.1.45.5005: Flags [.], seq 333045:356213, ack 3, win 1004, options [nop,nop,TS val 3248038760 ecr 2040731404], length 23168
00:26:39.580006 IP 192.168.1.45.5005 > 192.168.1.74.36738: Flags [.], ack 333045, win 8568, options [nop,nop,TS val 2040731405 ecr 3248038760], length 0
00:26:39.580020 IP 192.168.1.45.5005 > 192.168.1.74.36738: Flags [.], ack 356213, win 9292, options [nop,nop,TS val 2040731405 ecr 3248038760], length 0
00:26:39.580618 IP 192.168.1.74.36738 > 192.168.1.45.5005: Flags [P.], seq 356213:364901, ack 3, win 1004, options [nop,nop,TS val 3248038760 ecr 2040731404], length 8688
00:26:39.580618 IP 192.168.1.74.36738 > 192.168.1.45.5005: Flags [P.], seq 364901:396757, ack 3, win 1004, options [nop,nop,TS val 3248038760 ecr 2040731404], length 31856
00:26:39.580641 IP 192.168.1.45.5005 > 192.168.1.74.36738: Flags [.], ack 364901, win 9564, options [nop,nop,TS val 2040731406 ecr 3248038760], length 0
00:26:39.580661 IP 192.168.1.45.5005 > 192.168.1.74.36738: Flags [.], ack 396757, win 10559, options [nop,nop,TS val 2040731406 ecr 3248038760], length 0
00:26:39.580723 IP 192.168.1.74.36738 > 192.168.1.45.5005: Flags [P.], seq 396757:428613, ack 3, win 1004, options [nop,nop,TS val 3248038760 ecr 2040731405], length 31856
00:26:39.580734 IP 192.168.1.45.5005 > 192.168.1.74.36738: Flags [.], ack 428613, win 11555, options [nop,nop,TS val 2040731406 ecr 3248038760], length 0
00:26:39.580777 IP 192.168.1.74.36738 > 192.168.1.45.5005: Flags [.], seq 428613:448885, ack 3, win 1004, options [nop,nop,TS val 3248038760 ecr 2040731405], length 20272
00:26:39.580786 IP 192.168.1.45.5005 > 192.168.1.74.36738: Flags [.], ack 448885, win 12188, options [nop,nop,TS val 2040731406 ecr 3248038760], length 0
00:26:39.580814 IP 192.168.1.74.36738 > 192.168.1.45.5005: Flags [P.], seq 448885:460469, ack 3, win 1004, options [nop,nop,TS val 3248038760 ecr 2040731405], length 11584
00:26:39.580821 IP 192.168.1.45.5005 > 192.168.1.74.36738: Flags [.], ack 460469, win 12550, options [nop,nop,TS val 2040731406 ecr 3248038760], length 0
00:26:39.580883 IP 192.168.1.74.36738 > 192.168.1.45.5005: Flags [P.], seq 460469:492325, ack 3, win 1004, options [nop,nop,TS val 3248038761 ecr 2040731405], length 31856
00:26:39.580899 IP 192.168.1.45.5005 > 192.168.1.74.36738: Flags [.], ack 492325, win 13546, options [nop,nop,TS val 2040731406 ecr 3248038761], length 0
00:26:39.580971 IP 192.168.1.74.36738 > 192.168.1.45.5005: Flags [P.], seq 492325:524181, ack 3, win 1004, options [nop,nop,TS val 3248038761 ecr 2040731405], length 31856
00:26:39.580986 IP 192.168.1.45.5005 > 192.168.1.74.36738: Flags [.], ack 524181, win 14541, options [nop,nop,TS val 2040731406 ecr 3248038761], length 0
00:26:39.581149 IP 192.168.1.74.36738 > 192.168.1.45.5005: Flags [.], seq 524181:538661, ack 3, win 1004, options [nop,nop,TS val 3248038762 ecr 2040731406], length 14480
00:26:39.581161 IP 192.168.1.45.5005 > 192.168.1.74.36738: Flags [.], ack 538661, win 14994, options [nop,nop,TS val 2040731406 ecr 3248038762], length 0
00:26:39.581275 IP 192.168.1.74.36738 > 192.168.1.45.5005: Flags [P.], seq 538661:556037, ack 3, win 1004, options [nop,nop,TS val 3248038762 ecr 2040731406], length 17376
00:26:39.581286 IP 192.168.1.45.5005 > 192.168.1.74.36738: Flags [.], ack 556037, win 15537, options [nop,nop,TS val 2040731406 ecr 3248038762], length 0
00:26:39.581352 IP 192.168.1.74.36738 > 192.168.1.45.5005: Flags [.], seq 556037:570517, ack 3, win 1004, options [nop,nop,TS val 3248038762 ecr 2040731406], length 14480
00:26:39.581361 IP 192.168.1.45.5005 > 192.168.1.74.36738: Flags [.], ack 570517, win 15703, options [nop,nop,TS val 2040731406 ecr 3248038762], length 0
00:26:39.581476 IP 192.168.1.74.36738 > 192.168.1.45.5005: Flags [P.], seq 570517:587893, ack 3, win 1004, options [nop,nop,TS val 3248038762 ecr 2040731406], length 17376
00:26:39.581487 IP 192.168.1.45.5005 > 192.168.1.74.36738: Flags [.], ack 587893, win 15521, options [nop,nop,TS val 2040731407 ecr 3248038762], length 0
00:26:39.581567 IP 192.168.1.74.36738 > 192.168.1.45.5005: Flags [.], seq 587893:599477, ack 3, win 1004, options [nop,nop,TS val 3248038762 ecr 2040731406], length 11584
00:26:39.581578 IP 192.168.1.45.5005 > 192.168.1.74.36738: Flags [.], ack 599477, win 15399, options [nop,nop,TS val 2040731407 ecr 3248038762], length 0
00:26:39.581708 IP 192.168.1.74.36738 > 192.168.1.45.5005: Flags [P.], seq 599477:619749, ack 3, win 1004, options [nop,nop,TS val 3248038762 ecr 2040731406], length 20272
00:26:39.581722 IP 192.168.1.45.5005 > 192.168.1.74.36738: Flags [.], ack 619749, win 15187, options [nop,nop,TS val 2040731407 ecr 3248038762], length 0
00:26:39.581806 IP 192.168.1.74.36738 > 192.168.1.45.5005: Flags [.], seq 619749:640021, ack 3, win 1004, options [nop,nop,TS val 3248038762 ecr 2040731406], length 20272
00:26:39.581819 IP 192.168.1.45.5005 > 192.168.1.74.36738: Flags [.], ack 640021, win 14975, options [nop,nop,TS val 2040731407 ecr 3248038762], length 0
00:26:39.581984 IP 192.168.1.74.36738 > 192.168.1.45.5005: Flags [.], seq 640021:668981, ack 3, win 1004, options [nop,nop,TS val 3248038762 ecr 2040731406], length 28960
00:26:39.582002 IP 192.168.1.45.5005 > 192.168.1.74.36738: Flags [.], ack 668981, win 14671, options [nop,nop,TS val 2040731407 ecr 3248038762], length 0
00:26:39.582116 IP 192.168.1.74.36738 > 192.168.1.45.5005: Flags [P.], seq 668981:684909, ack 3, win 1004, options [nop,nop,TS val 3248038762 ecr 2040731406], length 15928
00:26:39.582128 IP 192.168.1.45.5005 > 192.168.1.74.36738: Flags [.], ack 684909, win 14504, options [nop,nop,TS val 2040731407 ecr 3248038762], length 0
00:26:39.582206 IP 192.168.1.74.36738 > 192.168.1.45.5005: Flags [.], seq 684909:705181, ack 3, win 1004, options [nop,nop,TS val 3248038762 ecr 2040731406], length 20272
00:26:39.582219 IP 192.168.1.45.5005 > 192.168.1.74.36738: Flags [.], ack 705181, win 14292, options [nop,nop,TS val 2040731407 ecr 3248038762], length 0
00:26:39.582331 IP 192.168.1.74.36738 > 192.168.1.45.5005: Flags [P.], seq 705181:722557, ack 3, win 1004, options [nop,nop,TS val 3248038762 ecr 2040731406], length 17376
00:26:39.582344 IP 192.168.1.45.5005 > 192.168.1.74.36738: Flags [.], ack 722557, win 14110, options [nop,nop,TS val 2040731407 ecr 3248038762], length 0
00:26:39.582411 IP 192.168.1.74.36738 > 192.168.1.45.5005: Flags [.], seq 722557:738485, ack 3, win 1004, options [nop,nop,TS val 3248038762 ecr 2040731406], length 15928
00:26:39.582421 IP 192.168.1.45.5005 > 192.168.1.74.36738: Flags [.], ack 738485, win 13943, options [nop,nop,TS val 2040731407 ecr 3248038762], length 0
00:26:39.582551 IP 192.168.1.74.36738 > 192.168.1.45.5005: Flags [P.], seq 738485:750069, ack 3, win 1004, options [nop,nop,TS val 3248038762 ecr 2040731406], length 11584
00:26:39.582562 IP 192.168.1.45.5005 > 192.168.1.74.36738: Flags [.], ack 750069, win 13821, options [nop,nop,TS val 2040731408 ecr 3248038762], length 0
00:26:39.582629 IP 192.168.1.74.36738 > 192.168.1.45.5005: Flags [.], seq 750069:768893, ack 3, win 1004, options [nop,nop,TS val 3248038763 ecr 2040731407], length 18824
00:26:39.582641 IP 192.168.1.45.5005 > 192.168.1.74.36738: Flags [.], ack 768893, win 13624, options [nop,nop,TS val 2040731408 ecr 3248038763], length 0
00:26:39.582828 IP 192.168.1.74.36738 > 192.168.1.45.5005: Flags [.], seq 768893:802197, ack 3, win 1004, options [nop,nop,TS val 3248038763 ecr 2040731407], length 33304
00:26:39.582851 IP 192.168.1.45.5005 > 192.168.1.74.36738: Flags [.], ack 802197, win 13275, options [nop,nop,TS val 2040731408 ecr 3248038763], length 0
00:26:39.582973 IP 192.168.1.74.36738 > 192.168.1.45.5005: Flags [P.], seq 802197:815229, ack 3, win 1004, options [nop,nop,TS val 3248038763 ecr 2040731407], length 13032
00:26:39.582985 IP 192.168.1.45.5005 > 192.168.1.74.36738: Flags [.], ack 815229, win 13138, options [nop,nop,TS val 2040731408 ecr 3248038763], length 0
00:26:39.583061 IP 192.168.1.74.36738 > 192.168.1.45.5005: Flags [.], seq 815229:841293, ack 3, win 1004, options [nop,nop,TS val 3248038763 ecr 2040731407], length 26064
00:26:39.583076 IP 192.168.1.45.5005 > 192.168.1.74.36738: Flags [.], ack 841293, win 12866, options [nop,nop,TS val 2040731408 ecr 3248038763], length 0
00:26:39.583265 IP 192.168.1.74.36738 > 192.168.1.45.5005: Flags [.], seq 841293:876045, ack 3, win 1004, options [nop,nop,TS val 3248038763 ecr 2040731407], length 34752
00:26:39.583287 IP 192.168.1.45.5005 > 192.168.1.74.36738: Flags [.], ack 876045, win 12502, options [nop,nop,TS val 2040731408 ecr 3248038763], length 0
00:26:39.584674 IP 192.168.1.74.36738 > 192.168.1.45.5005: Flags [P.], seq 876045:880389, ack 3, win 1004, options [nop,nop,TS val 3248038763 ecr 2040731407], length 4344
00:26:39.584674 IP 192.168.1.74.36738 > 192.168.1.45.5005: Flags [P.], seq 880389:945549, ack 3, win 1004, options [nop,nop,TS val 3248038763 ecr 2040731407], length 65160
00:26:39.584685 IP 192.168.1.45.5005 > 192.168.1.74.36738: Flags [.], ack 880389, win 15839, options [nop,nop,TS val 2040731410 ecr 3248038763], length 0
00:26:39.584691 IP 192.168.1.45.5005 > 192.168.1.74.36738: Flags [.], ack 945549, win 17875, options [nop,nop,TS val 2040731410 ecr 3248038763], length 0
00:26:39.584703 IP 192.168.1.74.36738 > 192.168.1.45.5005: Flags [.], seq 945549:968717, ack 3, win 1004, options [nop,nop,TS val 3248038764 ecr 2040731408], length 23168
00:26:39.584706 IP 192.168.1.45.5005 > 192.168.1.74.36738: Flags [.], ack 968717, win 18599, options [nop,nop,TS val 2040731410 ecr 3248038764], length 0
00:26:39.585035 IP 192.168.1.74.36738 > 192.168.1.45.5005: Flags [P.], seq 968717:1010709, ack 3, win 1004, options [nop,nop,TS val 3248038764 ecr 2040731408], length 41992
00:26:39.585042 IP 192.168.1.45.5005 > 192.168.1.74.36738: Flags [.], ack 1010709, win 19911, options [nop,nop,TS val 2040731410 ecr 3248038764], length 0
00:26:39.585068 IP 192.168.1.74.36738 > 192.168.1.45.5005: Flags [.], seq 1010709:1061389, ack 3, win 1004, options [nop,nop,TS val 3248038764 ecr 2040731408], length 50680
00:26:39.585076 IP 192.168.1.45.5005 > 192.168.1.74.36738: Flags [.], ack 1061389, win 21495, options [nop,nop,TS val 2040731410 ecr 3248038764], length 0
00:26:39.585411 IP 192.168.1.74.36738 > 192.168.1.45.5005: Flags [P.], seq 1061389:1075869, ack 3, win 1004, options [nop,nop,TS val 3248038764 ecr 2040731408], length 14480
00:26:39.585416 IP 192.168.1.45.5005 > 192.168.1.74.36738: Flags [.], ack 1075869, win 21948, options [nop,nop,TS val 2040731410 ecr 3248038764], length 0
00:26:39.585427 IP 192.168.1.74.36738 > 192.168.1.45.5005: Flags [P.], seq 1075869:1096141, ack 3, win 1004, options [nop,nop,TS val 3248038766 ecr 2040731410], length 20272
00:26:39.585430 IP 192.168.1.45.5005 > 192.168.1.74.36738: Flags [.], ack 1096141, win 22581, options [nop,nop,TS val 2040731410 ecr 3248038766], length 0
00:26:39.585456 IP 192.168.1.74.36738 > 192.168.1.45.5005: Flags [P.], seq 1096141:1141029, ack 3, win 1004, options [nop,nop,TS val 3248038766 ecr 2040731410], length 44888
00:26:39.585464 IP 192.168.1.45.5005 > 192.168.1.74.36738: Flags [.], ack 1141029, win 23984, options [nop,nop,TS val 2040731411 ecr 3248038766], length 0
00:26:39.585477 IP 192.168.1.74.36738 > 192.168.1.45.5005: Flags [.], seq 1141029:1154061, ack 3, win 1004, options [nop,nop,TS val 3248038766 ecr 2040731410], length 13032
00:26:39.585480 IP 192.168.1.45.5005 > 192.168.1.74.36738: Flags [.], ack 1154061, win 24391, options [nop,nop,TS val 2040731411 ecr 3248038766], length 0
00:26:39.585763 IP 192.168.1.74.36738 > 192.168.1.45.5005: Flags [P.], seq 1154061:1206189, ack 3, win 1004, options [nop,nop,TS val 3248038766 ecr 2040731410], length 52128
00:26:39.585787 IP 192.168.1.45.5005 > 192.168.1.74.36738: Flags [.], ack 1206189, win 25800, options [nop,nop,TS val 2040731411 ecr 3248038766], length 0
00:26:39.585810 IP 192.168.1.74.36738 > 192.168.1.45.5005: Flags [.], seq 1206189:1246733, ack 3, win 1004, options [nop,nop,TS val 3248038766 ecr 2040731410], length 40544
00:26:39.585863 IP 192.168.1.45.5005 > 192.168.1.74.36738: Flags [.], ack 1246733, win 25800, options [nop,nop,TS val 2040731411 ecr 3248038766], length 0
00:26:39.585945 IP 192.168.1.74.36738 > 192.168.1.45.5005: Flags [P.], seq 1246733:1271349, ack 3, win 1004, options [nop,nop,TS val 3248038766 ecr 2040731410], length 24616
00:26:39.585952 IP 192.168.1.45.5005 > 192.168.1.74.36738: Flags [.], ack 1271349, win 26087, options [nop,nop,TS val 2040731411 ecr 3248038766], length 0
00:26:39.585968 IP 192.168.1.74.36738 > 192.168.1.45.5005: Flags [P.], seq 1271349:1301757, ack 3, win 1004, options [nop,nop,TS val 3248038766 ecr 2040731410], length 30408
00:26:39.585986 IP 192.168.1.74.36738 > 192.168.1.45.5005: Flags [P.], seq 1301757:1322029, ack 3, win 1004, options [nop,nop,TS val 3248038766 ecr 2040731410], length 20272
00:26:39.585993 IP 192.168.1.74.36738 > 192.168.1.45.5005: Flags [P.], seq 1322029:1336509, ack 3, win 1004, options [nop,nop,TS val 3248038766 ecr 2040731411], length 14480
00:26:39.586002 IP 192.168.1.74.36738 > 192.168.1.45.5005: Flags [.], seq 1336509:1339405, ack 3, win 1004, options [nop,nop,TS val 3248038766 ecr 2040731411], length 2896
00:26:39.586027 IP 192.168.1.45.5005 > 192.168.1.74.36738: Flags [.], ack 1339405, win 26087, options [nop,nop,TS val 2040731411 ecr 3248038766], length 0
00:26:39.586092 IP 192.168.1.74.36738 > 192.168.1.45.5005: Flags [P.], seq 1339405:1369813, ack 3, win 1004, options [nop,nop,TS val 3248038766 ecr 2040731411], length 30408
00:26:39.586102 IP 192.168.1.74.36738 > 192.168.1.45.5005: Flags [P.], seq 1369813:1382845, ack 3, win 1004, options [nop,nop,TS val 3248038766 ecr 2040731411], length 13032
00:26:39.586111 IP 192.168.1.74.36738 > 192.168.1.45.5005: Flags [P.], seq 1382845:1401669, ack 3, win 1004, options [nop,nop,TS val 3248038767 ecr 2040731411], length 18824
00:26:39.586126 IP 192.168.1.74.36738 > 192.168.1.45.5005: Flags [.], seq 1401669:1432077, ack 3, win 1004, options [nop,nop,TS val 3248038767 ecr 2040731411], length 30408
00:26:39.586209 IP 192.168.1.45.5005 > 192.168.1.74.36738: Flags [.], ack 1432077, win 26087, options [nop,nop,TS val 2040731411 ecr 3248038766], length 0
00:26:39.586257 IP 192.168.1.74.36738 > 192.168.1.45.5005: Flags [P.], seq 1432077:1466829, ack 3, win 1004, options [nop,nop,TS val 3248038767 ecr 2040731411], length 34752
00:26:39.586282 IP 192.168.1.74.36738 > 192.168.1.45.5005: Flags [P.], seq 1466829:1505925, ack 3, win 1004, options [nop,nop,TS val 3248038767 ecr 2040731411], length 39096
00:26:39.586299 IP 192.168.1.74.36738 > 192.168.1.45.5005: Flags [.], seq 1505925:1524749, ack 3, win 1004, options [nop,nop,TS val 3248038767 ecr 2040731411], length 18824
00:26:39.586337 IP 192.168.1.45.5005 > 192.168.1.74.36738: Flags [.], ack 1524749, win 26087, options [nop,nop,TS val 2040731411 ecr 3248038767], length 0
00:26:39.586433 IP 192.168.1.74.36738 > 192.168.1.45.5005: Flags [P.], seq 1524749:1531989, ack 3, win 1004, options [nop,nop,TS val 3248038767 ecr 2040731411], length 7240
00:26:39.586433 IP 192.168.1.74.36738 > 192.168.1.45.5005: Flags [P.], seq 1531989:1597149, ack 3, win 1004, options [nop,nop,TS val 3248038767 ecr 2040731411], length 65160
00:26:39.586446 IP 192.168.1.45.5005 > 192.168.1.74.36738: Flags [.], ack 1531989, win 26267, options [nop,nop,TS val 2040731411 ecr 3248038767], length 0
00:26:39.586467 IP 192.168.1.74.36738 > 192.168.1.45.5005: Flags [.], seq 1597149:1617421, ack 3, win 1004, options [nop,nop,TS val 3248038767 ecr 2040731411], length 20272
00:26:39.586541 IP 192.168.1.45.5005 > 192.168.1.74.36738: Flags [.], ack 1617421, win 26267, options [nop,nop,TS val 2040731412 ecr 3248038767], length 0
00:26:39.586569 IP 192.168.1.74.36738 > 192.168.1.45.5005: Flags [P.], seq 1617421:1662309, ack 3, win 1004, options [nop,nop,TS val 3248038767 ecr 2040731411], length 44888
00:26:39.586587 IP 192.168.1.74.36738 > 192.168.1.45.5005: Flags [P.], seq 1662309:1675341, ack 3, win 1004, options [nop,nop,TS val 3248038767 ecr 2040731411], length 13032
00:26:39.586611 IP 192.168.1.74.36738 > 192.168.1.45.5005: Flags [.], seq 1675341:1710093, ack 3, win 1004, options [nop,nop,TS val 3248038767 ecr 2040731411], length 34752
00:26:39.586640 IP 192.168.1.45.5005 > 192.168.1.74.36738: Flags [.], ack 1710093, win 26267, options [nop,nop,TS val 2040731412 ecr 3248038767], length 0
00:26:39.586680 IP 192.168.1.74.36738 > 192.168.1.45.5005: Flags [P.], seq 1710093:1727469, ack 3, win 1004, options [nop,nop,TS val 3248038767 ecr 2040731411], length 17376
00:26:39.586740 IP 192.168.1.74.36738 > 192.168.1.45.5005: Flags [P.], seq 1727469:1772357, ack 3, win 1004, options [nop,nop,TS val 3248038767 ecr 2040731411], length 44888
00:26:39.586761 IP 192.168.1.74.36738 > 192.168.1.45.5005: Flags [P.], seq 1772357:1779597, ack 3, win 1004, options [nop,nop,TS val 3248038767 ecr 2040731411], length 7240
00:26:39.586761 IP 192.168.1.74.36738 > 192.168.1.45.5005: Flags [P.], seq 1779597:1792629, ack 3, win 1004, options [nop,nop,TS val 3248038767 ecr 2040731412], length 13032
00:26:39.586778 IP 192.168.1.74.36738 > 192.168.1.45.5005: Flags [.], seq 1792629:1802765, ack 3, win 1004, options [nop,nop,TS val 3248038767 ecr 2040731412], length 10136
00:26:39.586801 IP 192.168.1.45.5005 > 192.168.1.74.36738: Flags [.], ack 1802765, win 26267, options [nop,nop,TS val 2040731412 ecr 3248038767], length 0
00:26:39.586843 IP 192.168.1.74.36738 > 192.168.1.45.5005: Flags [P.], seq 1802765:1857789, ack 3, win 1004, options [nop,nop,TS val 3248038767 ecr 2040731412], length 55024
00:26:39.586857 IP 192.168.1.74.36738 > 192.168.1.45.5005: Flags [P.], seq 1857789:1869373, ack 3, win 1004, options [nop,nop,TS val 3248038767 ecr 2040731412], length 11584
00:26:39.586871 IP 192.168.1.74.36738 > 192.168.1.45.5005: Flags [.], seq 1869373:1878061, ack 3, win 1004, options [nop,nop,TS val 3248038767 ecr 2040731412], length 8688
00:26:39.587077 IP 192.168.1.45.5005 > 192.168.1.74.36738: Flags [.], ack 1878061, win 26267, options [nop,nop,TS val 2040731412 ecr 3248038767], length 0
00:26:39.587201 IP 192.168.1.74.36738 > 192.168.1.45.5005: Flags [P.], seq 1878061:1922949, ack 3, win 1004, options [nop,nop,TS val 3248038767 ecr 2040731412], length 44888
00:26:39.587245 IP 192.168.1.74.36738 > 192.168.1.45.5005: Flags [P.], seq 1922949:1967837, ack 3, win 1004, options [nop,nop,TS val 3248038767 ecr 2040731412], length 44888
00:26:39.587266 IP 192.168.1.74.36738 > 192.168.1.45.5005: Flags [.], seq 1967837:1970733, ack 3, win 1004, options [nop,nop,TS val 3248038768 ecr 2040731412], length 2896
00:26:39.587296 IP 192.168.1.45.5005 > 192.168.1.74.36738: Flags [.], ack 1970733, win 26267, options [nop,nop,TS val 2040731412 ecr 3248038767], length 0
00:26:39.587336 IP 192.168.1.74.36738 > 192.168.1.45.5005: Flags [P.], seq 1970733:1988109, ack 3, win 1004, options [nop,nop,TS val 3248038768 ecr 2040731412], length 17376
00:26:39.587372 IP 192.168.1.74.36738 > 192.168.1.45.5005: Flags [P.], seq 1988109:2053269, ack 3, win 1004, options [nop,nop,TS val 3248038768 ecr 2040731412], length 65160
00:26:39.587391 IP 192.168.1.74.36738 > 192.168.1.45.5005: Flags [.], seq 2053269:2063405, ack 3, win 1004, options [nop,nop,TS val 3248038768 ecr 2040731412], length 10136
00:26:39.587455 IP 192.168.1.45.5005 > 192.168.1.74.36738: Flags [.], ack 2063405, win 26267, options [nop,nop,TS val 2040731413 ecr 3248038768], length 0
00:26:39.587490 IP 192.168.1.74.36738 > 192.168.1.45.5005: Flags [P.], seq 2063405:2064853, ack 3, win 1004, options [nop,nop,TS val 3248038768 ecr 2040731412], length 1448
00:26:39.587490 IP 192.168.1.74.36738 > 192.168.1.45.5005: Flags [P.], seq 2064853:2118429, ack 3, win 1004, options [nop,nop,TS val 3248038768 ecr 2040731412], length 53576
00:26:39.587504 IP 192.168.1.45.5005 > 192.168.1.74.36738: Flags [.], ack 2064853, win 26312, options [nop,nop,TS val 2040731413 ecr 3248038768], length 0
00:26:39.587532 IP 192.168.1.74.36738 > 192.168.1.45.5005: Flags [.], seq 2118429:2156077, ack 3, win 1004, options [nop,nop,TS val 3248038768 ecr 2040731412], length 37648
00:26:39.587599 IP 192.168.1.45.5005 > 192.168.1.74.36738: Flags [.], ack 2156077, win 26312, options [nop,nop,TS val 2040731413 ecr 3248038768], length 0
00:26:39.587633 IP 192.168.1.74.36738 > 192.168.1.45.5005: Flags [P.], seq 2156077:2183589, ack 3, win 1004, options [nop,nop,TS val 3248038768 ecr 2040731412], length 27512
00:26:39.587648 IP 192.168.1.74.36738 > 192.168.1.45.5005: Flags [.], seq 2183589:2195173, ack 3, win 1004, options [nop,nop,TS val 3248038768 ecr 2040731413], length 11584
00:26:39.587691 IP 192.168.1.45.5005 > 192.168.1.74.36738: Flags [.], ack 2195173, win 26312, options [nop,nop,TS val 2040731413 ecr 3248038768], length 0
00:26:39.587727 IP 192.168.1.74.36738 > 192.168.1.45.5005: Flags [.], seq 2195173:2234269, ack 3, win 1004, options [nop,nop,TS val 3248038768 ecr 2040731413], length 39096
00:26:39.587767 IP 192.168.1.45.5005 > 192.168.1.74.36738: Flags [.], ack 2234269, win 26312, options [nop,nop,TS val 2040731413 ecr 3248038768], length 0
00:26:39.587782 IP 192.168.1.74.36738 > 192.168.1.45.5005: Flags [P.], seq 2234269:2248749, ack 3, win 1004, options [nop,nop,TS val 3248038768 ecr 2040731413], length 14480
00:26:39.587807 IP 192.168.1.74.36738 > 192.168.1.45.5005: Flags [.], seq 2248749:2279157, ack 3, win 1004, options [nop,nop,TS val 3248038768 ecr 2040731413], length 30408
00:26:39.587848 IP 192.168.1.45.5005 > 192.168.1.74.36738: Flags [.], ack 2279157, win 26312, options [nop,nop,TS val 2040731413 ecr 3248038768], length 0
00:26:39.587872 IP 192.168.1.74.36738 > 192.168.1.45.5005: Flags [P.], seq 2279157:2313909, ack 3, win 1004, options [nop,nop,TS val 3248038768 ecr 2040731413], length 34752
00:26:39.587894 IP 192.168.1.74.36738 > 192.168.1.45.5005: Flags [.], seq 2313909:2329837, ack 3, win 1004, options [nop,nop,TS val 3248038768 ecr 2040731413], length 15928
00:26:39.588029 IP 192.168.1.45.5005 > 192.168.1.74.36738: Flags [.], ack 2329837, win 26312, options [nop,nop,TS val 2040731413 ecr 3248038768], length 0
00:26:39.588106 IP 192.168.1.74.36738 > 192.168.1.45.5005: Flags [P.], seq 2329837:2379069, ack 3, win 1004, options [nop,nop,TS val 3248038768 ecr 2040731413], length 49232
00:26:39.588138 IP 192.168.1.74.36738 > 192.168.1.45.5005: Flags [.], seq 2379069:2422509, ack 3, win 1004, options [nop,nop,TS val 3248038768 ecr 2040731413], length 43440
00:26:39.588163 IP 192.168.1.45.5005 > 192.168.1.74.36738: Flags [.], ack 2422509, win 26312, options [nop,nop,TS val 2040731413 ecr 3248038768], length 0
00:26:39.588179 IP 192.168.1.74.36738 > 192.168.1.45.5005: Flags [P.], seq 2422509:2435541, ack 3, win 1004, options [nop,nop,TS val 3248038768 ecr 2040731413], length 13032
00:26:39.588196 IP 192.168.1.74.36738 > 192.168.1.45.5005: Flags [P.], seq 2476085:2509389, ack 3, win 1004, options [nop,nop,TS val 3248038768 ecr 2040731413], length 33304
00:26:39.588203 IP 192.168.1.45.5005 > 192.168.1.74.36738: Flags [.], ack 2435541, win 26109, options [nop,nop,TS val 2040731413 ecr 3248038768,nop,nop,sack 1 {2476085:2509389}], length 0
00:26:39.588216 IP 192.168.1.74.36738 > 192.168.1.45.5005: Flags [P.], seq 2509389:2518077, ack 3, win 1004, options [nop,nop,TS val 3248038768 ecr 2040731413], length 8688
00:26:39.588216 IP 192.168.1.74.36738 > 192.168.1.45.5005: Flags [R.], seq 2518077, ack 3, win 1004, options [nop,nop,TS val 3248038769 ecr 2040731413], length 0
00:26:39.588216 IP 192.168.1.74.36738 > 192.168.1.45.5005: Flags [R], seq 2307236047, win 0, length 0
00:26:39.588220 IP 192.168.1.45.5005 > 192.168.1.74.36738: Flags [.], ack 2435541, win 26109, options [nop,nop,TS val 2040731413 ecr 3248038768,nop,nop,sack 1 {2476085:2518077}], length 0
00:26:39.588234 IP 192.168.1.74.36738 > 192.168.1.45.5005: Flags [R], seq 2307328719, win 0, length 0
00:26:39.588305 IP 192.168.1.74.36738 > 192.168.1.45.5005: Flags [R], seq 2307341751, win 0, length 0
00:26:39.588305 IP 192.168.1.74.36738 > 192.168.1.45.5005: Flags [R], seq 2307341751, win 0, length 0

268 packets captured
268 packets received by filter
0 packets dropped by kernel
