tcpdump: verbose output suppressed, use -v[v]... for full protocol decode
listening on enp0s8, link-type EN10MB (Ethernet), snapshot length 262144 bytes
00:12:18.611998 IP 192.168.1.74.58234 > 192.168.1.45.5005: Flags [S], seq 4106255350, win 64240, options [mss 1460,sackOK,TS val 3247177758 ecr 0,nop,wscale 6], length 0
00:12:18.612021 IP 192.168.1.45.5005 > 192.168.1.74.58234: Flags [S.], seq 2053939390, ack 4106255351, win 65160, options [mss 1460,sackOK,TS val 2039870437 ecr 3247177758,nop,wscale 6], length 0
00:12:18.612192 IP 192.168.1.74.58234 > 192.168.1.45.5005: Flags [.], ack 1, win 1004, options [nop,nop,TS val 3247177758 ecr 2039870437], length 0
00:12:18.612798 IP 192.168.1.74.58234 > 192.168.1.45.5005: Flags [P.], seq 1:5, ack 1, win 1004, options [nop,nop,TS val 3247177759 ecr 2039870437], length 4
00:12:18.612817 IP 192.168.1.45.5005 > 192.168.1.74.58234: Flags [.], ack 5, win 1019, options [nop,nop,TS val 2039870438 ecr 3247177759], length 0
00:12:18.613050 IP 192.168.1.45.5005 > 192.168.1.74.58234: Flags [P.], seq 1:3, ack 5, win 1019, options [nop,nop,TS val 2039870438 ecr 3247177759], length 2
00:12:18.613131 IP 192.168.1.74.58234 > 192.168.1.45.5005: Flags [.], ack 3, win 1004, options [nop,nop,TS val 3247177759 ecr 2039870438], length 0
00:12:18.613179 IP 192.168.1.74.58234 > 192.168.1.45.5005: Flags [P.], seq 5:7245, ack 3, win 1004, options [nop,nop,TS val 3247177759 ecr 2039870438], length 7240
00:12:18.613206 IP 192.168.1.74.58234 > 192.168.1.45.5005: Flags [P.], seq 7245:14485, ack 3, win 1004, options [nop,nop,TS val 3247177759 ecr 2039870438], length 7240
00:12:18.620560 IP 192.168.1.74.58234 > 192.168.1.45.5005: Flags [.], seq 14485:15933, ack 3, win 1004, options [nop,nop,TS val 3247177767 ecr 2039870438], length 1448
00:12:18.655647 IP 192.168.1.45.5005 > 192.168.1.74.58234: Flags [.], ack 15933, win 857, options [nop,nop,TS val 2039870481 ecr 3247177759], length 0
00:12:18.656545 IP 192.168.1.74.58234 > 192.168.1.45.5005: Flags [P.], seq 15933:26069, ack 3, win 1004, options [nop,nop,TS val 3247177802 ecr 2039870481], length 10136
00:12:18.656545 IP 192.168.1.74.58234 > 192.168.1.45.5005: Flags [P.], seq 26069:36205, ack 3, win 1004, options [nop,nop,TS val 3247177802 ecr 2039870481], length 10136
00:12:18.656588 IP 192.168.1.45.5005 > 192.168.1.74.58234: Flags [.], ack 26069, win 752, options [nop,nop,TS val 2039870482 ecr 3247177802], length 0
00:12:18.656625 IP 192.168.1.45.5005 > 192.168.1.74.58234: Flags [.], ack 36205, win 645, options [nop,nop,TS val 2039870482 ecr 3247177802], length 0
00:12:18.656668 IP 192.168.1.74.58234 > 192.168.1.45.5005: Flags [.], seq 36205:44893, ack 3, win 1004, options [nop,nop,TS val 3247177803 ecr 2039870481], length 8688
00:12:18.656675 IP 192.168.1.45.5005 > 192.168.1.74.58234: Flags [.], ack 44893, win 555, options [nop,nop,TS val 2039870482 ecr 3247177803], length 0
00:12:18.656793 IP 192.168.1.74.58234 > 192.168.1.45.5005: Flags [P.], seq 44893:46341, ack 3, win 1004, options [nop,nop,TS val 3247177803 ecr 2039870481], length 1448
00:12:18.656799 IP 192.168.1.45.5005 > 192.168.1.74.58234: Flags [.], ack 46341, win 540, options [nop,nop,TS val 2039870482 ecr 3247177803], length 0
00:12:18.657112 IP 192.168.1.74.58234 > 192.168.1.45.5005: Flags [.], seq 46341:55029, ack 3, win 1004, options [nop,nop,TS val 3247177803 ecr 2039870482], length 8688
00:12:18.657216 IP 192.168.1.74.58234 > 192.168.1.45.5005: Flags [P.], seq 55029:60821, ack 3, win 1004, options [nop,nop,TS val 3247177803 ecr 2039870482], length 5792
00:12:18.657217 IP 192.168.1.74.58234 > 192.168.1.45.5005: Flags [P.], seq 60821:66613, ack 3, win 1004, options [nop,nop,TS val 3247177803 ecr 2039870482], length 5792
00:12:18.657242 IP 192.168.1.74.58234 > 192.168.1.45.5005: Flags [.], seq 66613:72405, ack 3, win 1004, options [nop,nop,TS val 3247177803 ecr 2039870482], length 5792
00:12:18.657329 IP 192.168.1.74.58234 > 192.168.1.45.5005: Flags [P.], seq 72405:77485, ack 3, win 1004, options [nop,nop,TS val 3247177803 ecr 2039870482], length 5080
00:12:18.657329 IP 192.168.1.74.58234 > 192.168.1.45.5005: Flags [P.], seq 77485:78197, ack 3, win 1004, options [nop,nop,TS val 3247177803 ecr 2039870482], length 712
00:12:18.657329 IP 192.168.1.74.58234 > 192.168.1.45.5005: Flags [.], seq 78197:79645, ack 3, win 1004, options [nop,nop,TS val 3247177803 ecr 2039870482], length 1448
00:12:18.673003 IP 192.168.1.74.58234 > 192.168.1.45.5005: Flags [.], seq 78197:79645, ack 3, win 1004, options [nop,nop,TS val 3247177819 ecr 2039870482], length 1448
00:12:18.699736 IP 192.168.1.45.5005 > 192.168.1.74.58234: Flags [.], ack 79645, win 176, options [nop,nop,TS val 2039870525 ecr 3247177803,nop,nop,sack 1 {78197:79645}], length 0
00:12:18.700762 IP 192.168.1.74.58234 > 192.168.1.45.5005: Flags [P.], seq 79645:90909, ack 3, win 1004, options [nop,nop,TS val 3247177847 ecr 2039870525], length 11264
00:12:18.724812 IP 192.168.1.74.58234 > 192.168.1.45.5005: Flags [.], seq 89781:90909, ack 3, win 1004, options [nop,nop,TS val 3247177871 ecr 2039870525], length 1128
00:12:18.743640 IP 192.168.1.45.5005 > 192.168.1.74.58234: Flags [.], ack 90909, win 0, options [nop,nop,TS val 2039870569 ecr 3247177847,nop,nop,sack 1 {89781:90909}], length 0
00:12:18.960869 IP 192.168.1.74.58234 > 192.168.1.45.5005: Flags [.], ack 3, win 1004, options [nop,nop,TS val 3247178107 ecr 2039870569], length 0
00:12:18.960898 IP 192.168.1.45.5005 > 192.168.1.74.58234: Flags [.], ack 90909, win 0, options [nop,nop,TS val 2039870786 ecr 3247177847], length 0
00:12:19.416967 IP 192.168.1.74.58234 > 192.168.1.45.5005: Flags [.], ack 3, win 1004, options [nop,nop,TS val 3247178563 ecr 2039870786], length 0
00:12:20.312683 IP 192.168.1.74.58234 > 192.168.1.45.5005: Flags [.], ack 3, win 1004, options [nop,nop,TS val 3247179459 ecr 2039870786], length 0
00:12:20.312710 IP 192.168.1.45.5005 > 192.168.1.74.58234: Flags [.], ack 90909, win 0, options [nop,nop,TS val 2039872138 ecr 3247177847], length 0
00:12:22.072547 IP 192.168.1.74.58234 > 192.168.1.45.5005: Flags [.], ack 3, win 1004, options [nop,nop,TS val 3247181219 ecr 2039872138], length 0
00:12:22.072568 IP 192.168.1.45.5005 > 192.168.1.74.58234: Flags [.], ack 90909, win 0, options [nop,nop,TS val 2039873898 ecr 3247177847], length 0
00:12:25.688738 IP 192.168.1.74.58234 > 192.168.1.45.5005: Flags [.], ack 3, win 1004, options [nop,nop,TS val 3247184835 ecr 2039873898], length 0
00:12:25.688766 IP 192.168.1.45.5005 > 192.168.1.74.58234: Flags [.], ack 90909, win 0, options [nop,nop,TS val 2039877514 ecr 3247177847], length 0
00:12:32.856647 IP 192.168.1.74.58234 > 192.168.1.45.5005: Flags [.], ack 3, win 1004, options [nop,nop,TS val 3247192003 ecr 2039877514], length 0
00:12:32.856673 IP 192.168.1.45.5005 > 192.168.1.74.58234: Flags [.], ack 90909, win 0, options [nop,nop,TS val 2039884682 ecr 3247177847], length 0
00:12:33.613518 IP 192.168.1.45.5005 > 192.168.1.74.58234: Flags [.], ack 90909, win 1002, options [nop,nop,TS val 2039885439 ecr 3247177847], length 0
00:12:33.614081 IP 192.168.1.74.58234 > 192.168.1.45.5005: Flags [P.], seq 90909:98149, ack 3, win 1004, options [nop,nop,TS val 3247192760 ecr 2039885439], length 7240
00:12:33.614081 IP 192.168.1.74.58234 > 192.168.1.45.5005: Flags [P.], seq 98149:105389, ack 3, win 1004, options [nop,nop,TS val 3247192760 ecr 2039885439], length 7240
00:12:33.614119 IP 192.168.1.45.5005 > 192.168.1.74.58234: Flags [.], ack 98149, win 1228, options [nop,nop,TS val 2039885439 ecr 3247192760], length 0
00:12:33.614142 IP 192.168.1.45.5005 > 192.168.1.74.58234: Flags [.], ack 105389, win 1454, options [nop,nop,TS val 2039885439 ecr 3247192760], length 0
00:12:33.614742 IP 192.168.1.74.58234 > 192.168.1.45.5005: Flags [P.], seq 105389:108285, ack 3, win 1004, options [nop,nop,TS val 3247192761 ecr 2039885439], length 2896
00:12:33.614742 IP 192.168.1.74.58234 > 192.168.1.45.5005: Flags [P.], seq 108285:110053, ack 3, win 1004, options [nop,nop,TS val 3247192761 ecr 2039885439], length 1768
00:12:33.614742 IP 192.168.1.74.58234 > 192.168.1.45.5005: Flags [P.], seq 110053:112949, ack 3, win 1004, options [nop,nop,TS val 3247192761 ecr 2039885439], length 2896
00:12:33.614753 IP 192.168.1.45.5005 > 192.168.1.74.58234: Flags [.], ack 108285, win 1545, options [nop,nop,TS val 2039885440 ecr 3247192761], length 0
00:12:33.614775 IP 192.168.1.45.5005 > 192.168.1.74.58234: Flags [.], ack 110053, win 1600, options [nop,nop,TS val 2039885440 ecr 3247192761], length 0
00:12:33.614788 IP 192.168.1.45.5005 > 192.168.1.74.58234: Flags [.], ack 112949, win 1690, options [nop,nop,TS val 2039885440 ecr 3247192761], length 0
00:12:33.614899 IP 192.168.1.74.58234 > 192.168.1.45.5005: Flags [P.], seq 112949:115845, ack 3, win 1004, options [nop,nop,TS val 3247192761 ecr 2039885439], length 2896
00:12:33.614904 IP 192.168.1.45.5005 > 192.168.1.74.58234: Flags [.], ack 115845, win 1781, options [nop,nop,TS val 2039885440 ecr 3247192761], length 0
00:12:33.615060 IP 192.168.1.74.58234 > 192.168.1.45.5005: Flags [P.], seq 115845:120189, ack 3, win 1004, options [nop,nop,TS val 3247192761 ecr 2039885439], length 4344
00:12:33.615060 IP 192.168.1.74.58234 > 192.168.1.45.5005: Flags [P.], seq 120189:124533, ack 3, win 1004, options [nop,nop,TS val 3247192761 ecr 2039885439], length 4344
00:12:33.615060 IP 192.168.1.74.58234 > 192.168.1.45.5005: Flags [P.], seq 124533:128877, ack 3, win 1004, options [nop,nop,TS val 3247192761 ecr 2039885440], length 4344
00:12:33.615070 IP 192.168.1.45.5005 > 192.168.1.74.58234: Flags [.], ack 120189, win 1917, options [nop,nop,TS val 2039885440 ecr 3247192761], length 0
00:12:33.615087 IP 192.168.1.45.5005 > 192.168.1.74.58234: Flags [.], ack 124533, win 2052, options [nop,nop,TS val 2039885440 ecr 3247192761], length 0
00:12:33.615097 IP 192.168.1.45.5005 > 192.168.1.74.58234: Flags [.], ack 128877, win 2188, options [nop,nop,TS val 2039885440 ecr 3247192761], length 0
00:12:33.615122 IP 192.168.1.74.58234 > 192.168.1.45.5005: Flags [P.], seq 128877:134669, ack 3, win 1004, options [nop,nop,TS val 3247192761 ecr 2039885440], length 5792
00:12:33.615128 IP 192.168.1.45.5005 > 192.168.1.74.58234: Flags [.], ack 134669, win 2369, options [nop,nop,TS val 2039885440 ecr 3247192761], length 0
00:12:33.615373 IP 192.168.1.74.58234 > 192.168.1.45.5005: Flags [P.], seq 134669:139013, ack 3, win 1004, options [nop,nop,TS val 3247192762 ecr 2039885440], length 4344
00:12:33.615373 IP 192.168.1.74.58234 > 192.168.1.45.5005: Flags [P.], seq 139013:141909, ack 3, win 1004, options [nop,nop,TS val 3247192762 ecr 2039885440], length 2896
00:12:33.615373 IP 192.168.1.74.58234 > 192.168.1.45.5005: Flags [.], seq 141909:144805, ack 3, win 1004, options [nop,nop,TS val 3247192762 ecr 2039885440], length 2896
00:12:33.615382 IP 192.168.1.45.5005 > 192.168.1.74.58234: Flags [.], ack 139013, win 2505, options [nop,nop,TS val 2039885440 ecr 3247192762], length 0
00:12:33.615403 IP 192.168.1.45.5005 > 192.168.1.74.58234: Flags [.], ack 141909, win 2595, options [nop,nop,TS val 2039885440 ecr 3247192762], length 0
00:12:33.615414 IP 192.168.1.45.5005 > 192.168.1.74.58234: Flags [.], ack 144805, win 2686, options [nop,nop,TS val 2039885440 ecr 3247192762], length 0
00:12:33.615545 IP 192.168.1.74.58234 > 192.168.1.45.5005: Flags [P.], seq 144805:153493, ack 3, win 1004, options [nop,nop,TS val 3247192762 ecr 2039885440], length 8688
00:12:33.615545 IP 192.168.1.74.58234 > 192.168.1.45.5005: Flags [P.], seq 153493:156389, ack 3, win 1004, options [nop,nop,TS val 3247192762 ecr 2039885440], length 2896
00:12:33.615553 IP 192.168.1.45.5005 > 192.168.1.74.58234: Flags [.], ack 153493, win 2957, options [nop,nop,TS val 2039885441 ecr 3247192762], length 0
00:12:33.615572 IP 192.168.1.45.5005 > 192.168.1.74.58234: Flags [.], ack 156389, win 3048, options [nop,nop,TS val 2039885441 ecr 3247192762], length 0
00:12:33.615611 IP 192.168.1.74.58234 > 192.168.1.45.5005: Flags [P.], seq 156389:165077, ack 3, win 1004, options [nop,nop,TS val 3247192762 ecr 2039885440], length 8688
00:12:33.615611 IP 192.168.1.74.58234 > 192.168.1.45.5005: Flags [P.], seq 165077:173765, ack 3, win 1004, options [nop,nop,TS val 3247192762 ecr 2039885440], length 8688
00:12:33.615619 IP 192.168.1.45.5005 > 192.168.1.74.58234: Flags [.], ack 165077, win 3319, options [nop,nop,TS val 2039885441 ecr 3247192762], length 0
00:12:33.615634 IP 192.168.1.45.5005 > 192.168.1.74.58234: Flags [.], ack 173765, win 3591, options [nop,nop,TS val 2039885441 ecr 3247192762], length 0
00:12:33.615683 IP 192.168.1.74.58234 > 192.168.1.45.5005: Flags [P.], seq 173765:194037, ack 3, win 1004, options [nop,nop,TS val 3247192762 ecr 2039885440], length 20272
00:12:33.615693 IP 192.168.1.45.5005 > 192.168.1.74.58234: Flags [.], ack 194037, win 4224, options [nop,nop,TS val 2039885441 ecr 3247192762], length 0
00:12:33.615711 IP 192.168.1.74.58234 > 192.168.1.45.5005: Flags [P.], seq 194037:202725, ack 3, win 1004, options [nop,nop,TS val 3247192762 ecr 2039885440], length 8688
00:12:33.615711 IP 192.168.1.74.58234 > 192.168.1.45.5005: Flags [P.], seq 202725:205621, ack 3, win 1004, options [nop,nop,TS val 3247192762 ecr 2039885440], length 2896
00:12:33.615719 IP 192.168.1.45.5005 > 192.168.1.74.58234: Flags [.], ack 202725, win 4496, options [nop,nop,TS val 2039885441 ecr 3247192762], length 0
00:12:33.615737 IP 192.168.1.45.5005 > 192.168.1.74.58234: Flags [.], ack 205621, win 4586, options [nop,nop,TS val 2039885441 ecr 3247192762], length 0
00:12:33.615775 IP 192.168.1.74.58234 > 192.168.1.45.5005: Flags [P.], seq 205621:208517, ack 3, win 1004, options [nop,nop,TS val 3247192762 ecr 2039885440], length 2896
00:12:33.615775 IP 192.168.1.74.58234 > 192.168.1.45.5005: Flags [.], seq 208517:211413, ack 3, win 1004, options [nop,nop,TS val 3247192762 ecr 2039885440], length 2896
00:12:33.615782 IP 192.168.1.45.5005 > 192.168.1.74.58234: Flags [.], ack 208517, win 4677, options [nop,nop,TS val 2039885441 ecr 3247192762], length 0
00:12:33.615796 IP 192.168.1.45.5005 > 192.168.1.74.58234: Flags [.], ack 211413, win 4767, options [nop,nop,TS val 2039885441 ecr 3247192762], length 0
00:12:33.615905 IP 192.168.1.74.58234 > 192.168.1.45.5005: Flags [P.], seq 211413:214309, ack 3, win 1004, options [nop,nop,TS val 3247192762 ecr 2039885440], length 2896
00:12:33.615906 IP 192.168.1.74.58234 > 192.168.1.45.5005: Flags [P.], seq 214309:231685, ack 3, win 1004, options [nop,nop,TS val 3247192762 ecr 2039885441], length 17376
00:12:33.615915 IP 192.168.1.45.5005 > 192.168.1.74.58234: Flags [.], ack 214309, win 4858, options [nop,nop,TS val 2039885441 ecr 3247192762], length 0
00:12:33.615932 IP 192.168.1.45.5005 > 192.168.1.74.58234: Flags [.], ack 231685, win 5401, options [nop,nop,TS val 2039885441 ecr 3247192762], length 0
00:12:33.616008 IP 192.168.1.74.58234 > 192.168.1.45.5005: Flags [P.], seq 231685:237477, ack 3, win 1004, options [nop,nop,TS val 3247192762 ecr 2039885441], length 5792
00:12:33.616008 IP 192.168.1.74.58234 > 192.168.1.45.5005: Flags [.], seq 237477:246165, ack 3, win 1004, options [nop,nop,TS val 3247192762 ecr 2039885441], length 8688
00:12:33.616017 IP 192.168.1.45.5005 > 192.168.1.74.58234: Flags [.], ack 237477, win 5582, options [nop,nop,TS val 2039885441 ecr 3247192762], length 0
00:12:33.616034 IP 192.168.1.45.5005 > 192.168.1.74.58234: Flags [.], ack 246165, win 5853, options [nop,nop,TS val 2039885441 ecr 3247192762], length 0
00:12:33.616159 IP 192.168.1.74.58234 > 192.168.1.45.5005: Flags [P.], seq 246165:254853, ack 3, win 1004, options [nop,nop,TS val 3247192762 ecr 2039885441], length 8688
00:12:33.616159 IP 192.168.1.74.58234 > 192.168.1.45.5005: Flags [.], seq 254853:267885, ack 3, win 1004, options [nop,nop,TS val 3247192762 ecr 2039885441], length 13032
00:12:33.616168 IP 192.168.1.45.5005 > 192.168.1.74.58234: Flags [.], ack 254853, win 6125, options [nop,nop,TS val 2039885441 ecr 3247192762], length 0
00:12:33.616185 IP 192.168.1.45.5005 > 192.168.1.74.58234: Flags [.], ack 267885, win 6532, options [nop,nop,TS val 2039885441 ecr 3247192762], length 0
00:12:33.616302 IP 192.168.1.74.58234 > 192.168.1.45.5005: Flags [P.], seq 267885:269333, ack 3, win 1004, options [nop,nop,TS val 3247192762 ecr 2039885441], length 1448
00:12:33.616302 IP 192.168.1.74.58234 > 192.168.1.45.5005: Flags [P.], seq 269333:272229, ack 3, win 1004, options [nop,nop,TS val 3247192762 ecr 2039885441], length 2896
00:12:33.616302 IP 192.168.1.74.58234 > 192.168.1.45.5005: Flags [.], seq 272229:289605, ack 3, win 1004, options [nop,nop,TS val 3247192762 ecr 2039885441], length 17376
00:12:33.616314 IP 192.168.1.45.5005 > 192.168.1.74.58234: Flags [.], ack 269333, win 6577, options [nop,nop,TS val 2039885441 ecr 3247192762], length 0
00:12:33.616327 IP 192.168.1.45.5005 > 192.168.1.74.58234: Flags [.], ack 272229, win 6668, options [nop,nop,TS val 2039885441 ecr 3247192762], length 0
00:12:33.616340 IP 192.168.1.45.5005 > 192.168.1.74.58234: Flags [.], ack 289605, win 7211, options [nop,nop,TS val 2039885441 ecr 3247192762], length 0
00:12:33.616433 IP 192.168.1.74.58234 > 192.168.1.45.5005: Flags [P.], seq 289605:301189, ack 3, win 1004, options [nop,nop,TS val 3247192762 ecr 2039885441], length 11584
00:12:33.616440 IP 192.168.1.45.5005 > 192.168.1.74.58234: Flags [.], ack 301189, win 7573, options [nop,nop,TS val 2039885441 ecr 3247192762], length 0
00:12:33.616458 IP 192.168.1.74.58234 > 192.168.1.45.5005: Flags [P.], seq 301189:312773, ack 3, win 1004, options [nop,nop,TS val 3247192762 ecr 2039885441], length 11584
00:12:33.616465 IP 192.168.1.45.5005 > 192.168.1.74.58234: Flags [.], ack 312773, win 7935, options [nop,nop,TS val 2039885442 ecr 3247192762], length 0
00:12:33.616520 IP 192.168.1.74.58234 > 192.168.1.45.5005: Flags [.], seq 312773:325805, ack 3, win 1004, options [nop,nop,TS val 3247192762 ecr 2039885441], length 13032
00:12:33.616527 IP 192.168.1.45.5005 > 192.168.1.74.58234: Flags [.], ack 325805, win 8342, options [nop,nop,TS val 2039885442 ecr 3247192762], length 0
00:12:33.616612 IP 192.168.1.74.58234 > 192.168.1.45.5005: Flags [P.], seq 325805:330149, ack 3, win 1004, options [nop,nop,TS val 3247192762 ecr 2039885441], length 4344
00:12:33.616612 IP 192.168.1.74.58234 > 192.168.1.45.5005: Flags [P.], seq 330149:333045, ack 3, win 1004, options [nop,nop,TS val 3247192762 ecr 2039885441], length 2896
00:12:33.616612 IP 192.168.1.74.58234 > 192.168.1.45.5005: Flags [P.], seq 333045:335941, ack 3, win 1004, options [nop,nop,TS val 3247192762 ecr 2039885441], length 2896
00:12:33.616612 IP 192.168.1.74.58234 > 192.168.1.45.5005: Flags [P.], seq 335941:341733, ack 3, win 1004, options [nop,nop,TS val 3247192762 ecr 2039885441], length 5792
00:12:33.616622 IP 192.168.1.45.5005 > 192.168.1.74.58234: Flags [.], ack 330149, win 8478, options [nop,nop,TS val 2039885442 ecr 3247192762], length 0
00:12:33.616637 IP 192.168.1.45.5005 > 192.168.1.74.58234: Flags [.], ack 333045, win 8568, options [nop,nop,TS val 2039885442 ecr 3247192762], length 0
00:12:33.616661 IP 192.168.1.45.5005 > 192.168.1.74.58234: Flags [.], ack 335941, win 8659, options [nop,nop,TS val 2039885442 ecr 3247192762], length 0
00:12:33.616681 IP 192.168.1.45.5005 > 192.168.1.74.58234: Flags [.], ack 341733, win 8840, options [nop,nop,TS val 2039885442 ecr 3247192762], length 0
00:12:33.616737 IP 192.168.1.74.58234 > 192.168.1.45.5005: Flags [P.], seq 341733:347525, ack 3, win 1004, options [nop,nop,TS val 3247192763 ecr 2039885441], length 5792
00:12:33.616737 IP 192.168.1.74.58234 > 192.168.1.45.5005: Flags [.], seq 347525:362005, ack 3, win 1004, options [nop,nop,TS val 3247192763 ecr 2039885441], length 14480
00:12:33.616746 IP 192.168.1.45.5005 > 192.168.1.74.58234: Flags [.], ack 347525, win 9021, options [nop,nop,TS val 2039885442 ecr 3247192763], length 0
00:12:33.616765 IP 192.168.1.45.5005 > 192.168.1.74.58234: Flags [.], ack 362005, win 9473, options [nop,nop,TS val 2039885442 ecr 3247192763], length 0
00:12:33.616906 IP 192.168.1.74.58234 > 192.168.1.45.5005: Flags [P.], seq 362005:364901, ack 3, win 1004, options [nop,nop,TS val 3247192763 ecr 2039885441], length 2896
00:12:33.616906 IP 192.168.1.74.58234 > 192.168.1.45.5005: Flags [.], seq 364901:383725, ack 3, win 1004, options [nop,nop,TS val 3247192763 ecr 2039885441], length 18824
00:12:33.616916 IP 192.168.1.45.5005 > 192.168.1.74.58234: Flags [.], ack 364901, win 9564, options [nop,nop,TS val 2039885442 ecr 3247192763], length 0
00:12:33.616933 IP 192.168.1.45.5005 > 192.168.1.74.58234: Flags [.], ack 383725, win 10152, options [nop,nop,TS val 2039885442 ecr 3247192763], length 0
00:12:33.617037 IP 192.168.1.74.58234 > 192.168.1.45.5005: Flags [P.], seq 383725:396757, ack 3, win 1004, options [nop,nop,TS val 3247192763 ecr 2039885441], length 13032
00:12:33.617045 IP 192.168.1.45.5005 > 192.168.1.74.58234: Flags [.], ack 396757, win 10559, options [nop,nop,TS val 2039885442 ecr 3247192763], length 0
00:12:33.617105 IP 192.168.1.74.58234 > 192.168.1.45.5005: Flags [.], seq 396757:414133, ack 3, win 1004, options [nop,nop,TS val 3247192763 ecr 2039885441], length 17376
00:12:33.617113 IP 192.168.1.45.5005 > 192.168.1.74.58234: Flags [.], ack 414133, win 11102, options [nop,nop,TS val 2039885442 ecr 3247192763], length 0
00:12:33.617201 IP 192.168.1.74.58234 > 192.168.1.45.5005: Flags [P.], seq 414133:428613, ack 3, win 1004, options [nop,nop,TS val 3247192763 ecr 2039885441], length 14480
00:12:33.617208 IP 192.168.1.45.5005 > 192.168.1.74.58234: Flags [.], ack 428613, win 11555, options [nop,nop,TS val 2039885442 ecr 3247192763], length 0
00:12:33.617258 IP 192.168.1.74.58234 > 192.168.1.45.5005: Flags [.], seq 428613:440197, ack 3, win 1004, options [nop,nop,TS val 3247192763 ecr 2039885442], length 11584
00:12:33.617264 IP 192.168.1.45.5005 > 192.168.1.74.58234: Flags [.], ack 440197, win 11917, options [nop,nop,TS val 2039885442 ecr 3247192763], length 0
00:12:33.617363 IP 192.168.1.74.58234 > 192.168.1.45.5005: Flags [.], seq 440197:456125, ack 3, win 1004, options [nop,nop,TS val 3247192763 ecr 2039885442], length 15928
00:12:33.617371 IP 192.168.1.45.5005 > 192.168.1.74.58234: Flags [.], ack 456125, win 12415, options [nop,nop,TS val 2039885442 ecr 3247192763], length 0
00:12:33.617473 IP 192.168.1.74.58234 > 192.168.1.45.5005: Flags [P.], seq 456125:460469, ack 3, win 1004, options [nop,nop,TS val 3247192763 ecr 2039885442], length 4344
00:12:33.617473 IP 192.168.1.74.58234 > 192.168.1.45.5005: Flags [.], seq 460469:473501, ack 3, win 1004, options [nop,nop,TS val 3247192763 ecr 2039885442], length 13032
00:12:33.617482 IP 192.168.1.45.5005 > 192.168.1.74.58234: Flags [.], ack 460469, win 12550, options [nop,nop,TS val 2039885443 ecr 3247192763], length 0
00:12:33.617497 IP 192.168.1.45.5005 > 192.168.1.74.58234: Flags [.], ack 473501, win 12958, options [nop,nop,TS val 2039885443 ecr 3247192763], length 0
00:12:33.617597 IP 192.168.1.74.58234 > 192.168.1.45.5005: Flags [P.], seq 473501:492325, ack 3, win 1004, options [nop,nop,TS val 3247192763 ecr 2039885442], length 18824
00:12:33.617605 IP 192.168.1.45.5005 > 192.168.1.74.58234: Flags [.], ack 492325, win 13546, options [nop,nop,TS val 2039885443 ecr 3247192763], length 0
00:12:33.617660 IP 192.168.1.74.58234 > 192.168.1.45.5005: Flags [.], seq 492325:503909, ack 3, win 1004, options [nop,nop,TS val 3247192764 ecr 2039885442], length 11584
00:12:33.617666 IP 192.168.1.45.5005 > 192.168.1.74.58234: Flags [.], ack 503909, win 13908, options [nop,nop,TS val 2039885443 ecr 3247192764], length 0
00:12:33.617776 IP 192.168.1.74.58234 > 192.168.1.45.5005: Flags [.], seq 503909:521285, ack 3, win 1004, options [nop,nop,TS val 3247192764 ecr 2039885442], length 17376
00:12:33.617784 IP 192.168.1.45.5005 > 192.168.1.74.58234: Flags [.], ack 521285, win 13906, options [nop,nop,TS val 2039885443 ecr 3247192764], length 0
00:12:33.617884 IP 192.168.1.74.58234 > 192.168.1.45.5005: Flags [P.], seq 521285:524181, ack 3, win 1004, options [nop,nop,TS val 3247192764 ecr 2039885442], length 2896
00:12:33.617884 IP 192.168.1.74.58234 > 192.168.1.45.5005: Flags [.], seq 524181:540109, ack 3, win 1004, options [nop,nop,TS val 3247192764 ecr 2039885442], length 15928
00:12:33.617894 IP 192.168.1.45.5005 > 192.168.1.74.58234: Flags [.], ack 524181, win 13876, options [nop,nop,TS val 2039885443 ecr 3247192764], length 0
00:12:33.617909 IP 192.168.1.45.5005 > 192.168.1.74.58234: Flags [.], ack 540109, win 13709, options [nop,nop,TS val 2039885443 ecr 3247192764], length 0
00:12:33.618014 IP 192.168.1.74.58234 > 192.168.1.45.5005: Flags [P.], seq 540109:556037, ack 3, win 1004, options [nop,nop,TS val 3247192764 ecr 2039885442], length 15928
00:12:33.618023 IP 192.168.1.45.5005 > 192.168.1.74.58234: Flags [.], ack 556037, win 13542, options [nop,nop,TS val 2039885443 ecr 3247192764], length 0
00:12:33.618084 IP 192.168.1.74.58234 > 192.168.1.45.5005: Flags [.], seq 556037:570517, ack 3, win 1004, options [nop,nop,TS val 3247192764 ecr 2039885442], length 14480
00:12:33.618090 IP 192.168.1.45.5005 > 192.168.1.74.58234: Flags [.], ack 570517, win 13390, options [nop,nop,TS val 2039885443 ecr 3247192764], length 0
00:12:33.618172 IP 192.168.1.74.58234 > 192.168.1.45.5005: Flags [P.], seq 570517:587893, ack 3, win 1004, options [nop,nop,TS val 3247192764 ecr 2039885442], length 17376
00:12:33.618180 IP 192.168.1.45.5005 > 192.168.1.74.58234: Flags [.], ack 587893, win 13208, options [nop,nop,TS val 2039885443 ecr 3247192764], length 0
00:12:33.618216 IP 192.168.1.74.58234 > 192.168.1.45.5005: Flags [.], seq 587893:592237, ack 3, win 1004, options [nop,nop,TS val 3247192764 ecr 2039885443], length 4344
00:12:33.618220 IP 192.168.1.45.5005 > 192.168.1.74.58234: Flags [.], ack 592237, win 13163, options [nop,nop,TS val 2039885443 ecr 3247192764], length 0
00:12:33.618358 IP 192.168.1.74.58234 > 192.168.1.45.5005: Flags [P.], seq 592237:619749, ack 3, win 1004, options [nop,nop,TS val 3247192764 ecr 2039885443], length 27512
00:12:33.618376 IP 192.168.1.45.5005 > 192.168.1.74.58234: Flags [.], ack 619749, win 12874, options [nop,nop,TS val 2039885443 ecr 3247192764], length 0
00:12:33.618421 IP 192.168.1.74.58234 > 192.168.1.45.5005: Flags [.], seq 619749:629885, ack 3, win 1004, options [nop,nop,TS val 3247192764 ecr 2039885443], length 10136
00:12:33.618430 IP 192.168.1.45.5005 > 192.168.1.74.58234: Flags [.], ack 629885, win 12767, options [nop,nop,TS val 2039885443 ecr 3247192764], length 0
00:12:33.618593 IP 192.168.1.74.58234 > 192.168.1.45.5005: Flags [.], seq 629885:658845, ack 3, win 1004, options [nop,nop,TS val 3247192764 ecr 2039885443], length 28960
00:12:33.618610 IP 192.168.1.45.5005 > 192.168.1.74.58234: Flags [.], ack 658845, win 12463, options [nop,nop,TS val 2039885444 ecr 3247192764], length 0
00:12:33.618723 IP 192.168.1.74.58234 > 192.168.1.45.5005: Flags [P.], seq 658845:671877, ack 3, win 1004, options [nop,nop,TS val 3247192764 ecr 2039885443], length 13032
00:12:33.618734 IP 192.168.1.45.5005 > 192.168.1.74.58234: Flags [.], ack 671877, win 12326, options [nop,nop,TS val 2039885444 ecr 3247192764], length 0
00:12:33.618782 IP 192.168.1.74.58234 > 192.168.1.45.5005: Flags [P.], seq 671877:684909, ack 3, win 1004, options [nop,nop,TS val 3247192764 ecr 2039885443], length 13032
00:12:33.618792 IP 192.168.1.45.5005 > 192.168.1.74.58234: Flags [.], ack 684909, win 12191, options [nop,nop,TS val 2039885444 ecr 3247192764], length 0
00:12:33.618843 IP 192.168.1.74.58234 > 192.168.1.45.5005: Flags [.], seq 684909:703733, ack 3, win 1004, options [nop,nop,TS val 3247192765 ecr 2039885443], length 18824
00:12:33.618855 IP 192.168.1.45.5005 > 192.168.1.74.58234: Flags [.], ack 703733, win 11994, options [nop,nop,TS val 2039885444 ecr 3247192765], length 0
00:12:33.619053 IP 192.168.1.74.58234 > 192.168.1.45.5005: Flags [.], seq 703733:738485, ack 3, win 1004, options [nop,nop,TS val 3247192765 ecr 2039885443], length 34752
00:12:33.619069 IP 192.168.1.45.5005 > 192.168.1.74.58234: Flags [.], ack 738485, win 11630, options [nop,nop,TS val 2039885444 ecr 3247192765], length 0
00:12:33.619143 IP 192.168.1.74.58234 > 192.168.1.45.5005: Flags [P.], seq 738485:742829, ack 3, win 1004, options [nop,nop,TS val 3247192765 ecr 2039885443], length 4344
00:12:33.619143 IP 192.168.1.74.58234 > 192.168.1.45.5005: Flags [P.], seq 742829:750069, ack 3, win 1004, options [nop,nop,TS val 3247192765 ecr 2039885443], length 7240
00:12:33.619152 IP 192.168.1.45.5005 > 192.168.1.74.58234: Flags [.], ack 742829, win 11583, options [nop,nop,TS val 2039885444 ecr 3247192765], length 0
00:12:33.619169 IP 192.168.1.45.5005 > 192.168.1.74.58234: Flags [.], ack 750069, win 11508, options [nop,nop,TS val 2039885444 ecr 3247192765], length 0
00:12:33.619250 IP 192.168.1.74.58234 > 192.168.1.45.5005: Flags [.], seq 750069:771789, ack 3, win 1004, options [nop,nop,TS val 3247192765 ecr 2039885444], length 21720
00:12:33.619395 IP 192.168.1.74.58234 > 192.168.1.45.5005: Flags [.], seq 771789:797853, ack 3, win 1004, options [nop,nop,TS val 3247192765 ecr 2039885444], length 26064
00:12:33.620175 IP 192.168.1.45.5005 > 192.168.1.74.58234: Flags [.], ack 797853, win 13908, options [nop,nop,TS val 2039885445 ecr 3247192765], length 0
00:12:33.620309 IP 192.168.1.74.58234 > 192.168.1.45.5005: Flags [P.], seq 797853:815229, ack 3, win 1004, options [nop,nop,TS val 3247192765 ecr 2039885444], length 17376
00:12:33.620322 IP 192.168.1.45.5005 > 192.168.1.74.58234: Flags [.], ack 815229, win 14451, options [nop,nop,TS val 2039885445 ecr 3247192765], length 0
00:12:33.620420 IP 192.168.1.74.58234 > 192.168.1.45.5005: Flags [P.], seq 815229:880389, ack 3, win 1004, options [nop,nop,TS val 3247192766 ecr 2039885444], length 65160
00:12:33.620506 IP 192.168.1.45.5005 > 192.168.1.74.58234: Flags [.], ack 880389, win 16487, options [nop,nop,TS val 2039885446 ecr 3247192766], length 0
00:12:33.621385 IP 192.168.1.74.58234 > 192.168.1.45.5005: Flags [P.], seq 880389:945549, ack 3, win 1004, options [nop,nop,TS val 3247192767 ecr 2039885445], length 65160
00:12:33.621411 IP 192.168.1.45.5005 > 192.168.1.74.58234: Flags [.], ack 945549, win 18523, options [nop,nop,TS val 2039885446 ecr 3247192767], length 0
00:12:33.621484 IP 192.168.1.74.58234 > 192.168.1.45.5005: Flags [.], seq 945549:973061, ack 3, win 1004, options [nop,nop,TS val 3247192767 ecr 2039885446], length 27512
00:12:33.621498 IP 192.168.1.45.5005 > 192.168.1.74.58234: Flags [.], ack 973061, win 19383, options [nop,nop,TS val 2039885447 ecr 3247192767], length 0
00:12:33.622128 IP 192.168.1.74.58234 > 192.168.1.45.5005: Flags [P.], seq 973061:1010709, ack 3, win 1004, options [nop,nop,TS val 3247192767 ecr 2039885446], length 37648
00:12:33.622147 IP 192.168.1.45.5005 > 192.168.1.74.58234: Flags [.], ack 1010709, win 20560, options [nop,nop,TS val 2039885447 ecr 3247192767], length 0
00:12:33.622205 IP 192.168.1.74.58234 > 192.168.1.45.5005: Flags [P.], seq 1010709:1049805, ack 3, win 1004, options [nop,nop,TS val 3247192767 ecr 2039885446], length 39096
00:12:33.622217 IP 192.168.1.45.5005 > 192.168.1.74.58234: Flags [.], ack 1049805, win 21781, options [nop,nop,TS val 2039885447 ecr 3247192767], length 0
00:12:33.622253 IP 192.168.1.74.58234 > 192.168.1.45.5005: Flags [.], seq 1049805:1065733, ack 3, win 1004, options [nop,nop,TS val 3247192768 ecr 2039885446], length 15928
00:12:33.622263 IP 192.168.1.45.5005 > 192.168.1.74.58234: Flags [.], ack 1065733, win 22279, options [nop,nop,TS val 2039885447 ecr 3247192768], length 0
00:12:33.622614 IP 192.168.1.74.58234 > 192.168.1.45.5005: Flags [P.], seq 1065733:1075869, ack 3, win 1004, options [nop,nop,TS val 3247192768 ecr 2039885446], length 10136
00:12:33.622614 IP 192.168.1.74.58234 > 192.168.1.45.5005: Flags [P.], seq 1075869:1141029, ack 3, win 1004, options [nop,nop,TS val 3247192768 ecr 2039885447], length 65160
00:12:33.622624 IP 192.168.1.45.5005 > 192.168.1.74.58234: Flags [.], ack 1075869, win 22596, options [nop,nop,TS val 2039885448 ecr 3247192768], length 0
00:12:33.622630 IP 192.168.1.45.5005 > 192.168.1.74.58234: Flags [.], ack 1141029, win 24632, options [nop,nop,TS val 2039885448 ecr 3247192768], length 0
00:12:33.622643 IP 192.168.1.74.58234 > 192.168.1.45.5005: Flags [.], seq 1141029:1158405, ack 3, win 1004, options [nop,nop,TS val 3247192769 ecr 2039885447], length 17376
00:12:33.622646 IP 192.168.1.45.5005 > 192.168.1.74.58234: Flags [.], ack 1158405, win 25175, options [nop,nop,TS val 2039885448 ecr 3247192769], length 0
00:12:33.622872 IP 192.168.1.74.58234 > 192.168.1.45.5005: Flags [P.], seq 1158405:1206189, ack 3, win 1004, options [nop,nop,TS val 3247192769 ecr 2039885447], length 47784
00:12:33.622879 IP 192.168.1.45.5005 > 192.168.1.74.58234: Flags [.], ack 1206189, win 25845, options [nop,nop,TS val 2039885448 ecr 3247192769], length 0
00:12:33.622902 IP 192.168.1.74.58234 > 192.168.1.45.5005: Flags [.], seq 1206189:1251077, ack 3, win 1004, options [nop,nop,TS val 3247192769 ecr 2039885448], length 44888
00:12:33.623056 IP 192.168.1.45.5005 > 192.168.1.74.58234: Flags [.], ack 1251077, win 25845, options [nop,nop,TS val 2039885448 ecr 3247192769], length 0
00:12:33.623096 IP 192.168.1.74.58234 > 192.168.1.45.5005: Flags [P.], seq 1251077:1271349, ack 3, win 1004, options [nop,nop,TS val 3247192769 ecr 2039885448], length 20272
00:12:33.623101 IP 192.168.1.45.5005 > 192.168.1.74.58234: Flags [.], ack 1271349, win 26132, options [nop,nop,TS val 2039885448 ecr 3247192769], length 0
00:12:33.623130 IP 192.168.1.74.58234 > 192.168.1.45.5005: Flags [P.], seq 1271349:1323477, ack 3, win 1004, options [nop,nop,TS val 3247192769 ecr 2039885448], length 52128
00:12:33.623157 IP 192.168.1.74.58234 > 192.168.1.45.5005: Flags [P.], seq 1323477:1336509, ack 3, win 1004, options [nop,nop,TS val 3247192769 ecr 2039885448], length 13032
00:12:33.623165 IP 192.168.1.74.58234 > 192.168.1.45.5005: Flags [P.], seq 1336509:1340853, ack 3, win 1004, options [nop,nop,TS val 3247192769 ecr 2039885448], length 4344
00:12:33.623165 IP 192.168.1.74.58234 > 192.168.1.45.5005: Flags [.], seq 1340853:1343749, ack 3, win 1004, options [nop,nop,TS val 3247192769 ecr 2039885448], length 2896
00:12:33.623187 IP 192.168.1.45.5005 > 192.168.1.74.58234: Flags [.], ack 1343749, win 26132, options [nop,nop,TS val 2039885448 ecr 3247192769], length 0
00:12:33.623346 IP 192.168.1.74.58234 > 192.168.1.45.5005: Flags [P.], seq 1343749:1391533, ack 3, win 1004, options [nop,nop,TS val 3247192769 ecr 2039885448], length 47784
00:12:33.623369 IP 192.168.1.74.58234 > 192.168.1.45.5005: Flags [P.], seq 1391533:1401669, ack 3, win 1004, options [nop,nop,TS val 3247192770 ecr 2039885448], length 10136
00:12:33.623369 IP 192.168.1.74.58234 > 192.168.1.45.5005: Flags [.], seq 1401669:1436421, ack 3, win 1004, options [nop,nop,TS val 3247192770 ecr 2039885448], length 34752
00:12:33.623383 IP 192.168.1.74.58234 > 192.168.1.45.5005: Flags [P.], seq 1436421:1437869, ack 3, win 1004, options [nop,nop,TS val 3247192770 ecr 2039885448], length 1448
00:12:33.623383 IP 192.168.1.74.58234 > 192.168.1.45.5005: Flags [P.], seq 1437869:1466829, ack 3, win 1004, options [nop,nop,TS val 3247192770 ecr 2039885448], length 28960
00:12:33.623407 IP 192.168.1.74.58234 > 192.168.1.45.5005: Flags [.], seq 1466829:1529093, ack 3, win 1004, options [nop,nop,TS val 3247192770 ecr 2039885448], length 62264
00:12:33.623416 IP 192.168.1.74.58234 > 192.168.1.45.5005: Flags [P.], seq 1529093:1531989, ack 3, win 1004, options [nop,nop,TS val 3247192770 ecr 2039885448], length 2896
00:12:33.623416 IP 192.168.1.74.58234 > 192.168.1.45.5005: Flags [P.], seq 1531989:1536333, ack 3, win 1004, options [nop,nop,TS val 3247192770 ecr 2039885448], length 4344
00:12:33.623445 IP 192.168.1.45.5005 > 192.168.1.74.58234: Flags [.], ack 1536333, win 26132, options [nop,nop,TS val 2039885448 ecr 3247192769], length 0
00:12:33.623550 IP 192.168.1.74.58234 > 192.168.1.45.5005: Flags [.], seq 1536333:1555157, ack 3, win 1004, options [nop,nop,TS val 3247192770 ecr 2039885448], length 18824
00:12:33.623556 IP 192.168.1.45.5005 > 192.168.1.74.58234: Flags [.], ack 1555157, win 26147, options [nop,nop,TS val 2039885449 ecr 3247192770], length 0
00:12:33.623653 IP 192.168.1.74.58234 > 192.168.1.45.5005: Flags [P.], seq 1555157:1597149, ack 3, win 1004, options [nop,nop,TS val 3247192770 ecr 2039885448], length 41992
00:12:33.623703 IP 192.168.1.74.58234 > 192.168.1.45.5005: Flags [.], seq 1597149:1647829, ack 3, win 1004, options [nop,nop,TS val 3247192770 ecr 2039885448], length 50680
00:12:33.623712 IP 192.168.1.74.58234 > 192.168.1.45.5005: Flags [P.], seq 1647829:1662309, ack 3, win 1004, options [nop,nop,TS val 3247192770 ecr 2039885448], length 14480
00:12:33.623718 IP 192.168.1.74.58234 > 192.168.1.45.5005: Flags [.], seq 1662309:1663757, ack 3, win 1004, options [nop,nop,TS val 3247192770 ecr 2039885448], length 1448
00:12:33.623753 IP 192.168.1.74.58234 > 192.168.1.45.5005: Flags [.], seq 1663757:1682581, ack 3, win 1004, options [nop,nop,TS val 3247192770 ecr 2039885448], length 18824
00:12:33.623781 IP 192.168.1.74.58234 > 192.168.1.45.5005: Flags [.], seq 1682581:1698509, ack 3, win 1004, options [nop,nop,TS val 3247192770 ecr 2039885448], length 15928
00:12:33.623807 IP 192.168.1.74.58234 > 192.168.1.45.5005: Flags [.], seq 1698509:1712989, ack 3, win 1004, options [nop,nop,TS val 3247192770 ecr 2039885448], length 14480
00:12:33.623828 IP 192.168.1.74.58234 > 192.168.1.45.5005: Flags [P.], seq 1712989:1727469, ack 3, win 1004, options [nop,nop,TS val 3247192770 ecr 2039885448], length 14480
00:12:33.623835 IP 192.168.1.74.58234 > 192.168.1.45.5005: Flags [.], seq 1727469:1728917, ack 3, win 1004, options [nop,nop,TS val 3247192770 ecr 2039885448], length 1448
00:12:33.623861 IP 192.168.1.74.58234 > 192.168.1.45.5005: Flags [P.], seq 1728917:1737605, ack 3, win 1004, options [nop,nop,TS val 3247192770 ecr 2039885448], length 8688
00:12:33.623861 IP 192.168.1.74.58234 > 192.168.1.45.5005: Flags [.], seq 1737605:1743397, ack 3, win 1004, options [nop,nop,TS val 3247192770 ecr 2039885449], length 5792
00:12:33.623887 IP 192.168.1.74.58234 > 192.168.1.45.5005: Flags [.], seq 1743397:1756429, ack 3, win 1004, options [nop,nop,TS val 3247192770 ecr 2039885449], length 13032
00:12:33.623917 IP 192.168.1.45.5005 > 192.168.1.74.58234: Flags [.], ack 1756429, win 26147, options [nop,nop,TS val 2039885449 ecr 3247192770], length 0
00:12:33.623968 IP 192.168.1.74.58234 > 192.168.1.45.5005: Flags [P.], seq 1756429:1757877, ack 3, win 1004, options [nop,nop,TS val 3247192770 ecr 2039885449], length 1448
00:12:33.623970 IP 192.168.1.45.5005 > 192.168.1.74.58234: Flags [.], ack 1757877, win 26192, options [nop,nop,TS val 2039885449 ecr 3247192770], length 0
00:12:33.624090 IP 192.168.1.74.58234 > 192.168.1.45.5005: Flags [.], seq 1757877:1766565, ack 3, win 1004, options [nop,nop,TS val 3247192770 ecr 2039885449], length 8688
00:12:33.624094 IP 192.168.1.45.5005 > 192.168.1.74.58234: Flags [.], ack 1766565, win 26252, options [nop,nop,TS val 2039885449 ecr 3247192770], length 0
00:12:33.624147 IP 192.168.1.74.58234 > 192.168.1.45.5005: Flags [P.], seq 1766565:1792629, ack 3, win 1004, options [nop,nop,TS val 3247192770 ecr 2039885449], length 26064
00:12:33.624162 IP 192.168.1.74.58234 > 192.168.1.45.5005: Flags [.], seq 1792629:1811453, ack 3, win 1004, options [nop,nop,TS val 3247192770 ecr 2039885449], length 18824
00:12:33.624196 IP 192.168.1.74.58234 > 192.168.1.45.5005: Flags [.], seq 1811453:1831725, ack 3, win 1004, options [nop,nop,TS val 3247192770 ecr 2039885449], length 20272
00:12:33.624236 IP 192.168.1.45.5005 > 192.168.1.74.58234: Flags [.], ack 1831725, win 26252, options [nop,nop,TS val 2039885449 ecr 3247192770], length 0
00:12:33.624325 IP 192.168.1.74.58234 > 192.168.1.45.5005: Flags [P.], seq 1831725:1857789, ack 3, win 1004, options [nop,nop,TS val 3247192770 ecr 2039885449], length 26064
00:12:33.624349 IP 192.168.1.74.58234 > 192.168.1.45.5005: Flags [P.], seq 1857789:1922949, ack 3, win 1004, options [nop,nop,TS val 3247192770 ecr 2039885449], length 65160
00:12:33.624360 IP 192.168.1.74.58234 > 192.168.1.45.5005: Flags [.], seq 1922949:1924397, ack 3, win 1004, options [nop,nop,TS val 3247192770 ecr 2039885449], length 1448
00:12:33.624369 IP 192.168.1.74.58234 > 192.168.1.45.5005: Flags [.], seq 1924397:1943221, ack 3, win 1004, options [nop,nop,TS val 3247192770 ecr 2039885449], length 18824
00:12:33.624395 IP 192.168.1.74.58234 > 192.168.1.45.5005: Flags [.], seq 1943221:1959149, ack 3, win 1004, options [nop,nop,TS val 3247192770 ecr 2039885449], length 15928
00:12:33.624417 IP 192.168.1.74.58234 > 192.168.1.45.5005: Flags [P.], seq 1959149:1970733, ack 3, win 1004, options [nop,nop,TS val 3247192770 ecr 2039885449], length 11584
00:12:33.624425 IP 192.168.1.74.58234 > 192.168.1.45.5005: Flags [.], seq 1970733:1975077, ack 3, win 1004, options [nop,nop,TS val 3247192771 ecr 2039885449], length 4344
00:12:33.624446 IP 192.168.1.74.58234 > 192.168.1.45.5005: Flags [P.], seq 1975077:1979421, ack 3, win 1004, options [nop,nop,TS val 3247192771 ecr 2039885449], length 4344
00:12:33.624446 IP 192.168.1.74.58234 > 192.168.1.45.5005: Flags [P.], seq 1979421:1988109, ack 3, win 1004, options [nop,nop,TS val 3247192771 ecr 2039885449], length 8688
00:12:33.624453 IP 192.168.1.74.58234 > 192.168.1.45.5005: Flags [.], seq 1988109:1991005, ack 3, win 1004, options [nop,nop,TS val 3247192771 ecr 2039885449], length 2896
00:12:33.624478 IP 192.168.1.74.58234 > 192.168.1.45.5005: Flags [.], seq 1991005:2005485, ack 3, win 1004, options [nop,nop,TS val 3247192771 ecr 2039885449], length 14480
00:12:33.624503 IP 192.168.1.74.58234 > 192.168.1.45.5005: Flags [.], seq 2005485:2018517, ack 3, win 1004, options [nop,nop,TS val 3247192771 ecr 2039885449], length 13032
00:12:33.624526 IP 192.168.1.74.58234 > 192.168.1.45.5005: Flags [.], seq 2018517:2032997, ack 3, win 1004, options [nop,nop,TS val 3247192771 ecr 2039885449], length 14480
00:12:33.624551 IP 192.168.1.74.58234 > 192.168.1.45.5005: Flags [.], seq 2032997:2046029, ack 3, win 1004, options [nop,nop,TS val 3247192771 ecr 2039885449], length 13032
00:12:33.624584 IP 192.168.1.45.5005 > 192.168.1.74.58234: Flags [.], ack 2046029, win 26252, options [nop,nop,TS val 2039885450 ecr 3247192770], length 0
00:12:33.624625 IP 192.168.1.74.58234 > 192.168.1.45.5005: Flags [P.], seq 2046029:2047477, ack 3, win 1004, options [nop,nop,TS val 3247192771 ecr 2039885449], length 1448
00:12:33.624627 IP 192.168.1.45.5005 > 192.168.1.74.58234: Flags [.], ack 2047477, win 26297, options [nop,nop,TS val 2039885450 ecr 3247192771], length 0
00:12:33.624734 IP 192.168.1.74.58234 > 192.168.1.45.5005: Flags [P.], seq 2047477:2053269, ack 3, win 1004, options [nop,nop,TS val 3247192771 ecr 2039885450], length 5792
00:12:33.624734 IP 192.168.1.74.58234 > 192.168.1.45.5005: Flags [.], seq 2053269:2059061, ack 3, win 1004, options [nop,nop,TS val 3247192771 ecr 2039885450], length 5792
00:12:33.624788 IP 192.168.1.74.58234 > 192.168.1.45.5005: Flags [.], seq 2059061:2089469, ack 3, win 1004, options [nop,nop,TS val 3247192771 ecr 2039885450], length 30408
00:12:33.624843 IP 192.168.1.74.58234 > 192.168.1.45.5005: Flags [P.], seq 2089469:2118429, ack 3, win 1004, options [nop,nop,TS val 3247192771 ecr 2039885450], length 28960
00:12:33.624876 IP 192.168.1.74.58234 > 192.168.1.45.5005: Flags [.], seq 2118429:2144493, ack 3, win 1004, options [nop,nop,TS val 3247192771 ecr 2039885450], length 26064
00:12:33.624941 IP 192.168.1.74.58234 > 192.168.1.45.5005: Flags [P.], seq 2144493:2183589, ack 3, win 1004, options [nop,nop,TS val 3247192771 ecr 2039885450], length 39096
00:12:33.624986 IP 192.168.1.74.58234 > 192.168.1.45.5005: Flags [.], seq 2183589:2209653, ack 3, win 1004, options [nop,nop,TS val 3247192771 ecr 2039885450], length 26064
00:12:33.625048 IP 192.168.1.74.58234 > 192.168.1.45.5005: Flags [P.], seq 2209653:2248749, ack 3, win 1004, options [nop,nop,TS val 3247192771 ecr 2039885450], length 39096
00:12:33.625086 IP 192.168.1.74.58234 > 192.168.1.45.5005: Flags [.], seq 2248749:2270469, ack 3, win 1004, options [nop,nop,TS val 3247192771 ecr 2039885450], length 21720
00:12:33.625252 IP 192.168.1.74.58234 > 192.168.1.45.5005: Flags [P.], seq 2270469:2274813, ack 3, win 1004, options [nop,nop,TS val 3247192771 ecr 2039885450], length 4344
00:12:33.625416 IP 192.168.1.45.5005 > 192.168.1.74.58234: Flags [.], ack 2274813, win 26297, options [nop,nop,TS val 2039885450 ecr 3247192771], length 0
00:12:33.625516 IP 192.168.1.74.58234 > 192.168.1.45.5005: Flags [.], seq 2274813:2287845, ack 3, win 1004, options [nop,nop,TS val 3247192772 ecr 2039885450], length 13032
00:12:33.625554 IP 192.168.1.45.5005 > 192.168.1.74.58234: Flags [.], ack 2287845, win 26297, options [nop,nop,TS val 2039885451 ecr 3247192772], length 0
00:12:33.625579 IP 192.168.1.74.58234 > 192.168.1.45.5005: Flags [P.], seq 2287845:2313909, ack 3, win 1004, options [nop,nop,TS val 3247192772 ecr 2039885450], length 26064
00:12:33.625604 IP 192.168.1.74.58234 > 192.168.1.45.5005: Flags [.], seq 2313909:2342869, ack 3, win 1004, options [nop,nop,TS val 3247192772 ecr 2039885450], length 28960
00:12:33.625654 IP 192.168.1.74.58234 > 192.168.1.45.5005: Flags [.], seq 2342869:2371829, ack 3, win 1004, options [nop,nop,TS val 3247192772 ecr 2039885450], length 28960
00:12:33.625706 IP 192.168.1.74.58234 > 192.168.1.45.5005: Flags [P.], seq 2371829:2379069, ack 3, win 1004, options [nop,nop,TS val 3247192772 ecr 2039885450], length 7240
00:12:33.625706 IP 192.168.1.74.58234 > 192.168.1.45.5005: Flags [.], seq 2379069:2402237, ack 3, win 1004, options [nop,nop,TS val 3247192772 ecr 2039885450], length 23168
00:12:33.625752 IP 192.168.1.74.58234 > 192.168.1.45.5005: Flags [.], seq 2402237:2429749, ack 3, win 1004, options [nop,nop,TS val 3247192772 ecr 2039885450], length 27512
00:12:33.625782 IP 192.168.1.74.58234 > 192.168.1.45.5005: Flags [P.], seq 2429749:2444229, ack 3, win 1004, options [nop,nop,TS val 3247192772 ecr 2039885450], length 14480
00:12:33.625799 IP 192.168.1.74.58234 > 192.168.1.45.5005: Flags [.], seq 2444229:2458709, ack 3, win 1004, options [nop,nop,TS val 3247192772 ecr 2039885450], length 14480
00:12:33.625834 IP 192.168.1.74.58234 > 192.168.1.45.5005: Flags [.], seq 2458709:2480429, ack 3, win 1004, options [nop,nop,TS val 3247192772 ecr 2039885450], length 21720
00:12:33.625869 IP 192.168.1.74.58234 > 192.168.1.45.5005: Flags [.], seq 2480429:2500701, ack 3, win 1004, options [nop,nop,TS val 3247192772 ecr 2039885450], length 20272
00:12:33.625899 IP 192.168.1.74.58234 > 192.168.1.45.5005: Flags [P.], seq 2500701:2509389, ack 3, win 1004, options [nop,nop,TS val 3247192772 ecr 2039885450], length 8688
00:12:33.625900 IP 192.168.1.74.58234 > 192.168.1.45.5005: Flags [P.], seq 2509389:2513733, ack 3, win 1004, options [nop,nop,TS val 3247192772 ecr 2039885450], length 4344
00:12:33.625911 IP 192.168.1.74.58234 > 192.168.1.45.5005: Flags [P.], seq 2513733:2526765, ack 3, win 1004, options [nop,nop,TS val 3247192772 ecr 2039885451], length 13032
00:12:33.625918 IP 192.168.1.74.58234 > 192.168.1.45.5005: Flags [R.], seq 2526765, ack 3, win 1004, options [nop,nop,TS val 3247192772 ecr 2039885451], length 0

287 packets captured
287 packets received by filter
0 packets dropped by kernel
